,title,category
885, 재고 없는데 긴급지침 무슨 소용  요소수에 애타는 화물 노동자들 종합 ,Social
886, 백신 인과성 불충분  심근염 심낭염 환자에 의료비 지원,Social
887,화이자 부스터샷 접종 후 사망신고  건   국내 첫 사례,Social
888,고흥 풍양면장  이장에게 폭행당해 파문,Social
889,정은경  일상회복  단계 전환 어려울수도 방역조치 강화 가능  종합 ,Social
890,세계유산  장릉  경관 망친 인천 아파트   개층 들어내거나   m 길이 나무 심거나,Social
891,제주  내년 농민수당  인당   만원 지급대상  만 천명,Social
892,검찰   대변인 폰 압수  대검 감찰과장 고발건 수사 착수,Social
893,노량진 고시원서 흉기 휘두른   대 긴급체포  소음 때문에 ,Social
894, 단독  까뭉개진   세기  임진왜란 유적  발뺌하는 남해군,Social
895,군비증강 위해  최선의 노력  다하는 문재인 정부,Social
896,종근당 장남  성관계 촬영 유포   심도 유죄,Social
897,  시간 줄서서  통 샀어요  인천 요소수 판매 주유소 북새통,Social
898,전두환 며느리  연희동 별채 공매 무효소송   심서도 패소,Social
899,검찰   주가조작  의혹 도이치모터스 권오수 회장 재조사,Social
900,전직 의원 곽상도  소환  순위 거론     대장동 로비 수사  급물살 타나,Social
901, 여야가 한 통속 되어 반대도 없이 짧은 시간에 처리 ,Social
902,부산시  택시호출 공공앱  동백택시  내달 출범,Social
903,화이자 백신 부스터샷   대 여성 사망 정부  인과성 조사  종합 ,Social
904,기획사 잠입해 아이돌 멤버 추행한 여성 검찰 송치,Social
905, 재고 없는데 긴급지침 무슨 소용  요소수에 애타는 화물 노동자들 종합 ,Social
906, 백신 인과성 불충분  심근염 심낭염 환자에 의료비 지원,Social
907,화이자 부스터샷 접종 후 사망신고  건   국내 첫 사례,Social
908,고흥 풍양면장  이장에게 폭행당해 파문,Social
909,경력단절여성법 전부개정안 국회 본회의 통과 내년  월 시행,Social
910,윤석열  노무현 전 대통령 묘역 참배  다정한 서민의 대통령 보고 싶습니다 ,Social
911, 동의 없이 규칙 개정  양승동 KBS 사장   심서 혐의 부인,Social
912,선관위   이재명 집무실 조폭 사진  공개한 시민단체 대표 고발,Social
913, 땅 투기 의혹  기성용 아버지  사문서 위조 인정,Social
914,의료연대  간호사  덕분에 가 아닌 인력충원 해달라     명   집회,Social
915,대선후보 이재명의  메타버스  전국 순회 첫 도착지는 울산,Social
916,검찰   도이치모터스 주가조작 의혹  권오수 회장 재소환 영장청구 방침,Social
917, 생리대 실험  김만구 교수  유해 물질 검출은 명백한 진실 ,Social
918,수능생은 두문불출 스터디카페는 썰렁  선물은 비대면으로,Social
919,위중증 환자 역대 최다  더는 못 버텨  거리에 선 의료인들,Social
920,백신 추가접종 후 첫 사망사례 나와 당국  인과성 조사 예정 ,Social
921,대장동 의혹  시간싸움  중 자리비운  총장 팀장  윗선 수사  산으로,Social
922,내년  월 일  게임 셧다운제  폐지 게임시간  가정 자율 선택,Social
923, MBN 프레스룸  헌화 막힌    입구서 사과,Social
924, 리뷰 약속  월    만원 들여 커피 서비스  먹튀는 사기 아닌가요 ,Social
925, 항소심 무죄  논란의 레깅스 불법촬영  벌금형 확정,Social
926, MBN 프레스룸    vs    불붙은 특검전쟁 ,Social
927, 불법촬영 유포  혐의 종근당 회장 장남   심도 집행유예,Social
928,내년부터 연간  조원 지방에 쏟는다 인구감소지역에 집중 배분,Social
929, 셧다운제  폐지   내년부터 자정 넘어도 PC게임 할 수 있다,Social
930,임산부석 앉은 학생에 호통 친 할아버지    꼰대  vs  왜 앉았냐 ,Social
931,화성시 카이스트 롯데백화점  K 반도체 이끌 핵심인력 기른다,Social
932, 카카오T 독주 막자  부산  동백택시  내달 공식 출범  종합 ,Social
933, 예산에 환경오염시설 추진 도미노 농촌이 도시의 식민지인가 ,Social
934, 나눔도 일상회복 중   위드코로나 로 활기 찾은 봉사현장,Social
935, 성관계 영상 유포  종근당 장남  심도 집행유예,Social
936,군 간부에 군사기밀 불법 수집한 방산업체 대표 집행유예,Social
937, 백종원 볼카츠  논란에 입 연 연돈 사장  좋은 취지  정말 신난다 ,Social
938,검찰  수사기밀 누설  광주 경찰관 추가 기소,Social
939,위중증 환자    명  역대 최다   위드 코로나  빨간불,Social
940,    대변인 공용폰 압수  대검 감찰과장 고발 사건 수사 착수,Social
941,마취총 쏴 구조 유기 동물    가  쇼크사  안락사 약품 사용 금지된다,Social
942,어린이 못 보는 오징어게임을  아동 대통령 선거  포스터에 ,Social
943,부스터샷 접종 후 사망사례 첫 신고 인과성은 미확인 종합 ,Social
944,경기선관위   이재명 조폭 연루설  주장한 시민단체 고발,Social
945,전두환 며느리  연희동 별채 공매 무효 소송  심도 패소,Social
946,의료연대 결의대회    격려에도 지난  년간 의료현장은 제자리 ,Social
947, 전세 연장하고 이혼 위기   청와대로 간 무주택자들,Social
948, 턱스크  한 채 손에는  담배    마스크 써달라  요구에 커피 던진   대,Social
949,  세 이상 부스터샷 당길 듯  전문가회의 공감대  내주 발표,Social
950,기관총 관련 군사기밀 수집하려 군에 돈 뿌린 방산업자들,Social
951,대구 앞산 모노레일  실시설계  진행   년   월 공사 완료,Social
952, 유격장 부실급식  제보의 반전 군  자율배식이었다 ,Social
953,BJ들 찾아가 흉기 난동   대에 항소심도 살인미수 인정,Social
954, 기사 나면 어떡해   불법 도박장  개그맨 김형인 무죄  검찰 항소,Social
955, MBN 프레스룸   뜨거워서  수프 테러,Social
956,오늘부터 차량용 요소수    만  생산한다,Social
957,이웃집 몰래 들어가 용변 보고 침 뱉고   대 남성  심 실형,Social
958,풍년의 역설 쌀값 하락에 과잉 물량  시장격리  요구,Social
959,검찰총장 돌연 연차  법무 장관은 방패  커지는 편파 수사 논란,Social
960, 대변인폰 압수  고발 사건  서울중앙 반부패 부 배당,Social
961,면허도 없이 음주운전에 목격자 폭행한   대 검거,Social
962,기성용 아버지 아들 몰래 사문서위조 인정,Social
963, 부스터샷  국내 첫 사망 신고 화이자 접종   대 여성,Social
964,경기선관위   이재명 조폭 연루설  주장한 시민단체 고발,Social
965,전두환 며느리  연희동 별채 공매 무효 소송  심도 패소,Social
966,의료연대 결의대회    격려에도 지난  년간 의료현장은 제자리 ,Social
967,방대본  미접종자 중심 감염 확산   독일과 유사한 상황 발생 가능 ,Social
968,내일부터  부스터샷 도 네이버 카카오 앱 통해 당일예약 가능,Social
969,육군 특수전 기관단총 사업 기밀 수집 방위업체 직원   집행유예 선고,Social
970, 현직 의원 수사  부담 던 검찰  이르면 주말께 곽상도 소환,Social
971,아이 재운다며 눌러 숨지게 한 어린이집 원장 징역  년,Social
972,서울시   안심소득  내년부터 시범실시   저소득    가구 대상  소득 적을수록 많이 지원 ,Social
973, 정부 믿고 전세 연장했다가 이혼 위기  무주택자들   앞 시위,Social
974, MBN 프레스룸  후진하는 트럭에 ,Social
975,조희연  청소년 백신 접종  자율 원칙이나 전향적 판단해달라  종합 ,Social
976,충남공무원노조  강제 동원 개선 없으면 투 개표 사무 거부  영상 ,Social
977,MB국정원의 PD수첩 죽이기  부숴버리고   종북세력 수괴 제거 ,Social
978,해운대구도 재난지원금  만 원 지급   일상 회복에 도움 되길 ,Social
979,무면허 음주운전 중 사고 내자 목격자 폭행까지   대 검거,Social
980,    대변인폰 압수  대검 감찰부 사건 수사 착수,Social
981,당뇨환자   년간       증가 심혈관질환 위험  배 높아,Social
982,중앙지검   대변인폰 압수  감찰과장 고발사건 반부패부 배당,Social
983,검찰   김건희 주가조작 연루 의혹  권오수 도이치모터스 회장 재소환,Social
984, 시끄럽다  고시원 이웃에게 흉기 휘두른   대  체포,Social
985,천재교육 vs 아이스크림미디어  초등 교과서  등 ,Social
986, 자율주행 특허전쟁 서막 완성차 IT 부품기업 기술확보 치열한  파전,Social
987,조희연  위드 코로나 비상계획 발동되면 초중고 전면등교도 중단 ,Social
988,국민의힘 홍석준 의원  구사일생  의원직 유지,Social
989, MBN 프레스룸  임창정  미접종 확진  논란,Social
990, 뇌물수수  김연창 전 대구 부시장  대법 징역  년 확정 종합 ,Social
991,   년 미뤄온 차별금지법 심사 또 미뤄 보수 기독교에 여야 굴복 ,Social
992,생태 평화체험 명소  DMZ 평화의 길    일부터 다시 열린다,Social
993, 예타 면제해 주오  울산건강연대  울산의료원 설립 예타 면제 촉구,Social
994,미접종은 죄인일까  김흥국 임창정이 기름부은  백신거부  논란,Social
995,       목  코로나   종합  신규 확진     명 위중증 환자    명 또  최다 ,Social
996,  대 여성  화이자 부스터샷 맞은 후 사망 국내 첫 사례,Social
997, Pick  유명 가수  구급차 타고 청주 남양주  연예인 택시  논란,Social
998, 정 변호사의 현장일지   년 전 빌려준  비트코인  얼마 받을 수 있나 ,Social
999,제주 지역화폐 활용 온라인 카지노 도입   큰 논란 예상 ,Social
