,title,category
294,후진중 초등생 깔고 간 트럭기사  뺑소니 적용 어렵다  왜  영상 ,Social
295, 폭행 당했다  국회의원 비서관  경찰에 신고 당해,Social
296, 내일     명대 예상   오후  시까지 부산 제외  전국     명 확진,Social
297,안 줄어드는 신규 확진     명    명     일     명대 예상,Social
298, 오토바이 친뒤 뺑소니  김흥국  벌금    만원,Social
299, 성관계 영상 유포  종근당 장남  심도 집행유예,Social
300,도청사 이전 신축부지 두고 날선 언쟁,Social
301,요소수 재고  일주일도 못 버텨  긴급 물량 배정 요청 ,Social
302,위드코로나 후 첫 집단감염 수능 방역  비상 ,Social
303,노량진 거리에 피  뚝뚝   고시원 소음 때문에 흉기 휘둘렀다,Social
304,박범계   공소권 남용  유우성 사건 검사들 조사 조치 필요 ,Social
305,최저임금 올라도 시급은     원   열정페이  강요받는 미용 스태프,Social
306, 줌인 주지훈 전지현의 지리산 해동분소가 북한산에 있는 이유,Social
307,광주시      억 지방채 발행 없이  일상회복지원금  지급 또 논란 종합 ,Social
308,오한아 서울시의원  서울시향 허술한 계약 관리  철저히 감사해야 ,Social
309,아이 치고 명함만 주고 떠난 트럭 한문철  뺑소니는 아냐 ,Social
310,오토바이 기대 담배 피우다  쿵   수리비만    만원   영상 ,Social
311,  이재명 조폭설  주장 박철민  이준석에 전화했다가  줄빠따  맞았다 ,Social
312,포항서 코로나   확진자  명 발생,Social
313,초등생 치고 명함만 주고간 트럭  한문철의 진단은 ,Social
314,정은경  위드코로나  단계 전환 늦추거나 방역 강화할 수도 ,Social
315, 변호사가 돈 못 갚으면 장기 팔아라 감금 협박  경찰 수사착수,Social
316,김만배 남욱 구속기간 연장 곽상도 소환조사 임박,Social
317, 고립을 막아라  기습폭설 대비 합동 훈련,Social
318, 깐부  맺고 출장 성매매 사이트   곳 운영 적발   경찰   문의 전화   만 건 추적,Social
319,   개월 아이 눌러 질식사    어린이집 원장 징역  년,Social
320,내일부터 부스터샷도 네이버 카카오 SNS 당일예약,Social
321,화이자 부스터샷 접종 후 사망신고  건   국내 첫 사례,Social
322,수능 D     전국 고등학교 원격수업 전환,Social
323,노량진 거리에 피  뚝뚝   고시원 소음 때문에 흉기 휘둘렀다,Social
324,박범계   공소권 남용  유우성 사건 검사들 조사 조치 필요 ,Social
325, 따놓은 당상  총기 입찰 사업   군사정보 유출 유죄 ,Social
326,수능 D    고등학교 원격수업 전환,Social
327, 차 빼주세요    대 주차관리원 말에 격분 야구방망이 휘둘렀다,Social
328,버리고  뿌리고 장성 대형 종이 공장 폐수 관리  엉망 ,Social
329, 대장동 특검  도입해도  대선 전 결론 은 미지수,Social
330,송도근 사천시장직  상실  부시장 대행 체제,Social
331,임신한 아내 두고 남녀  대   동호회 나간다는 남편 못 가게 하자 이혼 요구,Social
332, D라 누가하냐고   정년 보장되고 안정적  환경미화원 경쟁률     ,Social
333, 아이 서울 유  있지만  공정도시 서울  활용 준비 끝,Social
334,오후  시까지 전국서  천   명 확진   일  천   명대 예상 종합 ,Social
335,검찰     의원  곽상도 소환 임박   김만배 남욱 구속 연장,Social
336, 뺑소니 혐의  김흥국  심 벌금형    죄질 안 좋지만 범행 반성해 ,Social
337,이륜차 법규 위반 집중단속  무관용 원칙  적용,Social
338,  개월 여아  학대치사  어린이집 원장 징역  년  엄벌 필요 ,Social
339, 뉴스나이트  정은경  일상회복  단계 전환 어려울수도      월 초가 고비,Social
340,김미경 은평구청장  김헌동 SH 사장 후보 혁신파크 부지 공공주택 공급 계획  반발,Social
341,미 외교관 차량  서울 도심에서 뺑소니   경찰 조사 불응한 채 미군기지로,Social
342,군용 요소수 민간 공급 시작   수백미터 대기 행렬,Social
343,인천서 국회의원 비서관 폭행 혐의로 신고 당해,Social
344,광주 요양병원서 또 집단 돌파감염 추가 접종  속도 ,Social
345, 대장동 의혹  김만배 남욱 구속 기간 연장  검찰  혐의 입증에 주력,Social
346, 주식리딩방  피해자   명 중  명   대가 웁니다,Social
347,조희연  선 출마 염두 정책  서울시교육청  모든 중학생에게 스마트기기 보급,Social
348, 제보   코인 투자 고수익  미끼 오픈채팅 가짜 웹사이트 사기 속출,Social
349, 원주국립과학관  중투 또 부결  정부 사업인데  ,Social
350,가정집 모텔 출장 성매매 성매수자 연락처만  만 건,Social
351, 신동욱 앵커의 시선  어미낙타의 눈물,Social
352,수능 D    지역 고교 원격수업 전환 학원 특별 비상방역,Social
353,요소수 주유소에서만 살 수 있다 승용차      화물차    까지,Social
354,ASF 멧돼지 포획 트랩 규격 미달품 또 적발  지방계약법 위반 ,Social
355, 크랩   내 뱃살 좀 사갔으면   그런데 그것이 실제로 일어났습니다    ,Social
356,구급차 타고 공연장 간 가수  연예인 택시  논란,Social
357,인천서 행인  폭행당했다  국회의원 비서관 신고,Social
358, 백운기의 뉴스와이드  윤석열 광주행   이재명  대장동 수사 미진하면 특검 ,Social
359,곽상도 사직안 국회 통과  대장동 로비 의혹  검찰 소환 임박,Social
360,일상회복 보름도 안 돼서  이대로면  단계 어려워 ,Social
361,위기가정 발굴 허점 노출  보완책 절실,Social
362,  외교관  접촉사고 뒤 도주 대사관  보도 동의 안해 ,Social
363,위중증    명 역대 최다    비상계획 검토 아직 일러 ,Social
364,오후  시 부산 제외 전국     명 확진 전날 동시간   명  종합  ,Social
365, 수능방역  앞두고 교실 비우라는데  스터디카페 학원 자습실 떠도는 고 ,Social
366, 오토바이 뺑소니  가수 김흥국   심서 벌금    만원 선고,Social
367, 뺑소니 혐의  김흥국   심에서 벌금    만원 선고,Social
368,소상공인 상대 연 이자          억 뜯은 대부업체,Social
369, 가방 분실  신고했다가 주머니 속 마약이 툭   대 구속,Social
370, 백운기의 뉴스와이드   컨벤션 효과  속 선대위 갈등 윤석열 승리 조건은 ,Social
371,가정집 파고 든 출장 성매매  업주 연합 으로 단속 피해,Social
372,감쪽같은  암행순찰차  동행해보니  시간만에   건 적발,Social
373, 아들 퇴직금   억  곽상도 사직안 국회 가결 다음 주쯤   소환,Social
374,  외교관    택시 추돌후 미군부대 도주 경찰조사도 불응,Social
375, 따져보니  위중증    명 또  최다       명 감당 가능  ,Social
376,줄지 않는 확진자수 정은경  일상회복  단계 못갈수도 ,Social
377,소아 청소년 접종률    대 예상 심근염 심낭염 의료비 지원,Social
378,만취한채 운전대 잡은 영주시 간부 공무원  명 음주운전 적발,Social
379, 오토바이 뺑소니  김흥국   심서 벌금    만원,Social
380,개그맨 강성범  윤석열  대선 이기면 이 나라는 박살 날 것 ,Social
381, 일방적인 서울시정  의회와 협치 나서야 ,Social
382,공수처     장모 문건  의혹 수사  먼지털이식 수사  논란,Social
383,위중증 환자 최고치 경신  방역조치 강화할 수도 ,Social
384, 돈 없다  버티는 악덕 고용주 끝나지 않은 염전노예 비극,Social
385, 변호사비 대납 의혹  S사  왜 이 시기에 자료 PC 파쇄했나,Social
386, 단독  S사   변호사비 대납 의혹 사건  배당 직전 증거인멸 정황,Social
387, 오토바이 사고 뺑소니  가수 김흥국 씨   심서 벌금    만 원,Social
388, 대장동 특검  도입해도  대선 전 결론 은 미지수,Social
389, 차 빼달라 고 한   대 주차관리원 방망이로 위협한 남성,Social
390,KBS  더 유닛  순위 오류  방통심의위 의견진술,Social
391,가방 분실 신고했다가    옷 호주머니서 마약  툭     대 구속,Social
392, 단독  고립된 그 섬엔  여전히  염전 노예 가 살고 있다,Social
393,군용 요소수 민간 공급 시작   수백미터 대기 행렬,Social
394, 단독   직장내 괴롭힘 논란  엔씨  관련자  명 징계,Social
395,민주노총        권위적  수직적 노조 조직 문화 바뀌어야 ,Social
396,창원시    차 창원형 재난지원금  지급   억    만원 규모,Social
397, 차 빼달라 했다 고   대 주차관리원 야구방망이로 위협,Social
398,이재용 향한 골드만삭스 조언은  단순 마케팅 인가,Social
399,공수처가 문제삼은 손준성의  사건검색   대법원은 무죄로 봤다,Social
400, 단독  김부겸 총리    명 점심식사 참석 방역수칙 위반  반성한다 ,Social
401,정은경  현 상황  일상회복  단계 어려워 방역 강화 가능성 있어 ,Social
402,혐오 표현 방치하는 네이버     허울뿐인 댓글 신고제도 ,Social
403,위중증 환자 최고치 경신  방역조치 강화할 수도 ,Social
404,개그맨 강성범  윤석열씨가 대선 이기면 나라 박살날 것 ,Social
405,신호 위반해 오토바이 치고 도주한 김흥국   심서 벌금    만원,Social
406,오토바이 사고  뺑소니 논란  김흥국   심서 벌금    만원,Social
407,검찰 경찰개혁 시즌   검사장 직선제 도입해야 ,Social
408, 김주하의  그런데   중국이 원자재 수출 중단하면 ,Social
409, 단독   월    수익  미끼  천 억 유치 석 달 뒤  잠적 ,Social
410,요즘  금배추 라는데 병충해 냉해 덮쳐 농가는  울상 ,Social
411, 연        이자 뜯어내 호화생활 불법 대부조직 검거,Social
412,불법 현수막 골라 난도질   대 남성 검거,Social
413,가정집까지 노렸다 수도권 최대 출장 성매매 조직 적발,Social
414,승용차 같은  암행순찰차  신호위반 불법 유턴 잡아낸다,Social
415,타인 명예훼손 의혹 현직 경찰  검찰서 무혐의 처분,Social
416, 위드 코로나  이후 중환자 사망자   일상회복  단계 가능 ,Social
417,봉하마을 찾은 윤석열  노무현  국민 사랑 가장 많이 받으신 분 ,Social
418, 일상회복  단계로 못 갈 수도  부스터샷 접종 후 국내 첫 사망 신고,Social
419,아파트 계약자 개인정보 부동산으로 줄줄  대방건설 직원 소행 ,Social
420,면책특권 믿었나   외교관  택시 추돌 후 도주 경찰 조사 거부,Social
421,김충회 소장  하늘만 쳐다보고 농사짓는 사람들 맘껏 먹고 살 수 있게 해주고 싶어 ,Social
422,무참히 찢겨버린 동심    남의 놀이터에 오면 도둑 돼   제보영상 ,Social
423, 오토바이 치고 뺑소니  김흥국   심서 벌금    만원,Social
424,연리       로  초호화 생활  서민 울린 사채업자,Social
425, 오토바이 치고 뺑소니  김흥국   심서 벌금    만원,Social
426,주한 미 외교관  택시 추돌 후 도주 경찰도 속수무책,Social
427,번호판 없는 오토바이 사고내도 도망가면 못잡아 ,Social
428,이자가 원금의   배  서민 등쳐 고급차에 요트까지 초호화생활,Social
429,  외교관 일행 기지 안으로 뺑소니 조사도 거부 ,Social
430,기성용    아들 몰래 내가 했다   사문서 위조  인정,Social
431, 가정집에도 갑니다    개 사이트로 출장 성매매   만 명 적발,Social
432,후진하던 화물차에 초등생 깔릴 뻔 명함만 주고 간 기사,Social
433,오토바이 사고  뺑소니 논란  가수 김흥국  심서 벌금형,Social
434,      억 클럽  정조준 곽상도 소환 임박 관측,Social
435, 픽뉴스   달랑 명함만 주고 갔다    한국의 미소       년  드론택시  뜬다   테슬라 대항마    억  천만원 배구공,Social
436, 뉴있저   대검 대변인    장모 문건 설명    휴대전화 임의제출 공방,Social
437,미국대사관 차량  택시 추돌 뒤 도주 경찰 조사도 거부,Social
438, 이재명 조폭 연루설  주장 박철민 만나보니 김진태  냄새가 난다 ,Social
439,주식리딩방 피해 급증 환급 후 위약금도 문제,Social
440,줄어드는 신생아  입맛  잡으려  남양 매일  리베이트 살포,Social
441,앞에선  시민 감시단  뒤로는  출장 성매매  알선,Social
442, 단독  해결사 된 변호사  지인 채무자에  장기 팔아 갚아라  협박,Social
443,미국 외교관  택시 접촉 사고 뒤 도주 경찰 조사도 거부,Social
444,고급 아파트에 사무실 소상공인 상대  천  살인 이자,Social
445,미 외교관 차량  서울 도심에서 뺑소니   경찰 조사 불응한 채 미군기지로,Social
446,  대도 돌파감염 속출  추가접종 간격 한 달 단축 검토 ,Social
447,골드만 측  이재용  삼성생명 매각 논의에 관심 없어 보였다 ,Social
448,공수처  윤석열 장모 문건  손준성 지휘 수정관실서 작성  의심,Social
449,신호위반뒤 오토바이 뺑소니 김흥국  심 벌금    만원,Social
450, 가방 잃어버렸어요  신고한   대 주머니서 마약이  툭 ,Social
451,위중증 환자  또  역대 최다   아직 비상상황은 아냐 ,Social
452, 단독   주차금지 구역  차 빼 달라고 하자 야구 방망이 꺼내 위협,Social
453, 팩트맨 어린이집 종교수업은 아동학대 ,Social
454, 아들   억  곽상도 의원직 상실 검찰 소환 임박,Social
455, 뺑소니 혐의  가수 김흥국  벌금    만원,Social
456,조희연  비상계획 발동되면 전면등교도 중단     억 방역예산 투입,Social
457,진중권     반듯이  문제없어 이재명 캠프 후져 ,Social
458, 윤 장모 대응 문건  손준성 영장엔  상급자가 지시 ,Social
459,요소수  긴급수급조정조치  시행 주유소 협회  현장 상당히 혼란 ,Social
460,성매매  시민감시단원  알고 보니 경쟁업소 신고한 업주,Social
461, 날씨 내일 이번 추위 절정 주말부터 추위 누그러져,Social
462,  대 여성  부스터샷  맞은 후 사망   국내 첫 신고 접수,Social
463,미국 외교관  택시 접촉 사고 뒤 도주 경찰 조사도 거부,Social
464,고급 아파트에 사무실 소상공인 상대  천  살인 이자,Social
465,미 외교관 차량  서울 도심에서 뺑소니   경찰 조사 불응한 채 미군기지로,Social
466,  대도 돌파감염 속출  추가접종 간격 한 달 단축 검토 ,Social
467,골드만 측  이재용  삼성생명 매각 논의에 관심 없어 보였다 ,Social
468,공수처  윤석열 장모 문건  손준성 지휘 수정관실서 작성  의심,Social
469,신호위반뒤 오토바이 뺑소니 김흥국  심 벌금    만원,Social
470, 가방 잃어버렸어요  신고한   대 주머니서 마약이  툭 ,Social
471,위중증 환자  또  역대 최다   아직 비상상황은 아냐 ,Social
472, 단독   주차금지 구역  차 빼 달라고 하자 야구 방망이 꺼내 위협,Social
473, 팩트맨 어린이집 종교수업은 아동학대 ,Social
474, 아들   억  곽상도 의원직 상실 검찰 소환 임박,Social
475, 뺑소니 혐의  가수 김흥국  벌금    만원,Social
476,  m가 어느 정도야    김포  왕릉뷰  아파트 소식에   관우상 소환된 까닭,Social
477, 일제강점기는 한국 성장의 기반  성균관대 동아리 웹진 글 논란,Social
478,   살 생신에야 처음으로  사랑합니다  고백하네요 ,Social
479,  대사관 차량  택시 충돌 뒤 용산 미군 기지로 도주,Social
480,주유소에서 승용차    까지 정부가 요소수 유통 관리,Social
481,경찰 연락처 거르는 앱까지 만들어   만 명 성매매 ,Social
482, 대장동 개발 의혹  김만배 남욱 구속기간 열흘 연장,Social
483,반기문  원전 없는 탄소중립 불가론  에 환경단체들  무책임  비판,Social
484, 주진우 라이브  손영래  먹는 코로나 치료제  효과만 좋다면 다른 나라와 동일하게 쓸 수 있도록 도입 서두를 것 ,Social
485,일상회복  단계  걸림돌  위중증 환자 급증세,Social
486,가덕도신공항  보상 노린  신축 붐  건축 허가 개발 행위 제한 나선다,Social
487, 컨테이너 차에만 요소수 팝니다  일부 화물차 강력 반발,Social
488,재택 치료자 증가 현장의 목소리는 ,Social
489, 연인으로 새로 태어난    년차 신혼부부  자랑스러워요 ,Social
490, 단독   땅 투자하면 월    수익   천억 원대 사기,Social
491,김만배 남욱 구속기간 열흘 연장   일 기소,Social
492,기성용 아버지  아들 몰래 내가 했다   사문서 위조  인정,Social
493,가정집 모텔 출장 성매매 성매수자 연락처만  만 건,Social
494, 코인 투자 고수익  미끼 오픈채팅 가짜 웹사이트 사기 속출,Social
495, 단독 검사도 않고  음성  허위 보고 결국 집단감염,Social
496,서울 남은 병상   개뿐 일상회복  단계 불투명,Social
497, 조단위  부산 재개발  잇단 소송전에 몸살,Social
498, 단독   하루   명 사망 예측 현재 방역 유효  하루  ,Social
499,중앙고속  확장 TK신공항 가는 길  씽씽 ,Social
500,국민의힘 홈페이지 마비  시스템 점검중  왜 ,Social
501,  시간 기다려 넣었다  컨테이너 차량에만 판매해 소동도,Social
502, 대장동 개발 의혹  김만배 남욱 구속기간 열흘 연장,Social
503,반기문  원전 없는 탄소중립 불가론  에 환경단체들  무책임  비판,Social
504, 주진우 라이브  손영래  먹는 코로나 치료제  효과만 좋다면 다른 나라와 동일하게 쓸 수 있도록 도입 서두를 것 ,Social
505,일상회복  단계  걸림돌  위중증 환자 급증세,Social
506,암호화폐 지갑  카이카스  대규모 해킹 피해    억원 중국 옮겨져,Social
507,소상공인에 연  천  이자 호화 생활 대부업자 덜미,Social
508,광주 요양병원서 또 집단 돌파감염 추가 접종  속도 ,Social
509,무면허 음주운전 사고 목격자 폭행   대 검거,Social
510,    도이치모터스 주가조작 의혹  권오수 회장 재소환,Social
511, 비디오머그    혈압주의   갑질 오브 갑질  제 직책은 사원일까요  식모일까요 ,Social
512,  외교관  접촉사고 뒤 도주 대사관  보도 동의 안해 ,Social
513, 뉴있저  취재진 보자마자 문 닫은 곽상도     억 원 클럽 본격 조사 ,Social
514,가방 분실 신고한   대   주머니서 필로폰이  툭  현행범 체포,Social
515,정부과천청사서 방위사업청 직원  명  얀센 돌파감염 ,Social
516,공수처  손준성 혐의 다지기 판사사찰 의혹도 수사,Social
517, 여기는 원주   원주국립과학관  중투 또 부결  정부 사업인데  ,Social
518,하후상박  오세훈 안심소득      년 첫 실험,Social
519, 성관계 영상 유포  종근당 회장 장남  심도 집유,Social
520,   억 땅  기성용 부친  아들 몰래 사문서 위조  재판서 인정,Social
521,하늘 나는  드론택시  김포공항서 비행 시연      년 상용화 목표 ,Social
522, 게임 셧다운제    년 만의 폐지 내년  월  일 적용,Social
523, n번방  만든 문형욱 대법  징역   년 확정,Social
524,위중증 환자 또 최다  정은경  일상회복  단계 못 갈 수도 ,Social
525, SNS핫피플  머스크  테슬라 주식   억 달러어치 진짜 팔았다  ,Social
526,MBN 뉴스파이터  음주vs초보  발언  오월 정신 반듯이  방명록 논란 등,Social
527,위중증    명 최다 경신  비상계획 단계 아니지만 방역 강화할 수도 ,Social
528,ASF 멧돼지 포획 트랩 규격 미달품 또 적발  지방계약법 위반 ,Social
529,시의회 민주당  김헌동 부적격 이어 이창근 대변인 총공세,Social
530,기성용 아버지  아들 모르게  사문서 위조  인정했다,Social
531,  시간 줄 서서  통 샀다   대체 왜 트레일러만 주나  군 비축 요소수 공급 현장 가 보니,Social
532, 아들 퇴직금   억  곽상도 사직안 국회 가결 다음 주쯤   소환,Social
533, 김학의 뇌물  증언 회유 압박 있었나 법원  증인 재소환 종합 ,Social
534, 영상  아들   억 퇴직금  곽상도  의원직 상실   소환 임박,Social
535,생후   개월 아이 재운다며 질식사 시킨 어린이집 원장  징역  년 ,Social
536, 부스타 로또  등 당첨만   번  전국 최고 명당의 비밀 파헤치고 왔습니다,Social
537,   F  상장 첫날  GM 포드  제쳤다     제 의 테슬라  리비안  증시 데뷔 성공적 ,Social
538, 한동훈 독직폭행  정진웅  심도 무죄 주장  수사관 증인신청,Social
539,코로나 침입해도 음성   감염 후 복제 차단  사례 보고,Social
540,수능 D    지역 고교 원격수업 전환 학원 특별 비상방역,Social
541,가방 분실 신고자 옷에서 흰 가루 든 봉지가 툭 마약 투약   대 남성 구속,Social
542,  개월 여아  학대치사  어린이집 원장 징역  년  엄벌 필요 ,Social
543, n번방  만든 문형욱 대법  징역   년 확정,Social
544,한강 수중감시장비  년 소송 김포시  삼성SDS에 승소 확정,Social
545,부산에서 울산까지    분  광역철도 초석 정차역 신설 리스크 없앤다,Social
546,광주 서구 모 요양병원 관련   명 확진   환자   명 종사자  명,Social
547,위중증 또 최다     명 육박   새달 일상회복  단계 못 갈 수도 ,Social
548,재개발 구역 불법 분양권 쪼개기에  철퇴 ,Social
549,정은경의 고민  확진자 수는 예상범위 안이지만    ,Social
550,공수처  판사사찰 문건  관련 윤석열 이어 손준성도 입건,Social
551,MBN 뉴스파이터  살아남은 것이 기적  도로 위 날벼락,Social
552,무면허 음주운전에 목격자 폭행  도주까지   대   검거,Social
553,공수처   판사사찰 문건  의혹에 윤석열 이어 손준성 입건,Social
554,백신안전성위  내일 오전 발족  이상반응 보상 확대  종합 보 ,Social
555,오후  시기준 확진자    명   지난주보다    명 적어,Social
556, 문화 관광 체육 비빔밥     메타버스 오징어게임 도 가능할까,Social
557, 독직폭행  정진웅   수사관  명 증인신청  증거인멸 염려 설명 ,Social
558,오후  시 부산 제외 전국     명 확진 한 주 전보다   명 ,Social
559,위중증 최다치에  병상 관리 전국 통합      수도권 중환자 지방으로 보내나,Social
560,위드 코로나 도래했지만 아직은 비대면  대학들의 속사정,Social
561, 제로웨이  빼빼로데이라고 쓰레기 막 만들어도 되나요 ,Social
562,MBN 뉴스파이터   남의 놀이터에서 놀면 도둑  주거침입죄 성립하나 ,Social
563,공사 현장서   대 동료 망치로 때린   대 중국인  집행유예,Social
564,위중증 최다 기록 정은경  일상회복  단계 전환 어려울 듯 ,Social
565, 걷기 싫어서  배달 오토바이 훔쳐 무면허 운전한 중학생,Social
566, 수출입 차는 주고 내수 차는 왜 안줘    요소수 공급 주유소  혼란 ,Social
567,검찰    장모 모해위증 사건  고소인 제출 증거 불충분 ,Social
568, 가방 분실했어요  경찰에 신고하다 품에서 마약 떨어뜨린   대 남성,Social
569,기획사 몰래 잠입해 남자 아이돌 성추행한 여성  검찰 송치,Social
570,목포찾은 윤석열  DJ정신 제대로 배우면 나라도 제대로 갈 것 확신 ,Social
571,유한기  지인에   억 뇌물  난 깨끗하다  알잖느냐 ,Social
572,내년  반값 아파트  가능할까 오세훈 김헌동  자치구 장벽 넘어야,Social
573,최고  천  이자 뜯어 호화생활한 불법 대부업체 적발,Social
574,주한 미국 외교관의 뺑소니  택시 접촉사고 내고 현장 떠나,Social
575,광주서 요양병원발  명 등  명 확진 대부분 돌파 감염 종합 ,Social
576,   개월 아이 눌러 질식사    어린이집 원장 징역  년,Social
577,미국 외교관들 서울 도심에서 뺑소니    경찰 조사 거부 ,Social
578,서울 중증병상  곳 중  곳이 찼다  일상회복  구름 ,Social
579,위중증 환자 연일 최다  정은경  일상회복  단계 못갈 수도 있다 ,Social
580, 속보   경남   대구  명  오후  시까지 부산 제외 전국     명 확진,Social
581,일주일 앞으로 다가온 수능 의사가 전하는 최상의 건강관리 수칙,Social
582,기획사 사옥 몰래 들어가    아이돌  신체 만진 여성  결국,Social
583, 대장동 개발 의혹  김만배 남욱 구속기간   일까지 연장,Social
584, 성관계 영상 유포  A제약사 아들  심서도 집행유예,Social
585,해운대 아파트서 불법 대부업 운영            고금리 챙긴 일당 검거,Social
586,수능 D     전국 고등학교 원격수업 전환,Social
587,낮잠 안잔다고 온몸으로 압박     개월 아이 숨지게한 어린이집 원장,Social
588,무면허 음주운전 사고내고 목격자 폭행 후 도주   대  검거,Social
589, 남의 집 베란다 들이받고 나 몰라라  뚫린 벽 수건으로 막아놔,Social
590, 낮잠 안잔다고     개월 아기 몸으로 눌러 숨지게 한 원장,Social
