,title,category
0,경북서 신규 확진   명 안동   명  포항  명 등,Social
1, 개 기초단체장   공무원 점심시간 휴무제  찬성,Social
2,전국 곳곳에 비나 눈 제주 산지에는 눈 쌓여,Social
3,,Social
4,아침부터 공항에 발 묶인  진에어  승객들 본사 메인서버 먹통 원인,Social
5, 현장영상  위중증 환자 역대 최다    아직 우리 의료체계가 감당 가능 ,Social
6,대풍으로 쌀값 하락 전남도  과잉 생산 물량 시장 격리를 ,Social
7,여고생 머리카락 등에 몰래 소변 본 연극배우  대법  피해자 몰랐어도 강제추행 ,Social
8,광주 전남 하루 새   명 신규 확진 대부분 돌파 감염 종합 ,Social
9,셀트리온 코로나 항체치료제 사실상 유럽 허가  공급에 박차  종합 보 ,Social
10,노조파괴 공작을 벌인 대한민국을 심판한다,Social
11, 전과  범  소개팅앱서 만난 여성들 또 등친   대 남성 실형,Social
12,요소수 판매 글 올린 후 돈 받고  먹튀   사이버 사기꾼 구속,Social
13,중고나라 당근 등  요소수 먹튀 사기   일새    건 적발,Social
14,박근혜 정부 대변인  술 취해 여성 소방관 폭행한 혐의로 기소,Social
15, 따놓은 당상  총기 입찰 사업   군사정보 유출 유죄 ,Social
16,요양병원 확진자 증가세 광주  명 전남   명,Social
17, 가방 잃어버렸다  경찰에 신고했다가 주머니서 마약 떨어뜨린   대 구속,Social
18,에어부산  부산 괌 노선   일부터   개월 만에 주  회 운항 재개,Social
19,오세훈표  안심소득  실험  정부 승인 내년부터 시작,Social
20,가상화폐 지갑 카이카스 이용자 해킹 피해 경찰  수사 착수,Social
21,인천시  일상회복 지원금 발표 너무 서둘렀나   시의회와  엇박자 ,Social
22,밤사이 경북  개 시 군서 크고 작은 사고 잇따라     명 중경상,Social
23, 얀센 접종자들 한결 편해지겠네  오늘부터  부스터샷 도 네이버 카카오로 가능,Social
24, 기성용 몰래 사문서 위조    억 땅 산 부친  인정했다,Social
25, 요소수 팝니다  돈만 받고 잠적 피의자 첫 구속 피해자   명 종합 ,Social
26,초등학교 요양원서 집단감염 전북서   명 확진,Social
27,안동 포항 영천 등   개 시군서   명 확진 경북 누적  만   명,Social
28, 당신 덕분에 성장    년 전 퇴사자도 한우 챙겨준 회사,Social
29,올 가을 들어 가장 추운 날씨 일부 지역 눈 비,Social
30,홧김에 여고생 옷에 소변 본 연극배우  무죄 판결 뒤집힌 이유는 ,Social
31, 투자전문가 소개  알고 보니  인 역 사기 전과  범 실형,Social
32, 병원 가던 중 나았다  구급차 부른 그 가수가 향한 곳 ,Social
33,대법  몰래 등에 소변 피해자 몰랐어도 강제추행 ,Social
34,대학판  숙명여고 사건  아들에 A  준 교수  오늘  심 선고 나온다,Social
35,제주 김녕서   대 부부 트럭 사고 조수석 아내 숨져,Social
36, 시끄러워서   대낮에 고시원 이웃에 흉기 휘두른   대 여성,Social
37, 영상  고  담임  아이들 마스크 벗은 얼굴  졸업앨범 촬영 때 처음 봐  올해 수능 변수는 ,Social
38, 트럭에 아이가 치었는데 명함만 주고 갔다  당시 영상,Social
39,경북   명 확진 가족  지인 등 산발 감염 이어져,Social
40,어제 광주   명 전남   명 코로나   확진,Social
41, 초등생 조카 깔고 간 트럭 기사  명함만 주고 사라져    한문철 진단은,Social
42,오세훈표 안심소득 실험 내년부터 시범사업,Social
43,경북 안동 등   개 시 군서   명 추가  누적  만   명,Social
44, 원주국립과학관  중앙투자심사 또 부결  정부 사업인데  ,Social
45, AZ백신  차 접종 친정 아버지 횡단성 척수염으로 하반신 마비  국민청원,Social
46,수능 앞두고 거짓   과장 광고 기승 이런 사례들 있었다,Social
47,여학생 등 뒤에 몰래 소변 본 연극배우 대법  강제추행 ,Social
48,오늘부터 유류세       기름값  언제쯤 떨어질까,Social
49,구미서 초등학교 동창 여친 둔기로 살해한   대 검거,Social
50, 백신 이상반응 인정범위 확대      안전성위원회  오늘 출범  코로나TMI ,Social
51,수능 앞두고 또 백신 맞은 고  코로나 수험생  최소   명  확진,Social
52, 응급실서 진통제만 사지마비  대학병원 의사  심서  집유 ,Social
53,정부  요소수 판매처 주유소 한정  업계는  처음 들었다 ,Social
54,EMA  셀트리온 코로나 치료제 승인 권고  아침  지금,Social
55, 충전 중 아니라도 위험  휴대전화 충전기  트래킹 화재  주의,Social
56,셀트리온 코로나   치료제  유럽서  승인 권고  의견 획득,Social
57,주유소에서만 요소수 판매 승용차      화물차    까지,Social
58, 뉴스쏙 속 오늘부터 유류세 인하 직영 알뜰은 바로 반영,Social
59, 아들 퇴직금   억  곽상도 의원직 상실 검찰 소환 임박,Social
60, 굿모닝MBN 날씨 한낮  올가을 가장 추운 날씨 내일 아침 절정  낮부터 풀려 ,Social
61,경북    곳서   명 확진 이번엔 안동서 급속 확산,Social
62,오세훈표 안심소득 실험 내년부터 시범사업,Social
63,경북 안동 등   개 시 군서   명 추가  누적  만   명,Social
64,경기도  감사 거부한 남양주 시장 공무원  명 또 고발,Social
65,가정집 모텔 출장 성매매 성매수자 연락처만  만 건,Social
66,  개월 아이 눌러 질식사 시킨 어린이집 원장 징역  년,Social
67,기획사 잠입해 아이돌 크래비티 멤버 신체 만진 여성 검찰 송치,Social
68,출장 성매매 알선해온 업주  앞에선  성매매 시민감시단 ,Social
69,ASF 멧돼지 포획 트랩 규격 미달품 또 적발  지방계약법 위반 ,Social
70,미국 외교관  택시 접촉 사고 뒤 도주 경찰 조사도 거부,Social
71, 날씨  오후까지 서쪽 중심의 비 내일 오후부터 추위 풀려,Social
72,김만배 조사 연이틀 무산 구속시한 연장 특검 논의  솔솔 ,Social
73,경찰도 속수무책 택시 들이받고 도주한 차량의 정체는,Social
74, 로이더  의혹 김종국  혈액검사 결과 공개   의사  안 맞았죠  ,Social
75,뇌경색 환자에 진통제만 투여  대학병원 의사   심서 집행유예,Social
76,신규확진     명대 예상 정은경  일상회복  단계 못 갈수도 ,Social
77, 대사관 외교관  택시 추돌 후 도주  웃으며 놀리더라  주장,Social
78, 팩트체크  회사 소유 PC 휴대전화는 사용 직원 동의 없이 열람 ,Social
79,전국 곳곳 영하권  초겨울 추위 계속 내일 낮부터 풀려,Social
80, 주식리딩방  잇단 피해 수익 나면 돈 내라더니 즉시 결제,Social
81,김대중 노무현 좇아 국민통합 외친 윤석열에 엇갈린 평가,Social
82, 낮잠 안잔다고   개월 여아 눌러 질식사  어린이집 원장  징역  년,Social
83,유럽의약품청  셀트리온 코로나   항체치료제 승인 권고,Social
84,소상공인에  천   살인 이자  외제차 요트 구입,Social
85, 가방 잃어버렸다 며 경찰과 대화 나누다 마약 든 비닐봉지가  툭 ,Social
86, 총장 장모 대응 문건  영장엔  상급자가 지시 ,Social
87,신규 확진      명 안팎 유럽  셀트리온 치료제 사실상 승인,Social
88, 일상회복  단계로 못 갈 수도  부스터샷 접종 후 국내 첫 사망 신고,Social
89,노태우 빈소 조문 간       시민군   윤석열 곁에도 섰다,Social
90,홧김에 모르는 여성 등에 소변 본 연극배우  무죄 판결 뒤집혔다,Social
91,  월   일 굿모닝 MBN 주요뉴스,Social
92,또 택시기사 폭행 추적  주일째  오리무중 ,Social
93,성매매  시민감시단원  알고 보니 경쟁업주,Social
94, 현재 추세대로면 하루   명 사망 부스터샷 서둘러야 ,Social
95,위중증    명 또 최다 오늘 발표 확진      명대 예상,Social
96, 중장비에도 요소수 넣어야  건설현장도 멈춘다,Social
97, 코인 투자 고수익  미끼 오픈채팅 가짜 웹사이트 사기 속출,Social
98,백신 맞은 고  수험생 확진 수능 앞둔 학교  비상 ,Social
99,동거 중인 남성과 낳은  세딸 살해한 어머니  감형  왜 ,Social
100,서울시의회  시 대변인 어르고 달래며  집중포화 ,Social
101,수능 일주일 앞으로 전국 고교 원격수업 전환,Social
102, 낮잠 안잔다고   개월 여아 눌러 질식사  어린이집 원장  징역  년,Social
103,유럽의약품청  셀트리온 코로나   항체치료제 승인 권고,Social
104,소상공인에  천   살인 이자  외제차 요트 구입,Social
105, 가방 잃어버렸다 며 경찰과 대화 나누다 마약 든 비닐봉지가  툭 ,Social
106,중국 자본 개발 지난   년의 제주 민낯은 ,Social
107,광주학생독립운동  주인공 없이 껍데기만 남은 이유,Social
108, 더오래  성을 가는  친양자 입양  독신자도 가능해진다,Social
109, 가슴 통증  응급환자에 필요 검사 안한 의사  심 집유,Social
110,     세 사전예약 오늘까지 부스터샷 당일예약 시작,Social
111,밥하는  동네  아줌마    앵커 브리핑에 눈물이 쏟아졌다  학교비정규직  목소리를 내다 ,Social
112, 년 후에 나온 피자에땅 갑질 승소    기쁘지 않습니다  권성훈의 사오정이야기 ,Social
113,  개월 여아  학대치사  어린이집 원장 징역  년  엄벌 필요 ,Social
114,피해자 몰래 등과 머리카락에 소변 본  엽기 남성  대법  강제추행 맞다 ,Social
115,술 취해  소방관 뺨 때린 혐의 정연국 전 청와대 대변인 기소,Social
116, 르포 대장동 그 이후 수도권 개발광풍  이권다툼에 몸살,Social
117, 전문가에게 듣는다  코로나   백신  독감처럼 매년 접종   중장기적 과제 ,Social
118,소아 청소년 접종률    대 예상 심근염 심낭염 의료비 지원,Social
119,홧김에 여고생 등에 몰래 소변본 연극배우가 무죄  대법원서 뒤집혔다,Social
120,위중증 환자 연일 최다  일상회복  단계  이행 놓고 전문가들 사이에서도 이견,Social
121,정은경  단계적 일상회복  단계 전환 어려울 수 있다 ,Social
122, 유튜브에만 빠져 있는  요즘 애들이 보여준 반전  마을   년 ,Social
123, 아파트 내 놀이터 외부인 이용  주거침입 이라고요  ,Social
124,마약 소지하고 있던   대   가방 잃어버렸다 고 신고했다가 경찰에 덜미,Social
125,  외교관  접촉사고 후 미군 기지로 조사도 거부 ,Social
126,집안일 부탁 거절하자 흉기로 친형 살해한 동생   항소심도   년형,Social
127,  외교관  접촉사고 뒤 도주 대사관  보도 동의 안해 ,Social
128,정용진   재수 없다 는 악플에 남긴 댓글 한 글자 모두 웃었다,Social
129, 뉴스 열어보기  택시 다 어디갔지  심야 귀가 대란 이유 있었다,Social
130,검찰  김만배  소환 불응 에 노심초사 수사팀 확진도 영향,Social
131,서울 확진자 급증  병상 경고등  서킷브레이커 기준 없어 혼란,Social
132, 중국발 요소수대란 직격탄  광양항 수출입컨테이너차  요소수 바닥날까 수백미터  긴줄 ,Social
133,여성 뒤 옷에 몰래 소변 본   무죄  대법  강제추행 ,Social
134, 아들 퇴직금   억  곽상도 의원직 상실 다음 주쯤 검찰 소환,Social
135,가야 고분서 중국 청자가 세계문화유산 등재  탄력 ,Social
136,논 곳곳에 박힌 철근  일 년 농사 날릴까  걱정,Social
137, 한동훈 독직폭행  정진웅  심 시작   검찰 수사관 증인 신청,Social
138,위중증 환자 최고치 경신  방역조치 강화할 수도 ,Social
139,노량진 한복판에 피 뚝뚝  무슨 일이 고시원 내 비극,Social
140,성기 보이며  에 소변   대   연극배우 무죄 아닌 유죄 왜 ,Social
141,후진 화물차에 초등생 깔릴 뻔 명함만  달랑 ,Social
142,번호판 없는  유령 오토바이  사고 내도 못 잡아 ,Social
143,임산부석 앉은 고등학생 혼낸 할아버지  누가 더 잘못했나,Social
144, 분양권 파세요  개인정보 빼돌린 건설사 직원,Social
145,김소연  대전판 화천대유  주장에 대전시  법적대응 안하나 못하나,Social
146,정은경  일상회복  단계 전환 어려울 수도 ,Social
147,김부겸    명 식사  방역지침 위반,Social
148, 몸캠피싱  보이스피싱 범죄조직 인출책   대  명 실형,Social
149, 교육 지원 내세운 포퓰리즘    교육재난지원금  퍼주기 논란,Social
150, 저출산은 총체적 사회문제  답은  Happy Birth K  에 있다 ,Social
151, 달리다가 불붙는 자동차  회장님 보고가 문제였다   한판승부 ,Social
152,홧김에 여성 등에 소변 본 연극배우 무죄  대법원은  강제추행 ,Social
153, YTN 실시간뉴스  김부겸    명 식사 모임   방역수칙 위반,Social
154,약값   배 오른다  신포괄수가제 개선안에 뿔난 암 환자들,Social
155, 오늘날씨 전국 대부분 아침 영하권 비에서 눈으로,Social
156, 단독  범칙금 프리패스  모범운전자증 웃돈 받고 내준 노원모범운전자회,Social
157,홧김에 모르는 여성에 방뇨한 배우 대법  강제추행 ,Social
158, 단독 김만배  남욱 정영학      년  박영수 로펌 서 대장동 사업 입찰 준비 ,Social
159,홧김에 여성에게 소변 본 연극배우  무죄  대법서 판결 뒤집혔다,Social
160, 요소수 영끌  일단은 숨통 가격 폭등 버틸수 있을까,Social
161, 로이더 가 뭐길래   김종국 이슈에 뜬 스테로이드 부작용은,Social
162,  대 돌파감염 속출  추가접종 간격 단축 검토 ,Social
163, 이슈 In     천만원 공중보건장학제도  의대생은 갈수록 외면,Social
164,여고생 옷에 몰래 소변 본 연극배우 대법  무죄  뒤집은 까닭,Social
165, 현장영상   누가 열심히 일하나   다 같이 잘 살아야    반값 아파트  논란  강남 주민들  설왕설래 ,Social
166, 비상계획 시기상조 라는 정부  병상 확충이 능사 아냐 ,Social
167,옷에 소변보고 도망 대법  성적 도덕관념 반해 추행죄 ,Social
168, 만취 벤츠 로   대 숨지게 한   대 여성  오늘  심 선고,Social
169,  대 인부 덮친  만취 벤츠  운전자  오늘  심 선고 검찰은   년 구형,Social
170,화풀이로   대 여성 상의에 몰래 소변 연극배우 대법  강제추행 ,Social
171, 위드코로나 면 괜찮나  확진자 급증 불구 시민 불감증 심각,Social
172, 방역조치 강화될라  지금 만나자   더 조심해야 할 시기 ,Social
173,위드코로나  등교중지  기준 완화하나 지침    판 내주 나온다,Social
174,  년 전  인조 총기 강도  그들은 태양을 쏘았다,Social
175,     세   명 중  명만 예약 위드코로나 사각지대로 급부상,Social
176,주한 미 외교관  접촉 사고 뒤 도주 경찰 조사도 거부,Social
177, 첫만남이용권  논란 해외출생 복수국적 아동에도    만원 줘야 하나,Social
178, 정부믿고 전세 연장했다 이혼 위기  무주택자들의 분노,Social
179, 오늘의 날씨  전국 곳곳에 비나 눈   바람 세게 불어 추운 하루,Social
180,신생아    만원씩 주는 첫만남이용권  시행 두 달 남았는데  깜깜이 ,Social
181, 충전 중 아니라도 위험  휴대전화 충전기  트래킹 화재  주의,Social
182,피해자 몰래 등에 소변 본 남성 대법  강제추행 맞다 ,Social
183,위중증     명도 감당   밑 빠진 독에 물 붓기  더 늘 것 ,Social
184,기성용 아버지  아들 몰래 내가 땅 샀다   사문서 위조  인정,Social
185,국민은 속타는데  김오수 김태훈 휴가  대장동 수사 안 하겠다는 것 ,Social
186, TSMC 민주주의  양 날개로  잊혀진 존재에서 부활한 대만,Social
187, 위드 동심  굽이굽이 일상 회복,Social
188, 집 불타 갈 데 없는 아기  내보내야 합니까  구의원 호소에 은평구의 마음이 움직였다,Social
189,약대 수시 경쟁률 최고    대   주문 같은  의치한약수 ,Social
190, 가까운 서울 부론산단 소금산 힐링  넘버원 문화관광도시 원주 ,Social
191,한양 가던 선비 과거길  수능 대박 선사할  꽃길 ,Social
192,기준액 미달한 수입 채운다  닻 올린 오세훈  안심소득 ,Social
193, 하루     원 받고 전투기 굉음 참아라    군산 주민  부글부글 ,Social
194,성착취물 일당 모두 중형   년여 걸린  n번방 단죄 ,Social
195, 자연인  곽상도 소환 앞둔 검찰  뇌물죄 아닌 알선수재 적용하나,Social
196, 자유 제한  vs  민생 정책  음식점 총량제 논란,Social
197, 간병 비극  징역  년   대 청년  전태일 이소선장학재단 첫 수혜자 될까,Social
198,두 달 넘게 진행된  고발사주  수사 공수처  윤석열에 칼끝 겨눌 수 있을까,Social
199, 날씨  아침 최저기온 영하 도  추위 절정 충청 남부 눈 비,Social
200,한국교통대학교 총장선거  선거일 두고  전전긍긍 ,Social
201,수도권 아침까지 눈 비 미세먼지  좋음 ,Social
202, 영상 이승우 IH사장  청년세대   영끌  주택매수보단 청약 노려야 ,Social
203,위중증     명도 감당   밑 빠진 독에 물 붓기  더 늘 것 ,Social
204,잊혀진 백신  노바백스   공들였던     만명분 언제 오나,Social
205, 서울 요소수 대란      천원 하던 요소수  만원  주유소의 진실은 ,Social
206, 오늘의 날씨  대전 충남   일  금  아침  도 내외        눈 비,Social
207, 공무원도 사람이다  vs  연차 쓰고 가야 하나   점심시간 휴무제  어떻게 생각하십니까,Social
208,화장실 버스에서 여성 불법촬영   대  심 집행유예,Social
209, 오늘의 날씨  광주 전남   일  금  춥고 오후까지 비,Social
210,오늘부터 부스터샷도 네이버 카카오로 당일예약 후 잔여백신 맞는다,Social
211,경비행기로 세계일주하는   세 소녀  내일 서울 온다,Social
212,코로나로 시작한  배달     이젠 점심 배달 대기 단  건 ,Social
213,영부인도 들었다    비건 가죽 찾는다면  한지 가죽  어때요 ,Social
214,여성계  이재명 윤석열의 여가부 개편론   이대남  눈치 보는 말장난 ,Social
215, 단독  윤우진 수사 용두사미 되나    억 대관비 로 마무리 수순,Social
216, 단독  반도체 공급난  코로나 재택치료까지 덮쳤다    산소포화도 측정기 조달 초비상,Social
217, 남의 놀이터서 놀면 도둑   입주민 이기주의  어떻게 생각하십니까,Social
218,  최숙현 선수에 가혹행위  가해자들 엄벌,Social
219,일상회복  단계 시행  적신호   실외 노마스크  또 멀어진다,Social
220, 맞으신 거 아니에요      로이더 의혹 해명  김종국  호르몬에 의사 반응,Social
221, 허위이력서 의혹  김건희 정경심과 닮거나 다르거나,Social
222,  등해도 장학금 다 못받아  돈 없는 지방대  학생도 떠난다      대학평가 ,Social
223,  억 번 LH직원 무죄  커서 LH직원 될래요  분노 부른 검 경,Social
224,잊혀진 백신  노바백스   공들였던     만명분 언제 오나,Social
225, 서울 요소수 대란      천원 하던 요소수  만원  주유소의 진실은 ,Social
226, 오늘의 날씨  대전 충남   일  금  아침  도 내외        눈 비,Social
227, 공무원도 사람이다  vs  연차 쓰고 가야 하나   점심시간 휴무제  어떻게 생각하십니까,Social
228,화장실 버스에서 여성 불법촬영   대  심 집행유예,Social
229, 오늘의 날씨  광주 전남   일  금  춥고 오후까지 비,Social
230,오늘부터 부스터샷도 네이버 카카오로 당일예약 후 잔여백신 맞는다,Social
231,경비행기로 세계일주하는   세 소녀  내일 서울 온다,Social
232,코로나로 시작한  배달     이젠 점심 배달 대기 단  건 ,Social
233,영부인도 들었다    비건 가죽 찾는다면  한지 가죽  어때요 ,Social
234,여성계  이재명 윤석열의 여가부 개편론   이대남  눈치 보는 말장난 ,Social
235, 단독  윤우진 수사 용두사미 되나    억 대관비 로 마무리 수순,Social
236, 단독  반도체 공급난  코로나 재택치료까지 덮쳤다    산소포화도 측정기 조달 초비상,Social
237, 남의 놀이터서 놀면 도둑   입주민 이기주의  어떻게 생각하십니까,Social
238,  최숙현 선수에 가혹행위  가해자들 엄벌,Social
239,일상회복  단계 시행  적신호   실외 노마스크  또 멀어진다,Social
240, 맞으신 거 아니에요      로이더 의혹 해명  김종국  호르몬에 의사 반응,Social
241, 허위이력서 의혹  김건희 정경심과 닮거나 다르거나,Social
242,  등해도 장학금 다 못받아  돈 없는 지방대  학생도 떠난다      대학평가 ,Social
243,  억 번 LH직원 무죄  커서 LH직원 될래요  분노 부른 검 경,Social
244,잊혀진 백신  노바백스   공들였던     만명분 언제 오나,Social
245,주한  외교관  택시 들이받곤 조치없이 달아나,Social
246,   만원 빌려주고    만원 이자  벼랑끝 서민 등친 일당 검거,Social
247, 단독 정영학  본인회사와 아파트 거래로 비자금 최소   억 조성,Social
248,정은경  방역완화 폭 컸다  다시 강화할수도  위드코로나 빨간불,Social
249,도심 위협하는 산불   수도권 첫 산불 진화 훈련,Social
250, 팩트체크 매년 낙태가 신생아 출산보다 많은    만 건이라고 ,Social
251,땅끝  해남  축제   쌀 배추 고구마 김 등 해남의 맛 변신,Social
252,개그맨 강성범  윤석열  아저씨   대선 이기면 나라 박살 날 것 ,Social
253, 아들   억  곽상도 의원직 상실 검찰 소환 임박,Social
254,경쟁 업체 방해하려 시민감시단 활동한 성매매 업주,Social
255,주한 미 외교관  택시 추돌 후 도주  뺑소니 아니다 ,Social
256,이대로면 하루   명 사망  추가 접종 서둘러야 ,Social
257,위중증    명  또 최다   비상계획 검토 단계 아냐 ,Social
258,유럽 CHMP  셀트리온 코로나 항체 치료제 승인 권고,Social
259, 외국인 전용 카지노 고사 위기  온라인 암호화폐 결제 도입 제안 ,Social
260, 신문과 놀자  주니어를 위한 칼럼 따라잡기  먹는 코로나 치료제,Social
261, 신문과 놀자  피플 in 뉴스  모두 잘 살자 며 장기집권 노리는 시진핑,Social
262, 한국어 기원      년전  요하 농경지   중앙  유목민설 뒤집히나,Social
263,머스크  자신의 테슬라 주식    팔아  조원 현금화  세금 회피 의도 분석,Social
264, n번방  문형욱 징역   년  박사방  강훈 징역   년 확정,Social
265,주한  외교관  택시 들이받곤 조치없이 달아나,Social
266,   만원 빌려주고    만원 이자  벼랑끝 서민 등친 일당 검거,Social
267, 단독 정영학  본인회사와 아파트 거래로 비자금 최소   억 조성,Social
268,정은경  방역완화 폭 컸다  다시 강화할수도  위드코로나 빨간불,Social
269,도심 위협하는 산불   수도권 첫 산불 진화 훈련,Social
270, 팩트체크 매년 낙태가 신생아 출산보다 많은    만 건이라고 ,Social
271,땅끝  해남  축제   쌀 배추 고구마 김 등 해남의 맛 변신,Social
272,개그맨 강성범  윤석열  아저씨   대선 이기면 나라 박살 날 것 ,Social
273, 아들   억  곽상도 의원직 상실 검찰 소환 임박,Social
274, 문화가 있는 주말 이현정 기자의 영화 보조출연 후기,Social
275, 한민족  천년 역사에서 결정적인   장면 임진왜란   여년 전   신무기 조총 도입  전쟁   대변혁,Social
276,유오성  내집처럼 편안 사람 냄새 가득한 강원의 정서 담았죠 ,Social
277,   년간 간첩가족 누명 벗어나 감사 죄없는 가족 억울함 더 풀어야 ,Social
278,납북귀환어부 불법구금 국가 책임 첫 인정,Social
279,코로나 확진자 중환자 증가세 주말 강원도내 확산 우려 커져,Social
280,LG 소니  자동차 회사 될까  IT기업들  완성차 제조사 업계 도전장,Social
281,정용진   재수없다  SNS 악플에   왜   쿨한 대응 화제,Social
282, 돈 못 갚으면 장기 팔아  변호사가 감금 협박 경찰 수사 착수,Social
283,오늘   일 부터 부스터샷도 잔여백신 접종 가능,Social
284,이재명  넥타이  점  윤석열  집사부 팬  안철수  마라톤 티 ,Social
285,규칙적인 혈당측정  당뇨병 치료 합병증 예방의 핵심,Social
286,검찰총장 휴가 가고  권순일은 조사도 안해 늦어지는 대장동 수사,Social
287, 영상 초등생 치고 명함만 주고 떠난 트럭 한문철 진단은 ,Social
288, 한동훈 독직폭행  정진웅  심 첫 재판  무죄  주장,Social
289,코로나   백신 접종완료율              세 접종예약 오늘까지,Social
290,오늘부터 부스터샷도 네이버 카카오 SNS 당일예약,Social
291, 아들 퇴직금   억  곽상도 사직안 국회 가결 다음주쯤   소환,Social
292,소아 청소년 접종률    대 예상 심근염 심낭염 의료비 지원,Social
293,위중증 환자 최고치 경신  방역조치 강화할 수도 ,Social
