,title,category
591,위중증    명  최다   확진     명 정은경  일상회복  단계 시점 불투명 ,Social
592,정우택 청주 상당 재선거 출마 공식화 지역 정치권  요동 ,Social
593,교육청까지 선거용  돈 뿌리기  경쟁,Social
594,검찰   대변인폰 영장 없이 압수  논란 대검 감찰과장 고발 건 수사 착수,Social
595,위중증    명 역대 최다    비상계획 검토 아직 일러 ,Social
596,네이버 카카오로  부스터샷 잔여백신 당일예약  가능해진다,Social
597, 소리 거슬렸다  고시원 앞방사람에 흉기 휘두른 공시생,Social
598, 내일 날씨  찬공기 유입되며 쌀쌀 서울 아침 영하 도,Social
599,법원  김만배 남욱 구속기간   일까지 연장 결정,Social
600,시민단체 예산삭감 갈등 시의회 민주당  오세훈 시장 집중 공격,Social
601,김건희  허위이력  이재명  논문의혹  대선 대리전이 펼쳐진다,Social
602, 파리바게뜨  아직도 조합원 찾아 노조 탈퇴 권유해    애가 탄다 ,Social
603,예사롭지 않은 중환자 사망자 증가세 일상회복  단계 가능할까,Social
604, 단독  정부 감사원 고발 건 기소율       정부 절반 그쳐,Social
605,손님과 말다툼 벌이다 흉기로 찌르고 도주한 노래방 사장,Social
606,기성용    아들 모르게  사문서 위조  인정했다,Social
607,법원  김만배 남욱 구속기간   일까지 연장 결정,Social
608,위기의 한국패션산업연구원  본원 또 강제경매 넘어가나,Social
609,김헌동  반값 아파트  후보지 거론에 은평구  잘못된 발상  반발,Social
610,공수처  권순정   윤석열 장모 대응 문건  기자들에게 보여줘 ,Social
611, 묻지마 폭행  일면식없는 남성에게 흉기까지 휘두른   대,Social
612,가방 분실 신고한 사람 옷에서 비닐봉지가 툭 마약 투약   대 남성 체포,Social
613,정승일  원전 확대  국민 공감대 있으면 가능 ,Social
614,  일 울산 중학교 집단감염  명 등  명 신규 확진,Social
615, 하명 감찰 의혹 커지자 김오수 돌연 연차,Social
616, 엄마아빠도  선생님도 무서워요   일상에 스며든 아동학대,Social
617, 돈 벌겠다는 급한 마음에 뛰어들었다가   리딩방 피해      급증,Social
618,임창정 미접종  김흥국  그 싼 걸  안티백서 자유냐 민폐냐,Social
619,바이오엔테크 mRNA 적용 항암제  초기 임상 기대 이하  시총  조 증발 ,Social
620,예방의학 교수  백신맞고 입원하면 주요 이상사례로 인정해야 ,Social
621, 의원직 상실  곽상도       억 클럽  수사 본격화,Social
622,검찰     의원  곽상도 소환 임박   김만배 남욱 구속 연장,Social
623,예사롭지 않은 중환자 사망자 증가세 일상회복  단계 가능할까,Social
624, 단독  정부 감사원 고발 건 기소율       정부 절반 그쳐,Social
625,손님과 말다툼 벌이다 흉기로 찌르고 도주한 노래방 사장,Social
626,기성용    아들 모르게  사문서 위조  인정했다,Social
627,법원  김만배 남욱 구속기간   일까지 연장 결정,Social
628,위기의 한국패션산업연구원  본원 또 강제경매 넘어가나,Social
629,김헌동  반값 아파트  후보지 거론에 은평구  잘못된 발상  반발,Social
630,공수처  권순정   윤석열 장모 대응 문건  기자들에게 보여줘 ,Social
631, 묻지마 폭행  일면식없는 남성에게 흉기까지 휘두른   대,Social
632,가방 분실 신고한 사람 옷에서 비닐봉지가 툭 마약 투약   대 남성 체포,Social
633,정승일  원전 확대  국민 공감대 있으면 가능 ,Social
634, 헉   경북에 주  시간 수업 연봉     만원 원로교사  수두룩,Social
635,성관계 맺은 여성 신체 촬영 동의 없이 SNS 유포  종근당 장남  심도  집유 ,Social
636, 내일날씨 전국 대부분 아침 영하권 비에서 눈으로,Social
637, 위드아웃 코로나 같아요  보복음주 회식에 비틀대는 한국 사회,Social
638,올 수능  칸막이 없이 시험 본다 확진자  병원에서 시험 응시  종합 ,Social
639,노량진 한복판서 도움 요청한 수험생  소음 이 불러온 비극,Social
640,  대 여성  부스터샷 맞은 후 사망 국내 첫 사례,Social
641,중앙지검   대변인 공용폰 압수  대검 감찰과장 고발 사건 배당,Social
642, 단독  공수처  대검 간부 대화 담긴 내부 메신저 확보,Social
643,울산  명 신규 확진 수능 앞둔 고  학생  명 포함 종합 ,Social
644,법원   대장동 핵심  김만배 남욱 구속기간 연장 결정,Social
645, Pick         이자 받으며 초호화 생활 불법 대부업 일당 검거,Social
646, 한동훈 폭행 혐의  정진웅   심서도 혐의 부인  수사관 증인신청 ,Social
647,내년  월 일부터 게임 셧다운제 폐지,Social
648,시의회 민주당  김헌동 부적격 이어 이창근 대변인 총공세,Social
649,자영업자  민주노총에 손해배상 청구한다,Social
650, 대장동 수사  속도내야하는데    코로나와 싸워 김만배 소환불응 종합 ,Social
651,    년 재일교포 간첩사건 법정 진술      년 재심서 증거능력 인정 ,Social
652,이웃집 몰래 들어가 용변 본   대 남성 실형,Social
653, 바다정보다잇다   부드럽고 촉촉한 가성비 생선    월 제철 삼치,Social
654, 위중증 환자 계속 늘어나면 일상회복  단계로 못갈수도 ,Social
655,어젯밤 택시 안 잡힌 이유  팬데믹에 법인택시 기사     떠났다,Social
656,백신접종 후 심근염 심낭염    명 최대  천만원 받는다,Social
657, 가방 분실했어요  경찰과 대화중 주머니서 마약 흘린   대  구속,Social
658,비상계획 발동시 서울 학교 원격수업 전환 필수활동은 대면으로 종합 보 ,Social
659, 코인으로 돈 벌 점괘  유명 무속인 유튜버  코인 사기로 고소당해,Social
660,백신안전성위  내일 발족  이상반응 보상 범위 확대  종합 ,Social
661,중앙지검   대변인 공용폰 압수  대검 감찰과장 고발 사건 배당,Social
662, 단독  공수처  대검 간부 대화 담긴 내부 메신저 확보,Social
663,울산  명 신규 확진 수능 앞둔 고  학생  명 포함 종합 ,Social
664,정부  날림 행정 에 요소수 공급 현장 곳곳 혼선,Social
665,박병석 손목시계  김명수 서예작품  김부겸 나무부채액자 정 관계 애장품  막판 행렬  위아자     ,Social
666,제주 신규 확진자   명 발생 요양병원 사우나 집단감염   명 추가,Social
667,정진웅   수사관 증인신청  한동훈과 충돌  정당했나,Social
668, 르포  숨통 트이네요  군용 요소수 공급에 주유소마다 장사진,Social
669,공수처   판사사찰 문건  의혹 윤석열 이어 손준성도 입건,Social
670, 단독   나눔의 집  공익제보자 업무 배제 계속되는 괴롭힘,Social
671,시비 외국인 납치 감금 폭행한   대 외국인들  징역형 ,Social
672, Pick   성관계 영상  퍼뜨린 종근당 장남  심도 집행유예,Social
673, 주  시간 수업에 연봉  천만 원 원로교사  경북에   명,Social
674, 한동훈 독직폭행  정진웅  심도 무죄 주장  수사관 증인신청,Social
675,인슐린 발견    년  당뇨병 역사 바꿨다,Social
676, 가방 잃어버렸다      신고했다가 필로폰 딱 걸린   대,Social
677, 유명해지니 어때    이정재 향한  기자 질문에  갑론을박 ,Social
678,조성은이 고소한  캠프 전현직 인사들은  연이틀 경찰조사,Social
679, 홍천 교통사고 후 아수라장 도와준 군인들에게 감사 ,Social
680,  대사관  등 서기관  택시추돌 후 도주 택시기사  웃으며 조롱 ,Social
681, 성관계 영상 유포  종근당 장남  심도 집행유예,Social
682,백신 접종완료     만명      세   만명  차 접종 종합 ,Social
683, 출장 성매매  조직적 알선 일당 적발,Social
684,정부  날림 행정 에 요소수 공급 현장 곳곳 혼선,Social
685,박병석 손목시계  김명수 서예작품  김부겸 나무부채액자 정 관계 애장품  막판 행렬  위아자     ,Social
686,제주 신규 확진자   명 발생 요양병원 사우나 집단감염   명 추가,Social
687,정진웅   수사관 증인신청  한동훈과 충돌  정당했나,Social
688, 르포  숨통 트이네요  군용 요소수 공급에 주유소마다 장사진,Social
689,공수처   판사사찰 문건  의혹 윤석열 이어 손준성도 입건,Social
690, 단독   나눔의 집  공익제보자 업무 배제 계속되는 괴롭힘,Social
691,시비 외국인 납치 감금 폭행한   대 외국인들  징역형 ,Social
692, Pick   성관계 영상  퍼뜨린 종근당 장남  심도 집행유예,Social
693, 주  시간 수업에 연봉  천만 원 원로교사  경북에   명,Social
694, 쌍무지개 떴다  천안 아산서 잇따라 쌍무지개 관찰,Social
695,취약계층 집중 지원 닻올린 오세훈의  안심소득 ,Social
696, 영상  출장 안마 마사지로 위장 수도권 최대 출장성매매 일당 검거,Social
697,LG 필립스  과징금  년 분쟁  내달 판가름,Social
698,원아 재우려 몸 누르다 숨지게 한 어린이집 원장 징역  년,Social
699,서울대병원 간호사 눈물의 호소  저희 좀 살려달라 ,Social
700, 집단확진  광주 모 요양병원 이동자제 권고 밀접촉 환자 분리 종합 ,Social
701,검찰  사옥 잠입해 남성 아이돌 멤버 강제추행한 여성 송치,Social
702,경찰  무면허 음주운전에 사고 내자 목격자 폭행한   대 검거,Social
703,호주산 요소수  만      한국 도착  수송기 김해공항 귀환,Social
704,법원  한국GM 사장 GM 부사장에 노조 접근금지 ,Social
705, 경력단절여성법  국회 통과 이젠 경력단절 예방 집중,Social
706, 화이자 백신 맞고 싶다  방역 공무원이 백신 새치기,Social
707,내일 전국 곳곳에 비 눈 찬바람에 체감기온  뚝 ,Social
708,감귤 수확철에 요소수 없어  발 동동 ,Social
709,고급 아파트에 사무실 차린 불법대부업체 최고 이자 연  천 ,Social
710,복지부  오세훈  안심소득  승인 저소득  인가구     만원 지원,Social
711, 마인크래프트 가 쏘아올린 공    게임 셧다운제    년 만에 폐지,Social
712,은평구청장  혁신파크에 반값 아파트  잘못된 발상 ,Social
713,확진 땐 논술 면접 못 보나  코로나 수능  응시권 보장하라 ,Social
714,성관계 영상 촬영 유포 종근당 회장 장남  심도 집유,Social
715,  빼빼로 vs   포키  막대과자  원조 는 누구일까,Social
716,대기 중 배달 오토바이 슬쩍   살 소년  걸어 다니기 싫어서 ,Social
717,검찰   김건희 주가조작 연루 의혹  도이치 권오수 회장 재소환,Social
718,요소수 확보했다지만 포스코  물류대란 우려 여전,Social
719, 근로기준법 위반 혐의  양승동 KBS사장 측   심 판단 부당 ,Social
720, 무단협 사태  SBS 노사갈등 격화 사측  탄압 주장은 왜곡 ,Social
721, 녹색  맛있는 쌀  상표 말고 품종보고 골라야,Social
722,이웃집 무단 침입해 용변 본   대 남성   심 실형 선고,Social
723, 간병살인 논란    살 청년   가 남긴 마지막 말은,Social
724,위중증 환자 수 증가세 지속 대구 새로운 요양병원 집단감염,Social
725,공수처   판사사찰 문건  의혹 관련 손준성 입건,Social
726,제주   명 신규 확진 요양병원 사우나 감염 고리  여전 ,Social
727,대구 시내버스 연료절감사업 실적 저하가  노조 탓 ,Social
728,코로나   부스터샷 맞은 뒤 숨진 사례 확인 화이자 백신 맞은   세 이상 여성,Social
729,충북 오후  시   명 확진 증평 교회 집단감염 발생,Social
730, 땅 투기  의혹 기성용 부친  재판서 사문서 위조 혐의 인정,Social
731,위드 코로나 타고   대학가  이제야 숨통 ,Social
732,검찰   김건희 주가조작 연루 의혹  권오수 도이치모터스 회장 재소환,Social
733,후진하다 아이 덮친 트럭 필사적으로 기어가 피했다,Social
734, 마스크 써달라  요청에 커피 던진   대  점원 도촬까지 발각,Social
735, 성관계 영상 유포  종근당 장남  심도 집행유예,Social
736,수도권 최대 출장 성매매 업소 적발    가정집까지 침투,Social
737, 안 잔다고 몸으로 눌러  아동학대치사 어린이집 원장 징역  년,Social
738, 곽상도 사퇴 로 부담 던 검찰 김만배 이틀째  소환 불응 ,Social
739,신고가로 집 산 딸  핀잔줬더니    년  개월 뒤 대반전이,Social
740,   도이치모터스 주가조작 의혹  권오수 회장 재소환,Social
741,  개월 여아  학대치사  어린이집 원장 징역  년  엄벌 필요 ,Social
742, 이제 어른 됐는데   게임 강제 셧다운제   년만에 폐지,Social
743, 간병살인 논란    살 청년   가 남긴 마지막 말은,Social
744,위중증 환자 수 증가세 지속 대구 새로운 요양병원 집단감염,Social
745,공수처   판사사찰 문건  의혹 관련 손준성 입건,Social
746,영어회화전문강사들  경남교육청 복도 점거 농성,Social
747, 뉴스큐   내일 기름 넣어도 될까    요소수 사태 고비 넘기나 ,Social
748, 인과성 불충분  심근염 심낭염 환자에 의료비 지원키로 종합 ,Social
749, 금품수수  송도근 사천시장 집행유예 확정 시장직 상실,Social
750, 영상  성매매 감시단 이 성매매 업주 모범시민의 두 얼굴,Social
751,대곡 소사 복선전철 한강 하저 터널 관통 성공,Social
752,백신 접종  올인  유럽   백신 맞으면  성매매 무료  이벤트도,Social
753,   명 사상  제주대 인근 추돌사고 화물차 기사 항소심서 금고  년  년,Social
754,김만배 재소환 또 불발 곽상도 뇌물 조사 임박,Social
755,김포시   감시장비 소송   년만에 삼성SDS 컨소 상대로 승소 확정,Social
756,정은경  상황 나빠지면  단계를 지속하거나 조치 강화  위중증 환자 또 최다,Social
757, 르포    시간 기다렸다  요소수 풀린 부산항 주유소 수백  행렬,Social
758,시속    서행하다 튀어나온 학생과 충돌했는데   차량 잘못     ,Social
759, 영상  드론택시 떴다      년 상용화 목표 ,Social
760,타인 명예훼손 의혹 샀던 현직 경찰관  검찰서 무혐의 처분,Social
761,요소수 긴급수급조정조치 시행   있어야 사고 팔지 ,Social
762,비닐하우스 일부러 쓰러뜨려 보험금 탄 농부 등 무더기  유죄 ,Social
763,누리호가 성공하면 할 수 있는 일  윅픽 ,Social
764,서울 중학교 신입생  내년부터   인  스마트기기  받는다,Social
765, 설왕설래 곽상도 의원 지역구 조직위원장은 누구 ,Social
766,대구시  확진자 집단 발생 요양병원 방역 특별점검,Social
767, 단독  황무성  자격 안 되는 유동규 대신 나를 사장 내세우고 뒤에서 다른 얘기 ,Social
768,광주시      억 지방채 발행 없이  일상회복지원금  지급한다,Social
769,경남   명 확진 요양병원 학교 돌봄시설 집단감염 여파 지속 종합 ,Social
770, 권순일 재판 거래 의혹  수사 의지 없는     공개된 자료만 확보 압수수색도 안해,Social
771, 여성 신체 촬영 유포  혐의 종근당 회장 장남   심서도  집유 ,Social
772,기획사 잠입해 남성 아이돌 추행한 여성  검찰 송치,Social
773, 야구장도 가는데 집회 막나  민노총  꼼수 집회  강행 예고,Social
774, 벌금 좀 내주십쇼  조폭 박철민  이준석에 전화했다가  줄빠따  맞았다,Social
775,부산 펜션서 판돈     만원 놓고 도박판 벌인   명 검거,Social
776, 자율주행 특허  현대차 세계  위 LG  위    바짝 추격,Social
777, 셧다운제 폐지  국회 본회의 통과   년 만에 사라진다,Social
778,관광 수입 느는데 태백 떠나는 시민들 왜 ,Social
779,이 추위  하루만 더 견디면   일 낮부터 기온 올라,Social
780,손준성 두 번 부른 공수처  구속영장 재청구 카드  고심 ,Social
781,위중증    명 최다 경신  비상계획 단계 아니지만 방역 강화할 수도 ,Social
782,마스크 시비  침뱉고 주먹질하고 생활폭력    명 검거,Social
783, 대장동 송전탑 지하화 이행명령 취소 소송  판결 내년 초 예상,Social
784,정은경  일상회복  단계 전환 어려울수도   방역조치 강화 가능 ,Social
785,내일부터  추가 접종 도 네이버 카카오 예약 가능 첫 사망 의심 신고도  종합 ,Social
786,김건희 소환만 남은 도이치모터스 주가 조작 의혹   아킬레스건 될까,Social
787,국민의힘 울산시의원들  김기현 비리  민주당의 헛소리 ,Social
788,정은경     월 중순 일상회복  단계  연기 가능성 언급,Social
789, 전세 연장했다 이혼 위기  무주택자에 찍힌 집값   적  누구,Social
790, 청소년은 심야 게임 안돼  셧다운제    년 만에 폐지,Social
791, 빨리 결제부터   주유소 앞 군 보유 요소수 구매 행렬,Social
792,곽상도 사직안 국회 통과    억 클럽  로비 의혹 수사 속도,Social
793,추가 접종  네이버 카카오로 당일 예약 가능,Social
794,억지로 재우려 다리로 압박    개월 아이 숨지게 한 어린이집 원장,Social
795,위중증 이틀 연속 최다 경신  정은경  상황 악화 시  조치 강화  종합 ,Social
796,김해   명 등 경남에서 코로나   확진   명 추가,Social
797,위중증    명 또  최다   에크모 추가 도입 ,Social
798,근대산업유산 광주 전방 일방 공장터 주요 건축물 보존  가닥 ,Social
799, 셧다운제  시행   년 만에 폐지 경단녀 지원 넘어 예방도 강화,Social
800,성희롱 갑질 약물 빼돌리기 경기도의료원 왜 이럴까 ,Social
801, 단독   방 안엔 쥐덫    만원 월급도 빼돌려   끝나지 않은 염전 노예 비극,Social
802,버릇없다고   대 동포에게 흉기 휘두른   대 외국인남성,Social
803, 축구경기를 보고 감상문을 쓰라니  전주예술중 고 학부모들 울분,Social
804,경남  창원   명 등   명 확진 어제 하루   명 종합 보 ,Social
805, 단독  뒷문 뚫린 블록체인 상반기  조 천억 피해,Social
806, 대변인 공용폰 압수  대검 감찰과장 고발사건 검찰 수사 착수,Social
807, 마스크 좀 써주세요  말하자 주먹,Social
808,정은경  또 역대최다 위중증에  이대론 일상회복  단계 어려워 ,Social
809,앞으로  년 후 비행기택시 타고 출근한다,Social
810,   김만배 남욱 구속기간   일까지 연장,Social
811,일감 느는데 일손 없다  조선업계  감원 역풍 ,Social
812, 소득 적을수록 더 많이 지원  오세훈표 안심소득 내년 실험,Social
813, 부스터샷    대 여성  접종 이틀후 사망 인과성 조사 종합 ,Social
814, 수능 코앞인데 확진자는 늘고  고  수험생 학부모들  걱정태산 ,Social
815,수능 코앞 울산서 고  수험생 돌파감염 확진 학원가  비상  종합 ,Social
816,대구 민주당사 옆 중 고   집회 소음  몸살  학습권 침해  현실로,Social
817, 단독   가방 없어졌다  신고자  경찰과 대화 중 떨어진 물건,Social
818,윤석열  노무현 대통령  국민의 사랑 가장 많이 받으신 분 ,Social
819,정진석 국회부의장 대표발의  임업직불제법  국회 본회의 통과,Social
820, 오늘의 운세    월   일 금요일 음력   월  일    ,Social
821, 단독   방 안엔 쥐덫    만원 월급도 빼돌려   끝나지 않은 염전 노예 비극,Social
822,버릇없다고   대 동포에게 흉기 휘두른   대 외국인남성,Social
823, 축구경기를 보고 감상문을 쓰라니  전주예술중 고 학부모들 울분,Social
824,경남  창원   명 등   명 확진 어제 하루   명 종합 보 ,Social
825, 단독  뒷문 뚫린 블록체인 상반기  조 천억 피해,Social
826, 대변인 공용폰 압수  대검 감찰과장 고발사건 검찰 수사 착수,Social
827, 마스크 좀 써주세요  말하자 주먹,Social
828,정은경  또 역대최다 위중증에  이대론 일상회복  단계 어려워 ,Social
829,앞으로  년 후 비행기택시 타고 출근한다,Social
830,   김만배 남욱 구속기간   일까지 연장,Social
831,일감 느는데 일손 없다  조선업계  감원 역풍 ,Social
832, 소득 적을수록 더 많이 지원  오세훈표 안심소득 내년 실험,Social
833, 부스터샷    대 여성  접종 이틀후 사망 인과성 조사 종합 ,Social
834, 수능 코앞인데 확진자는 늘고  고  수험생 학부모들  걱정태산 ,Social
835,수능 코앞 울산서 고  수험생 돌파감염 확진 학원가  비상  종합 ,Social
836,대구 민주당사 옆 중 고   집회 소음  몸살  학습권 침해  현실로,Social
837, 단독   가방 없어졌다  신고자  경찰과 대화 중 떨어진 물건,Social
838,부산항 인근 주유소  곳 요소수    톤 판매 화물차만 구매 가능,Social
839,박미경 도의원  주  시간 수업에 연봉  억 원로교사 문제 등 지적,Social
840, 속보  이재명  한 중은 뗄 수 없는 관계  요소수 부탁   중국대사  우리도 부족하지만  ,Social
841,최근 코로나   증가 추세는   세 이상의 확진자 비율이 늘어난 영향 추가접종 필요,Social
842,진중권  윤석열  반듯이  가지고 생트집 이재명 한글 모르나 ,Social
843,기념일마다 선물에 월급날엔 일찍 집으로    MZ가  픽 한 플랫폼  총사  복지도 톡톡 튀네,Social
844, 강릉 정동진 앞바다서 잠수함 봤다  신고  오인  판명,Social
845,   개월 원생 학대 치사 혐의  어린이집 원장 징역  년 선고 영상 ,Social
846,김 부장은 왜  현대차 내부고발 포상금    억  소문내려 할까,Social
847, 르포   광군제 블프  앞둔 세관은  초긴장   요소수 직구 도 등장,Social
848, 헌혈 동참하면 돼지고기 드려요     봉사왕  이태원 씨,Social
849, 영상  후진하던 트럭이 초등학생 덮쳐  운전자  명함만 주고 떠났다 ,Social
850,이재명  출근용 넥타이   윤석열  집사부 프라이팬  경매 나온다 안철수는 티셔츠 위아자     ,Social
851,전국 고교     원격수업  주간 학생 확진 하루평균    명,Social
852,충북  학교 학원 연쇄감염  지속    명 확진 누적     명,Social
853,  일부터 한국 싱가포르 여행안전권역 시행  쿠브  앱으로 인증,Social
854, 뉴스큐   화이자 백신 맞고 사망    피해 가족들의 절규  이유는 ,Social
855, 성관계 영상 유포  종근당 장남  심도 집행유예 취업제한,Social
856,권순정  대검 감찰부  무리한  몰래 포렌식  진행해 공수처에  입건 사주  ,Social
857,채용설명회에 면접까지   메타버스로 오세요,Social
858,D   수능 고사장에 너무 늦어도 너무 빨라도 곤란,Social
859,검찰   장모 모해위증  주변인 진술있으나 신빙성 떨어져 ,Social
860,얀센 접종자     만명 부스터샷 사흘만에 예약자의     접종 완료,Social
861,코로나   이후 대격차의 시대  돌봄 환경 디지털 일자리 전략을 ,Social
862, 왕릉뷰  아파트    개층 철거하거나   m 나무 심어야 한다,Social
863,제주서  중 추돌    명 사상자  낸 화물차 기사 항소심서 형량 늘어,Social
864, 퇴근길TMI  빼빼로데이 유래   날씬해지자 는 의미였다고 ,Social
865,미국 외교관들 서울 도심에서 뺑소니    경찰 조사 거부 ,Social
866, 영상   어쩜 이럴수가    초등생 다리 깔고 간 트럭기사  명함만 주고 사라졌다,Social
867,정우택  청주 상당 U턴  성공  재선거 출마한다  종합 ,Social
868,지자체 예산 횡령해 식사 명절선물 의혹 문제 알고도  쉬쉬  종합 ,Social
869, 철인 종 선수 고    최숙현 가혹행위  감독 주장 실형 확정,Social
870, 마스크 시비 로 침 뱉고 뺨까지 제주 생활 폭력범 무더기 검거,Social
871,심근염 심낭염  근거자료 불충분  대상자 의료비 지원키로,Social
872,기획사 사옥 침입해 아이돌 멤버 강제추행한 여성 검찰 송치,Social
873,최근 일주일 학생 하루    명 확진 고교는 오늘부터 원격수업,Social
874,오세훈표  안심소득  내년부터 시범시행 저소득    가구 지원,Social
875,가정집까지 침투한 출장 성매매   수도권 최대규모 업주 검거,Social
876, 김기현 땅 투기 의혹  제기에 국힘 울산시당  똥볼 찼다  평가절하,Social
877, 감히 내 여친 욕해   BJ 흉기로 찌른   대 원심 유지,Social
878, n번방  개설자 문형욱   박사방  운영자 강훈 중형 확정,Social
879,마스크 착용 요구에 카페서 커피 던진   대 경찰 입건,Social
880, 게임 셧다운제    년 만의 폐지 내년  월  일부터 적용,Social
881, 소각시설 기준 초과 영업취소 정당  청주시  클렌코에 승소,Social
882,현실로 다가온 에어택시  김포공항서 잠실까지      분 ,Social
883,제주서  중 추돌    명 사상자  낸 화물차 기사 항소심서 형량 늘어,Social
884,기획사 잠입해 아이돌 멤버 추행한 여성 검찰 송치,Social
