,title,category
297,테슬라 추월한  르노 조에    월 독일 전기차 등록  위,Economic
298,정부 긴급조치에 오픈마켓서 자취 감춘 요소수  해외직구 판매 계속 ,Economic
299,삼성물산 세사패TV  넉달만에    만  구독 달성,Economic
300,만도  KETI와 전기차 충전 자율주행로봇 만든다,Economic
301, 핫스탁 지오엘리먼트 아이티아이즈 대한전선,Economic
302,해리 왕자  잭도시 저격    트위터가  월   의회 폭동 방관 ,Economic
303,샐바시온   코빅실 V  비강 스프레이 델타 변이       사멸 효능 입증,Economic
304,일론 머스크  테슬라 주식   억달러 매각,Economic
305,기대 못 미친 상장사들 어닝 쇼크 어닝 서프라이즈,Economic
306,코스맥스    ODM  위 굳히기       만개 생산  돌파 ,Economic
307,정부  내년  월까지 요소 요소수 수입관세 면제,Economic
308, 현금 최대  억원     씨티은행 희망퇴직에 직원      여명 신청,Economic
309,원스톱 라이프 누리는 편리미엄 아파트  더샵 동성로센트리엘 ,Economic
310, 제네시스 하우스 뉴욕  공개 도심 속  문화 오아시스 ,Economic
311,엘앤씨바이오  최대 실적 행진  Q 영업익 전년      ,Economic
312,삼성전자  장중  만원선 또 붕괴 인플레이션 우려 직격탄,Economic
313, 슈퍼푸드 인기인데  건강식품서 쇳가루 검출,Economic
314,산업계  요소수 찾기  동분서주  LX인터   서     t 확보,Economic
315,바이옵트로 공모 청약 경쟁률   대   증거금    억원,Economic
316,벤츠 금정 인증중고차 전시장  사직오토랜드로 이전,Economic
317, 떠보기 아니었네  머스크  테슬라 주식    조어치  진짜  팔았다,Economic
318,삼성전자  사내식당  곳 급식 추가 개방,Economic
319,청약제 강화 예고된 세종시 시장은  그래도 오를 것 ,Economic
320, 국세청 칼날 에 분기 영업익 통째로 날리게 된 아시아나,Economic
321,MBK  투자자금   조 시대 고수익 기대 자금 쇄도,Economic
322,신세계 경기점  리뉴얼 하니 충청도 고객도 찾아온다,Economic
323,    일 수출        수입       증가 무역수지는 적자,Economic
324,군에서 쓰던 국산 항법장치  민간서도 쓴다,Economic
325,수능 D    수험생  과민성대장증후군 스트레스  OO으로 관리,Economic
326,케이뱅크  중 저신용자 신용대출 금리 인하,Economic
327,광역 교통망 확충되는 인천  미추 구역  주안 센트럴팰리스  공급 예정,Economic
328,쿠팡플레이  월드컵 최종예선 UAE 이라크 축구 경기 생중계,Economic
329,코로나 백신  독감처럼 매년 접종   당국  정례화 검토 ,Economic
330,진짜 팔았다  머스크  테슬라 지분    조 규모 매각,Economic
331,스톡옵션 행사한 머스크  테슬라 주식 팔아 차익만  조    억원 챙겼다,Economic
332,요소수 주유소에서만 살 수 있다   구매량 제한,Economic
333, 글로벌증시 투자전략  고공행진  증시 과열의  끝  조정 시작됐나 ,Economic
334,신세계인터 자주  대나무 화장지  만개 팔렸다 ,Economic
335,지오엘리먼트  코스닥 성공 입성  따  달성후 강세,Economic
336,현대카드  국내 최초 유효기간 적립한도 없는 카드 선봬,Economic
337,하이   중국  스태그플레이션  진입  한국 증시 변수로 작용 ,Economic
338, 마스크처럼  주유소서 요소수   L 한정판매 이례적 수급조정,Economic
339, 최강시사  김기식     인 가구     넘어 주택시장 청약제도 분양제도 모두 변화 올 것 ,Economic
340, 인플레 공포 에 코스피 하락 한때      선 위협 종합 ,Economic
341,희비 엇갈린 새내기  지오엘리먼트 급등 아이티아이즈 급락,Economic
342, 핫이슈 키워드  이재명 조건부 특검론 광주 찾은 윤석열 음주 운전자와 초보 운전자의 대결 대장동 수사팀,Economic
343,원하는 일자리 없어 쉬는 사람   만      명,Economic
344,지오엘리먼트  코스닥 상장 첫날 강세 상승률    대,Economic
345,현대카드  첫  적립 한도 유효 기간 없는  멤버십 제공,Economic
346, 분에 화장품     개 생산에 깜짝 놀란 중국   코스맥스의 힘,Economic
347,삼성전자  CES     혁신상 휩쓸어 TV   년 연속 최고상,Economic
348, 속보  코로나   신규 확진     명   이틀째     명대,Economic
349,LG전자    초TV와 손잡고 MZ 감성 저격 나서    스타일러에 빠진 남자  영상 공개,Economic
350,  월     일 수출        수입      무역수지      억달러,Economic
351, 시승기   스포츠 모드 가 어울리는 프리미엄 하이브리드 세단 렉서스 ES    h F 스포츠,Economic
352,속초  국평  아파트  억 돌파 강원도 역대 최고가,Economic
353,물가 상승 우려에 달러 강세 원 달러 환율 상승 출발,Economic
354,내일 유류세     내린다 휘발유  L    원  경유    원 인하,Economic
355,삼성전자 열흘만에   만전자  무너져  물가 급등 영향,Economic
356,공급망 불안에 휘둘리는 물가  높은 물가상승률 당분간 지속 ,Economic
357,삼성생명  분기 영업이익     억원 전년      ,Economic
358,게임   신작보다 메타버스 고개 숙인 엔씨 vs  기세등등  펄어비스,Economic
359,엔씨소프트   분기 영업이익    억원 전년      ,Economic
360,삼성생명   분기 당기순익     억원   전년     가까이 감소,Economic
361,한종희 삼성전자 사장  CES 기조연설   공존의 시대  강조,Economic
362,마트 밖으로 뺐던 전문점  다시 안으로  대형마트  뭉쳐야 산다 ,Economic
363,   만명 저조한 증가세에 디즈니플러스 허니문 끝났나     한국 등 론칭 성과 관건 ,Economic
364,지오엘리먼트  코스닥 상장 첫날 강세 상승률    대,Economic
365, 서울 아파트   채 중  채 가격 낮춰 팔아  헬리오시티   평  월     억   월      억,Economic
366,장중   만전자  하락    분할로 매수  vs   손절친다 ,Economic
367,SPC그룹  파리바게뜨 인도네시아  호점  아쉬타몰점  오픈,Economic
368,박용만  두 아들과 두산 떠났다,Economic
369, 수출입 동향    월     일 수출        증가  반도체       ,Economic
370,리복   년에  번  블프데이  진행 최대     할인,Economic
371,  월    일 수출       증가    개월 연속 성장  청신호  종합 ,Economic
372,코스피  인플레 우려에 장초반           선 한때     선 위협,Economic
373,  물가 급등에 원 달러 환율    원 오른     원,Economic
374,삼성전자  CES     서   개 혁신상 수상   최고혁신상에  개 제품 등극,Economic
375,한미약품  자체 개발 항암신약  글로벌 상용화에 속도 붙어 ,Economic
376,카카오게임즈  오딘    개월 연속  위 리니지M  M    위,Economic
377,게임빌  NFT 신사업 기대감에 급등 컴투스 동반 상승,Economic
378, 철도  사업 개편 조짐 보이는 북한  현대화  또 강조,Economic
379, 사내 급식 몰아주기  제재에 삼성전자 구내식당  개 외부업체에 맡겨,Economic
380,이마트  메타버스에서 개점   주년 기념식,Economic
381,SK네트웍스  EV     가입      년 넷제로 도전 ,Economic
382,요소수 주유소에서만 판매   승용차     화물차     한정,Economic
383, 진퇴양난   고물가에 부양책 쓰고 싶어도 못 써 ,Economic
384, 아파트 규제 강화에 풍선효과  오피스텔  역대급 거래량  호황,Economic
385,시의회  김헌동  부적격  의견냈지만   오세훈 시장 임명할 듯,Economic
386,삼성생명   분기 누적 당기순이익  조    억원       ,Economic
387,SK이노  CES      혁신상  관왕,Economic
388,머스크  주식 진짜 팔았다       만주 매도 ,Economic
389,당진 기지시 품은  당진 푸르지오 클라테르    월 일반 분양,Economic
390,이주열  높은 물가  당분간 지속   일시적일지도 의문 ,Economic
391,기아 카니발 YG  냉각수 누수로   만대 리콜,Economic
392,당근마켓  요소수 사기 불법거래 위험 알림 강화 ,Economic
393,대신    인플레  금융시장 충격 코스피     선 지지여부 봐야 ,Economic
394,코스피  인플레 우려에 약세로 출발 시총 상위주 대부분 하락,Economic
395,아파트 규제가 오피스텔 불질렀다 경기도 거래량 역대 최고,Economic
396,케이뱅크  중금리상품 금리 전격 인하 고신용자 제외,Economic
397, 먹는 것도 합격 전략   위드 코로나 후 첫 수능  컨디션 관리 위한  릴랙스 메뉴  어때요 ,Economic
398,인터파크  월간 최대 쇼핑 축제    월 인생주간  진행,Economic
399,국제유가 상승에 원유 석유제품 수입      껑충 종합 ,Economic
400,코스피  장 초반     선으로 밀려 LG화학    ,Economic
401,SK네트웍스  EV     가입      년 넷제로 도전 ,Economic
402,요소수 주유소에서만 판매   승용차     화물차     한정,Economic
403, 진퇴양난   고물가에 부양책 쓰고 싶어도 못 써 ,Economic
404, 아파트 규제 강화에 풍선효과  오피스텔  역대급 거래량  호황,Economic
405,시의회  김헌동  부적격  의견냈지만   오세훈 시장 임명할 듯,Economic
406,컴투스  새로운 성장 동력 확보에 목표주가  삼성증권,Economic
407,   만 유튜버 몸값은   억   카카오엔터   머니게임  진용진씨 채널 샀다,Economic
408,코스피  기관 매도   증시 약세에 하락 출발     선 초반대,Economic
409,한화큐셀  미국 텍사스서 ESS 단독 단지 첫 개발 나서,Economic
410,SK이노베이션 NCM  배터리  CES 혁신상   관왕,Economic
411,내년 집값 하락 없다 민간연구소 일제히 상승 전망  부동산    ,Economic
412,한은 총재  공급병목 유가상승 수요압력에 높은 물가상승률 당분간 지속 ,Economic
413,한국GM  쉐보레 서울서비스센터 재건축한다 지상  층 규모,Economic
414, 내일 기름 넣어야 하겠네    일부터 유류세     인하,Economic
415,코스피 코스닥 하락 출발   인플레이션 압력도 커져,Economic
416,환율   원 가량 올라     원대 중후반 상승,Economic
417,유진증권  SK하이닉스  내년 상반기까지 메모리 가격 하락으로 실적 부진   목표가는 상향 ,Economic
418,엔씨소프트   분기 매출 전분기          억원   한국 비중    ,Economic
419,코스피  거래일째 하락세     선으로 후퇴,Economic
420,    선까지 밀려난 코스피 불안한 투자심리  경계 가득 ,Economic
421, 원하는 일자리 없어요  그냥 쉬는 사람   만명 육박,Economic
422,르노 조에    월 독일 전기차  위 테슬라 모델  아이오닉   제쳐,Economic
423,이마트  개점 기념식을  메타버스 이마트타운 에서 ,Economic
424,GS    딸기 샌드위치  업그레이드   온라인 예약 주문 시작 ,Economic
425,요소수 주유소서 한 번에 최대    만 구매 가능,Economic
426,내일부터  개월간 유류세     인하 휘발유  당    원 경유    원 ,Economic
427,현대카드  프리미엄카드  아메리칸익스프레스  출시  연회비 최대    만원,Economic
428, 속보   월     일 수출       증가   일평균 기준       ,Economic
429,  월     일 수출       증가 일평균 기준        종합 ,Economic
430,아파트 대체재로 떠오른 오피스텔  올해 매매  역대 최다 ,Economic
431, 속보    월     일 수출액    억 달러 전년비       증가,Economic
432,한미반도체    억 규모 반도체 제조용 장비 수주 계약,Economic
433,코스피  하락 출발해      선   인플레이션 악재 ,Economic
434,삼성전자  사내식당 급식업체  곳 선정  점진적 전면 개방 ,Economic
435,탑코  디엠티 인수로 글로벌 사업 강화  탑툰 해외 공략 가속 ,Economic
436, 속보   월     일 수출    억  전년       증가,Economic
437, 급식 몰아주기  지적받은 삼성  사내식당  곳 추가 개방,Economic
438,파리바게뜨  인도네시아 공략  호  아쉬타몰점  개점,Economic
439,김헌동 SH 사장 후보자  부적격  오세훈  임명 강행  주목 ,Economic
440,테슬라 대항마  리비안   상장 하루만에 포드 GM 시총 넘어,Economic
441, 중국 물가 고공행진 인플레 수출효과 동반 ,Economic
442,알바생      급여주기 보고 근무 결정  월급 주급보다 시급 선호,Economic
443,광명  분양가          만원 시세 반값에 조합 반발,Economic
444,편의점 최장수 도시락      만개 팔렸다,Economic
445,메드팩토  면역항암학회서 바이오마커 연구성과 발표,Economic
446,신세계 경기점  리뉴얼 효과  톡톡  매출      껑충 ,Economic
447,북한산국립공원이 한 눈에 들어오는 광폭 테라스에 커뮤니티 시설까지  북한산 라파우제 분양,Economic
448, 위드코로나 에 재택 끝나니   슈트 매출 급증,Economic
449, 휘발유 내일 넣으세요      일부터 직영 알뜰주유소    원 인하,Economic
450,장외시장  후끈  증권업계 격전 예고,Economic
451, 주택시장 변곡점 오나     월 수도권 아파트 거래   채 중  채  하락 ,Economic
452,강세론자 제레미 시걸  인플레이션 향방   월 FOMC 회의가 좌우 ,Economic
453,옵션만기일  기관 대량 매물 쏟아내나,Economic
454,미국 물가급등에 바이든까지 등판 금융시장도  흔들 ,Economic
455,신한금투  HMM  운임  분기가 피크 투자의견  중립  유지 ,Economic
456, 호선 연장 등 교통호재 수혜 누려  다산 한강 프리미어 갤러리 에비뉴  눈길,Economic
457,기아 카니발 K    만    대 리콜 냉각수 누수 현상,Economic
458, 남혐 논란  조윤성 GS리테일 사장 물러날 듯 태광 에 무게,Economic
459,요소수 이어 오리털도  중국발 수급 불안     내년 패딩 가격 오르나,Economic
460,주성종합건설  테라팰리스 인덕원  차  이달 분양,Economic
461,삼성전자  내년에도 반도체 실적 소폭 개선 가능성 유진,Economic
462,IBK투자증권  펄어비스 검은사막 모바일 중국 진출 가능성 높아  목표가 상향,Economic
463,CJ제일제당   역대급 실적  이유 있었다,Economic
464, 백신 미접종자의 유행병    재유행 패닉  독일  미접종자 공개 비판,Economic
465,카니발 K   냉각수 누수로 화재 가능성    약   만대 리콜,Economic
466,브랜디  누적거래액  조 돌파  제 의 무신사 될까 ,Economic
467, 인플레에   중저소득층 불만 높아 백악관  공급망 문제에 사활 ,Economic
468,당근마켓  요소수 나눔 독려  불법행위 강경 대응할 것 ,Economic
469,김헌동 SH사장 후보  부적격     가능한 빨리 임명 ,Economic
470, 적자탈출에 사활   롯데손해보험  삼성화재 인재영입 재시작,Economic
471, 소비자가 만든 레시피      대 입맛 확 사로잡았다 ,Economic
472,올 겨울  특히 마스크 환기  방역수칙  중요한 이유는 ,Economic
473,내일부터 유류세     인하   휘발유  당    원 경유    원 ,Economic
474,삼성전자  사내식당 급식업체  곳 선정  점진적 전면 개방 ,Economic
475,요소수  연말까지 주유소에서만 판매 정부  긴급수급조정조치  시행,Economic
476,당근마켓   선한 요소수 나눔 독려  불법엔 강경 대응 ,Economic
477,롯데  크라우드 펀딩 플랫폼  와디즈 에    억 투자,Economic
478, 이제 좀 반등하려는데   바이오 에 찬물 끼얹은 식약처,Economic
479,제주영어교육도시 인근  제주국제학교 아이비스     분양,Economic
480, 소비자가 만든 레시피 통했다  농심  카구리 큰사발면  흥행,Economic
481,SK이노베이션 NCM  배터리  CES 혁신상   개 수상,Economic
482,종로 삼청공원 입구에 주차장 짓는다,Economic
483,에어부산    개월만에 부산 괌 노선 운항 재개,Economic
484,롯데칠성  맥주 사업 흑자 전환 예상 목표가  신한금투,Economic
485,   물가 끌어올린 에너지 내년  분기까지 가격 압력 ,Economic
486,한화큐셀    텍사스서 첫 ESS 단독 단지 개발,Economic
487,내일부터 유류세     인하 휘발유  당    원 경유    원 ,Economic
488,에어부산    개월 만에 부산 괌 노선 운항 재개  국제선 확대할 것 ,Economic
489,조광ILI  정부 수소경제 활성화 수혜 기대 키움,Economic
490,승용차 요소수  주유소에서    씩 판다 내년 월까지 관세 면제,Economic
491,이주열  높은 물가상승률  당분간 지속될 전망 ,Economic
492, 제 의 테슬라  리비안 상장  수혜주 옥석 가려야 ,Economic
493,SK이노  포드 F     라이트닝 탑재 NCM  배터리  CES 혁신상 ,Economic
494,넷플릭스 드라마  오징어게임  신드롬 블랙푸드 수혜 톡톡,Economic
495,요소수 판매처  당분간 주유소만 일반 차량은 최대   리터까지,Economic
496,한종희 삼성전자 사장 내년 CES 기조연설 나선다,Economic
497,동양생명  배당수익률      보험주 중 가장 높아 목표가  한화투자,Economic
498,   월 옵션만기일  금융투자기관  대량 매물 쏟아내나,Economic
499,선데이토즈   분기 영업익   억 전년비       ,Economic
500, 먹는  코로나 치료제 나오는데 우리는 언제 ,Economic
501,    기후변화 대응 협력할 것   깜짝  공동성언,Economic
502,툴젠  증권신고서 제출  연내 코스닥 이전 상장 목표 ,Economic
503, 한화  자체 개발 항법장치 민수 분야 진출,Economic
504,동아오츠카  수능 당일 이온음료 꼭 챙기세요  ,Economic
505,   물가 끌어올린 에너지 내년  분기까지 가격 압력 ,Economic
506,한화큐셀    텍사스서 첫 ESS 단독 단지 개발,Economic
507,내일부터 유류세     인하 휘발유  당    원 경유    원 ,Economic
508,에어부산    개월 만에 부산 괌 노선 운항 재개  국제선 확대할 것 ,Economic
509,조광ILI  정부 수소경제 활성화 수혜 기대 키움,Economic
510,승용차 요소수  주유소에서    씩 판다 내년 월까지 관세 면제,Economic
511,이주열  높은 물가상승률  당분간 지속될 전망 ,Economic
512, 제 의 테슬라  리비안 상장  수혜주 옥석 가려야 ,Economic
513,SK이노  포드 F     라이트닝 탑재 NCM  배터리  CES 혁신상 ,Economic
514,넷플릭스 드라마  오징어게임  신드롬 블랙푸드 수혜 톡톡,Economic
515,요소수 판매처  당분간 주유소만 일반 차량은 최대   리터까지,Economic
516,현대카드   현대 아메리칸 익스프레스 카드  출시  무제한 멤버십 리워즈 제공 ,Economic
517, 배터리 분리막 가치 반영 못해  SK이노베이션 목표가  쑥 ,Economic
518,요소수  주유소에서만 판매    승용차 최대   L까지,Economic
519, 라이트코인  시총 TOP   재진입할 것 ,Economic
520,세븐일레븐    찬 도시락    초마다  개씩 팔렸다,Economic
521,요소수 주유소서 한번에 최대    만 구매 김부겸  긴급수급조정 조치 시행 ,Economic
522,파미노젠  장뇌축 염증성 장 질환 치료제 특허 출원,Economic
523, 가을 보양식 준비하세요  롯데마트   활 전복 대게  할인 행사,Economic
524,제네시스  맨해튼에 복합문화공간  제네시스 하우스 뉴욕  오픈,Economic
525,신한금투  컴투스 목표가 상향 신작게임 메타버스 플랫폼 기대,Economic
526,미 인플레  연말까지 심화되고 내년  분기부터 완화 예상,Economic
527, 헝다 또 디폴트 모면   일 데드라인 달러채 이자 지급 ,Economic
528,리비안  화려한 나스닥 데뷔 장중 시총     억달러 넘었다,Economic
529,에어부산  부산 괌 노선 재개    일부터 주  회 운항,Economic
530,엔씨소프트  분기 영업익    억원 작년동기비        종합 ,Economic
531,관리비 절감에 친환경까지  건설사에도  ESG  바람,Economic
532,요소수 수급 대란 숨통 트였지만  전담팀 꾸려 대응 ,Economic
533,GKL  업황 악화에도 인건비 그대로  Q 부진 심화 현대차 ,Economic
534, 김대호 박사의 오늘 기업 사람  테슬라 LX인터내셔널 애플 두산,Economic
535, 오리온  실적 모멘텀 재부각   과도한 저평가  NH ,Economic
536,정부  요소수  긴급수급조정조치  시행 차량당 구매량 제한,Economic
537,요소수 품귀 여수산단 물류  빨간불 ,Economic
538,LG  구광모 회장 단독 대표체제로 전환   이달말 권영수 후임 인사에 주목,Economic
539, 실적 부진 셀트리온 목표주가 내려 ,Economic
540,차량용 요소수 주유소서만 판매  승용차  대당   리터 제한 긴급수급조정조치,Economic
541,KB   가격 상승 압력 고조  CPI 추가 상승 경계해야 ,Economic
542,펄어비스  검은사막 모바일  출시 기대감  신한금투,Economic
543,한화큐셀    텍사스서 첫 ESS단독 단지 개발 진행,Economic
544, 첫눈 왔으니 이제 김장해야겠네   김장 도우미  제품 어떤 게 있나,Economic
545,신한금투  컴투스 목표가 상향 신작게임 메타버스 플랫폼 기대,Economic
546, 뉴스체크 경제  전통시장  인 김장 비용   만원,Economic
547,신세계 경기점  리뉴얼 효과 덕에 올해 매출      ,Economic
548,  억 받고  직원   명중  명 짐쌌다  파격 특별퇴직금에 씨티은행 희망퇴직 폭주,Economic
549,   현대차 엔진결함 내부고발자에     억원  포상 역대 최대,Economic
550,한은 총재  높은 소비자물가 상승률 당분간 지속될 것 ,Economic
551, 한미 디커플링 해소 조건 미 증시 조정 받아야 ,Economic
552, 수능 당일 이온음료 꼭 챙기세요  컨디션을 위한 준비물은 ,Economic
553, 반값아파트   상가 매출 축소 공사비 부풀리기 정황 또 확인 시민단체  고발키로,Economic
554, 뉴욕 한복판에  전통 살린  제네시스   복합문화공간 첫 개관,Economic
555,한화큐셀   텍사스서 첫 ESS 단독단지 개발   하루   만    명 사용분 ,Economic
556,넷마블  메타버스 진출로  성장동력 기대 삼성,Economic
557, 이슈분석  미 물가상승 압박 최고치 인플레 공포 증시 덮치나,Economic
558,     만개 판매 오리온  참붕어빵  오징어게임 덕 봤다 ,Economic
559,내일부터 유류세     인하 휘발유  당    원 경유    원 ,Economic
560,  억 파격조건에  소매금융 청산 씨티은행  희망퇴직     명 신청,Economic
561,휴젤   Q 실적 기대치 하회 허가 취소 이슈 부담 목표가  삼성 ,Economic
562,카카오페이  MTS 오픈시 이용자수  천만명 확대 전망 메리츠증권,Economic
563, 클릭 e종목   게임빌  NFT 메타버스 종합 플랫폼 업체로 도약 ,Economic
564,유진투자증권  실적 부진 셀트리온 목표주가 내려 ,Economic
565,서울시의회  김헌동 SH 사장 후보자  부적격  의결  임명 강행할까,Economic
566,김총리  요소수 긴급수급조치 시행 수급 정상화에 시간 필요 ,Economic
567,르노삼성 XM  수출로 회복 시동 지역 부품업계는 ,Economic
568,기아 카니발 등  개 차종   만  천여대 리콜,Economic
569,HMM   Q 역대급 실적 주가 하락 과도 대신 ,Economic
570,요소수 연말까지 주유소서 승용차당 한 번에 최대    만 구매가능,Economic
571,휴젤  국가 출하승인 지연으로 내수 매출 감소 목표가  삼성,Economic
572,김 총리  요소수 수급 정상화  시간 필요 국민 불편 송구 ,Economic
573,한은 총재  예상넘는 소비자물가 상승률  당분간 지속 ,Economic
574,리비안  상장 첫날 시총     억달러 돌파   GM 포드 넘었다 ,Economic
575,알펜시아 담합 의혹 집중 추궁  매각 일정 불변 ,Economic
576,  IT업계  반도체 자료 요구 외국서 답습 우려,Economic
577,펄어비스  검은사막   출시 임박 기대감 유효 신한,Economic
578,  법인 전략 우려 장기적  증권가  코스맥스 목표가 줄하향,Economic
579, 뉴스새벽배송  증시 덮친 인플레 우려   월 소비자물가  급등 ,Economic
580, 요소 싸게 들여와라    공업용 요소  내년 월까지 관세 안 물린다,Economic
581, 투자노트  위드코로나 시대와 저비용항공사 LCC  주가,Economic
582,KT  G 사흘간이나 멈췄는데 안 알렸다 방통위의 반응,Economic
583,인플레이션에   증시 하락   다시 커지는 불안 심리,Economic
584,요소수 주유소에서만 판다 승용차   L 화물차   L까지 구매 가능,Economic
585,GKL  외국인 유입 없이는 실적 회복 불가능  현대차,Economic
586,뉴욕증시  소비자물가 급등에 하락   테슬라   대 반등,Economic
587,차량용 요소수 주유소에서만 판매   승용차  대당 한 번에    만 살 수 있다,Economic
588,에어부산  부산 괌 노선 운항 재개 국제선 하늘길 기지개,Economic
589,이주열 한은 총재  예상보다 큰 물가상승 당분간 지속 ,Economic
590,셀트리온   분기 실적 시장 기대치 하회 목표가  KTB,Economic
591,이주열  예상보다 높은 소비자물가상승률 당분간 지속될 것 ,Economic
592,카카오페이  이용자     만 금융플랫폼 도약 기대감  메리츠,Economic
593, 글로벌 비즈      헝다 천천히 분해 자산 자국 기업 매각 등 작업 진행 ,Economic
594,뉴욕 한복판에  제네시스 하우스  들어선다,Economic
