,title,category
584, 냉탕온탕  이윤재 김철웅 천종윤  전영현 권봉석 공기영 ,Economic
585, 대한해협     신격호    년  열정은 잠들지 않는다 ,Economic
586,물적분할 발표 후 주가 추락  SK케미칼 주주들 뿔났다,Economic
587,울산 남구 대체주거지로 각광받는  덕하지구   후속 분양 단지 어디 ,Economic
588, 특화 설계 통해 고객 집객력   탕정역 역세권 상가  젤존시티  분양,Economic
589,수도권 상위     아파트값   대출 금지선    억원 넘었다,Economic
590, 친절한 경제  삼성   SK에 반도체 자료 달라고 한 미국  왜 그런 걸까,Economic
591,연준   부동산 위기  세계 및  경제에 악영향 끼칠수도 ,Economic
592,한미 재계  글로벌 반도체 배터리 공급망 재편시 기업비밀 보호해야 ,Economic
593,OK저축은행  하루만 맡겨도 연      정기예금 특판,Economic
594, 단독 머지포인트 소비자 분쟁조정 신청     명 넘었다 역대 최대 규모,Economic
595,롯데마트   네모난 사과 샤인감귤  이색 과일 개발 확대,Economic
596, 반도체 전문가  양향자     반도체 패권 쥔  와 한 배 타야 ,Economic
597,GS건설   익산자이 그랜드파크      가구 이달 분양,Economic
598, 위드코로나 효과 톡톡  대구 호텔업계 예약률 껑충  웃음꽃 ,Economic
599,한미경제계  기업 자율성 기밀 보호하며 글로벌 공급망 재건 ,Economic
600, 번 외식  만원 환급 신용카드 외식 할인   일로 종료,Economic
601,배민 요기요 쿠팡이츠    월까지 누적 결제액     조 원,Economic
602,GS건설   익산자이 그랜드파크       가구 분양,Economic
603,타타대우상용차  CJ대한통운과 공급 계약 트럭   대 공급,Economic
604, 조선업계    월 선박수주  위   세계 발주량     자치,Economic
605, 클라우드 사업 등 호조   분기 역대 최대 실적 기록한 NHN,Economic
606, 고객정보는 제외  삼성 SK 미 상무부에 반도체 자료 제출 종합 ,Economic
607,두산위브    월에만  개 단지     가구 공급,Economic
608,창사   년 만에 지아이텍  월 최대 출하량 기록,Economic
609,금융당국   보험대리점 에 칼 빼드나    차 배상책임 도 검토,Economic
610, 단독   충여회를 아시나요  윤석열 대선후보 확정에 관심집중,Economic
611,사각사과 샤인감귤 롯데마트 빼빼로데이에 달콤한 이색과일 판매,Economic
612,무섭게 오르는 대출금리에  은행 폭리 막아달라  국민청원까지,Economic
613,금감원  키움 메리츠  등 증권사들에  경영유의 조치 ,Economic
614,현대중공업      억 규모 차세대 이지스함  번함 수주,Economic
615, 위드코로나에 외식 폭발     억 소비쿠폰 열흘 만에 소진,Economic
616,삼성전자 SK하이닉스  민감 정보 빼고 반도체 자료   제출,Economic
617,요소 만 톤 수입 추진 산업용 요소 대체 여부 주말 결론,Economic
618,신규확진     명 주말효과 걷히면  핼러윈 후폭풍  오나,Economic
619,위중증 환자    명   일 만에 최고치 신규 확진      명,Economic
620,  조선    월 선박 수주  위 전 세계      싹쓸이 ,Economic
621,집에서도 쉽게 칼 주름 잡는다 테팔  스팀다리미 ,Economic
622,삼성 SK  에 반도체 정보 제출  고객사 정보 재고량 제외  종합 ,Economic
623,여기도 오징어게임 열풍   CU  몽골 말레이시아에 달고나 수출,Economic
624,은행  신탁 군침 흘리지만  대장동사태 로 역풍 맞나,Economic
625, 단독  MBK파트너스 코리아센터 투자 다나와 인수 동시 추진,Economic
626,엔케이맥스   표적형 NK세포치료제  공동임상 본격화,Economic
627,외식에 일주일간 카드    만건 긁었다 내일 할인사업 종료,Economic
628, 조선사들  지난달 싹쓸이 수주   밀어내고  위 복귀,Economic
629,금융당국   보험대리점 에 칼 빼드나    차 배상책임 도 검토,Economic
630, 단독   충여회를 아시나요  윤석열 대선후보 확정에 관심집중,Economic
631,사각사과 샤인감귤 롯데마트 빼빼로데이에 달콤한 이색과일 판매,Economic
632,무섭게 오르는 대출금리에  은행 폭리 막아달라  국민청원까지,Economic
633,이즈미디어    월 K 콘텐츠 NFT 플랫폼 출시 기대감에  상승 ,Economic
634, 속보 신규확진     명 지난주 대비    명 증가,Economic
635,스카이라이프   분기 영업익    억 전년비        ,Economic
636,SK바이오사이언스  노바백스 백신 허가 전망에 상승,Economic
637,금호건설  LH 설계공모 당선 검단에    세대 아파트 짓는다,Economic
638,김헌동    년치 SH 분양원가 공개 강남에  억 아파트 건설 ,Economic
639,롯데하이마트 온라인쇼핑몰  연중 최대 혜택 주는  쎄일하마  행사 인기,Economic
640,하얏트 호텔앤리조트  글로벌 객실 특가 프로모션 최대     할인,Economic
641,직장인   명중  명  위드코로나  감염위험 크게 우려 ,Economic
642,코스피  기관 외인 매수에 장 초반      대 상승 종합 ,Economic
643,셀트리온   렉키로나  승인 권고 안건 상정 소식에 UP,Economic
644, 핫이슈 키워드  여야정 삼각충돌   대   민생토론 김종인 선대위 대통령 딸 청 관저살이,Economic
645,에너지 대란에 뜨거운 원전주   한전기술   주 신고가,Economic
646,두산밥캣    인프라 법안 통과 소식에   대 강세,Economic
647,바텍   Q 영업익    억원 전년        증가,Economic
648,코스피 상승세   기관 외인 쌍끌이 순매수,Economic
649,  G 요금제 다양화  아직  감감  시니어요금제 우선해야,Economic
650,삼성전자 SK하이닉스    상무부에 반도체 자료 제출,Economic
651,헬릭스미스  엔젠시스의 샤르코마리투스병 국내 임상    a상 탑라인 결과 발표,Economic
652,수도권 영역 넓히는 대형병원  부동산도 덩달아 들썩,Economic
653, 은행 폭리 막아달라  치솟는 금리에 청와대 청원까지 등장,Economic
654,쉐이크쉑  크리스마스 시즌 맞아  블랙 트러플 시리즈  재출시,Economic
655,신세계푸드  내년 노브랜드버거 흑자 전환 전망 한화투자증권,Economic
656,요소 만 톤 수입 추진 산업용 요소 대체 여부 주말 결론,Economic
657,아이파크몰  카카오페이로 현장 결제시     원 즉시 할인,Economic
658,  번가   대한민국 숙박대전  동참    만여개 국내 숙박 쿠폰 제공,Economic
659,삼성전자  고객 정보 제외한 반도체 자료 미국 상무부에 제출 ,Economic
660, 익산자이 그랜드파크  이달 분양 예정,Economic
661,급등했던 항공 여행 리오프닝      대 하락,Economic
662, 한진  폐페트병 재활용한 친환경 유니폼 도입,Economic
663,반도체 영업 기밀 내놓으라는   삼성 SK  민감한 정보는 뺐다,Economic
664,CU  오징어게임  달고나  몽골 말레이시아에 수출,Economic
665,화이자 알약에 휘청였던 제약 바이오주   반발매수 유입에 반등,Economic
666,씨티그룹  한국씨티은행 철수에    조원 쓴다  장기적으로 이익 ,Economic
667, 개월간 연      OK저축    중도해지OK정기예금    ,Economic
668,현대   차세대 이지스함 선도함 이어  번함도 수주,Economic
669,  G 요금제 다양화  아직  감감  시니어요금제 우선해야,Economic
670,삼성전자 SK하이닉스    상무부에 반도체 자료 제출,Economic
671,헬릭스미스  엔젠시스의 샤르코마리투스병 국내 임상    a상 탑라인 결과 발표,Economic
672,SK바이오사이언스  노바백스 허가 전망에    상승,Economic
673,실손보험 가입자      고액 수령    는 연간 한 번도 안 받아,Economic
674,환율  글로벌 달러 약세에 이틀째 하락     원 수준 등락,Economic
675,NAVER  내년 실적 성장 전망에 장초반 상승,Economic
676,비트코인      만원 재돌파   사상 최고가 경신,Economic
677, 억 분양 현재   억  결혼 발표  이시언  상도동 아파트도 화제,Economic
678,연내 지방 공공택지 아파트 공급 활기     여 가구 분양 앞둬,Economic
679, 만원 돌려받는  외식할인  내일 끝난다    억 예산 소진 전망,Economic
680,코스피  외국인 기관  사자 에 상승세  인프라 종목 강세 예상 ,Economic
681, 중국이 통화 완화로 방향 틀면 코스피에도 볕 들 것 ,Economic
682,NHN 분기 최대 실적  매출     억 영업익    억  페이코 견인 ,Economic
683,김헌동    년치 SH 분양원가 공개할 것    억 아파트로  영끌  막겠다 ,Economic
684, 단독  fn마켓워치 SM그룹  창명해운 품었다,Economic
685, 인프라법 하면 이 주식이지    두산밥캣 이틀째 급등,Economic
686,하나금투  에코프로비엠  폭발적 이익성장에 고멀티플 정당화 ,Economic
687,동부건설  여주역 센트레빌 트리니체  평균      대   마감,Economic
688,현대중공업  차세대 이지스함  번함 수주,Economic
689,    개  조합 이끈 가로주택정비사업   신청쇄도  흥행비결은 ,Economic
690,천보  글로벌 LFP 침투율 상승에 수혜  목표가 ,Economic
691,연내 지방 공공택지      가구 분양 대전,Economic
692,SK바이오사이언스  노바백스 허가 전망에    상승,Economic
693,실손보험 가입자      고액 수령    는 연간 한 번도 안 받아,Economic
694,신한금투  국내 주식 비중 유지해야 반도체 자동차 소비주 관심 ,Economic
695, 자막뉴스   급등 종목 알려준다     연회비 내고도  손실     ,Economic
696,김치가 왜 거기서 나와    김장 김치 주문 받는 편의점,Economic
697, 엘앤에프  가파른 이익 성장세 목표 시총   조  하나금투,Economic
698, 집값 공약은  이재명  기본주택  vs 윤석열  규제완화 ,Economic
699,NHN  분기기준 최대 실적 결제 광고매출만  천억원 종합 ,Economic
700, 월급은 용돈인가  금융 임대소득 연간     만원 이상  고소득 직장인    만명 넘어,Economic
701,현대    꿈의 구축함  차세대 이지스  번함 수주,Economic
702,씨티은행  한국 철수에 최대    조원 부담 예상,Economic
703,현대   차세대  광개토급  이지스함 수주 종합 ,Economic
704, 비트코인 투더 문  비트코인       달러 돌파   사상 최고가 경신,Economic
705,하나카드    월 알리익스프레스 이용고객 최대     혜택 제공,Economic
706,크래프톤 배그 모바일  항저우 아시안게임 이스포츠 종목 선정,Economic
707, 헬스케어 빅데이터  날개 펴는 일본 JMDC,Economic
708,최저임금 논쟁은 세계의 싸움터 올 노벨경제학상은 어떤 주장했나,Economic
709,평택 고덕  차 아이파크  내일   일 까지 정당계약,Economic
710, 키즈카페 아녜요  핀란드엔 누구나  아무때나  열린 어린이집 ,Economic
711,공공지원 민간임대주택  시흥 장현 서희스타힐스  임차인 모집 공고 임박,Economic
712, 요소수 사기  주의보 중고나라 당근마켓서 기승,Economic
713,원 달러 환율    원 내린       원 출발,Economic
714,현대       억 규모 차세대 이지스함 건조계약 체결,Economic
715,한미경제계  기업 자율성 기밀 보호하며 세계공급망 재건해야 ,Economic
716,NH투자증권  구리 선물 ETN  종 상장,Economic
717,한국투자증권  신작 흥행 엔씨소프트 목표가 상향 ,Economic
718,  번가  대한민국 숙박대전 동참  할인쿠폰 받고 여행가세요 ,Economic
719, 오징어게임  달고나  몽골 말레이시아 CU에서도 판다,Economic
720,롯데마트  초고당도 자랑하는  샤인감귤  만나보세요 ,Economic
721, 조니워커 블루   럭셔리 위스키의 깊이를 전하는 브랜드 캠페인,Economic
722,주택 시장  큰 손      세대  학세권 단지 선호도 높아     공주 유구 줌파크  분양에 기대감 몰려,Economic
723,바이오파마   우량 제약 바이오 기업 IR 서 신약 개발 핵심사업 소개,Economic
724,오피스텔도 국민평형    전용     판상형  인기 ,Economic
725,현대중공업  차세대 이지스함  번함 수주     억 규모,Economic
726,만하트     마력을 자랑하는 MHX      공개,Economic
727,디지털 환경의 새로운 독점 기준은 ,Economic
728,최저임금 논쟁은 세계의 싸움터 올 노벨경제학상은 어떤 주장했나,Economic
729,평택 고덕  차 아이파크  내일   일 까지 정당계약,Economic
730, 키즈카페 아녜요  핀란드엔 누구나  아무때나  열린 어린이집 ,Economic
731,공공지원 민간임대주택  시흥 장현 서희스타힐스  임차인 모집 공고 임박,Economic
732,카카오  카카오엔터 IPO 기대감 쑥   현대차증권  목표주가   만원,Economic
733, 힐스테이트 앞산 센트럴   일 해당지역  순위 청약 진행,Economic
734,제노레이   분기 영업익   억 전년비        ,Economic
735,솔루스첨단소재  글로벌 배터리 시장 성장 수혜 하나금융투자,Economic
736,대양금속  영업익   억      성장   분기 최대 실적 ,Economic
737, 단독  재도전 끝에   월계  미 미 삼   예비안전진단 통과,Economic
738,신한금투  CJ대한통운 목표가 하향  분기 택배 점유율 관건,Economic
739,삼성 SK  마감 당일  에 반도체 자료 제출 기밀정보는 제외,Economic
740,포드    년만에 주가   달러 돌파 전기차 기대감,Economic
741, 변동성 구간 내년 인플레 완화 수혜 업종 비중 늘려야 ,Economic
742,매연저감용 촉매 관세           vs 한국      탄소중립 정책 역행 ,Economic
743,대양금속   분기 영업익 분기 최대 전년비      ,Economic
744, 적자  실손보험 과잉진료 심각   만명 보험금     만원 수령,Economic
745,이더리움      달러 넘어서며  사상 최고가  비트코인도  최고 ,Economic
746,  분전략  한미 디커플링 심화 오늘 장 전망은 ,Economic
747,현대중공업      억 규모 광개토 III Batch II 후속함 건조 계약,Economic
748, 는 오르는데  은 내리막길 디커플링  지속 ,Economic
749,천보  LFP 배터리 침투율 상승으로 추가 수혜 목표가  하나금투,Economic
750,현대차   카카오  카카오엔터 내년 상반기 상장 돌입에 주목 ,Economic
751, 회사 다닐 맛 나네  유연한 조직문화 형성 나선 금호석화,Economic
752,김헌동 SH사장 후보자  서울 강남에  억 아파트 공급 집값 반드시 잡겠다 ,Economic
753,문승욱 산업장관  오늘 방미 반도체 공급망 정보 철강 등 논의,Economic
754, 단독  오징어게임 특수 누리자  삼양식품  뿌셔삼양 라면스낵  출시,Economic
755,삼성 SK  미국에 반도체 자료 제출   민감정보 제외 ,Economic
756,정비사업 사활 건 대형 건설사  브랜드타운 거듭난다,Economic
757,아비코전자  DDR 가 실적 개선 재료 고성장세 기대 SK,Economic
758,삼성바이오로직스  세계시장 CDMO 파트너 찾는다,Economic
759,삼성 SK  고객 기밀정보 뺀 반도체 자료 미국 제출,Economic
760,KB증권  삼성SDI  원형전지 수요 확대 긍정적 ,Economic
761,현대홈쇼핑  원가율 쇼크 부정적   한화투자증권  목표주가   만     원,Economic
762, 먹는 코로나 치료제 나온다   위드코로나 관련주  강세 ,Economic
763,중흥그룹  대우건설 노조에  업계 톱   연봉 수준으로 인상 제안,Economic
764,증권사들  CJ제일제당 수익성 악화 목표주가 하향 ,Economic
765,이재명 윤석열 재난지원금 격돌  나랏빚 증가  위  Vs  K 재정 탄탄 ,Economic
766,  블랙박스  반도체도 부족한데 요소수까지  우려커진 완성차업계,Economic
767,동부건설   여주역 센트레빌 트리니체  평균      대    역대 최고 경쟁률,Economic
768, 속보  삼성전자 SK하이닉스  미 상무부에 반도체 자료 제출 ,Economic
769,KB    리비안 수혜주  삼성SDI  긍정적 주가흐름 기대 ,Economic
770, 투자노트  사상 최고가 갈아치운 루이비통과 에르메스,Economic
771,대우건설 노조 만난 중흥그룹   업계 최고 임금  파격 제안,Economic
772,엔케이맥스   표적형 NK세포치료제  공동임상 본격화,Economic
773,연준 부의장  경제전망 옳다면  내년 말 금리인상 조건 만족 ,Economic
774, 김대호 박사의 오늘 기업 사람  소프트뱅크그룹 SK바이오사이언스 삼성전자 롯데정밀화학,Economic
775,씨티그룹  한국 철수에 인건비 등 최대    조 지출,Economic
776,들어는 봤나 고사리마늘파스타  극강의 채소맛  비건족 홀린다,Economic
777,덕산네오룩스  성수기 힘입어    분기 실적 컨센서스 상회 신한금투,Economic
778, 터치스크린 뺐어요    반도체칩 대란에 BMW  고육지책 ,Economic
779, 위드코로나에 호텔 본격 회복 규모별 실적 차별화 ,Economic
780,엘앤에프  목표 시총   조원  목표가   하나,Economic
781,헝다  또다시 부도 위기  전용 제트기까지 매각,Economic
782, 여주역 센트레빌 트리니체   순위 청약       대   ,Economic
783,    전략  무장한 삼성바이오로직스  글로벌 세일즈 나선다,Economic
784,최고    만원 소득월액 보험료 내는 직장인     명,Economic
785,선정땐     계약해지땐      정비사업 둘러싼 시공사 교체 바람,Economic
786, 메타버스 대장주  로블록스 시간외 폭등    Q 호실적 공개,Economic
787,실손보험 믿고 과잉진료  가입자   가     만원 넘게 타갔다,Economic
788, 이날만 기다렸다    위드코로나  첫 주말에   만명 몰린 제주공항,Economic
789,온동네 개발열풍 이촌동  강남 추월    집코노미TV ,Economic
790, 한국 잠재성장률은 꼴찌 빚 증가 속도는  등 전망 ,Economic
791,대우건설 노조 만난 중흥그룹   업계 최고 임금  파격 제안,Economic
792,머스크 보유주식 처분 가능성 우려에 테슬라 주가    하락,Economic
793,알파벳 시총  조달러 클럽 가입   MS  애플 이어 세번째,Economic
794, 외환브리핑 인프라법 통과에  증시 최고 환율 이틀째 하락할 듯,Economic
795, 뉴스체크 경제  신공항 예정 가덕도 건축허가 급증,Economic
796, 변동성 장세 지속  가격 조정된 반도체 자동차 담아라 ,Economic
797, 이슈분석   나 지금 떨고 있니  종부세 공습 임박한 부동산 시장,Economic
798, 테슬라 주식 처분 따르겠다  머스크 트윗 한 방에    빠졌다,Economic
799,한투증권  엔씨소프트 극초반 일매출액    억원 육박 가능성,Economic
800, 속보  삼성전자 SK하이닉스  미국 반도체 공급망 정보 제출,Economic
801,CJ대한통운  이커머스 사업  Q 택배 점유율에 달린 주가 목표가  신한,Economic
802,케이카    중고차 업체 견조한 주가흐름 따라갈 것  유안타,Economic
803,쌀값 하락 우려에 벼 매수세 뚝  농협에만 집중 출하 ,Economic
804,유안타   케이카  중고차 호황 최대 수혜주 ,Economic
805,CNN  화이자  이르면 이번주 부스터샷 대상 모든 성인 확대 요구 ,Economic
806, 빅데이터MSI  일 오전 주식시장 심리  단계  매우 좋음 ,Economic
807,요소수 대란에 울산 물류 자동차업계 비상,Economic
808, 클릭 e종목   대우건설  푸르지오 브랜드의 경쟁력 재확인 ,Economic
809,아이원스   분기 사상 최대 분기 실적  저평가 영역  NH,Economic
810,인플레 우려에 암호화폐 랠리  이더리움  사상 최고가 경신,Economic
811, 국경개방 인프라  통과  환호     또 최고치  뉴욕마감  종합 ,Economic
812,한전   송전탑 백지화 불가 이번 주 고비 ,Economic
813,머스크  지분 매각 할까   테슬라    급락해  천백슬라 로,Economic
814,강원도 휘발유 가격      원 돌파 재고 요소수 변수,Economic
815,플라스틱없는 카페 어때요  환경 소비가 대세,Economic
816, 글로벌 비즈    스타벅스 첫 노조 투표 진행 직원  백명 참여,Economic
817, 클릭 e종목  케이카  중고차 시장 최대 수혜주 ,Economic
818, 주식     팔까요  머스크 트윗에 테슬라 주가    급락,Economic
819,덕산네오룩스  연말 비수기는 적극 비중확대 기회 키움,Economic
820, 제갈길 간다  새 주인 품은 G마켓 인터파크 연동 티켓예매 종료,Economic
821,실손보험 가입자   가     만원 이상 수령    는  원,Economic
822,검암역 로열파크씨티 푸르지오   대한민국 최초 하이엔드 리조트 도시 로 조성,Economic
823,배터리 회사와 협업하고  연구센터 짓고  꿈의 배터리 를 위한 현대차의 도전,Economic
824,엔씨소프트   리니지W  초기 흥행 주목  매수   한국,Economic
825,엔비디아  메타버스 환경의 최대 수혜 반도체 업체 하이,Economic
826,마약 반입 많은 곳인데  특송물류센터 직원도 딴짓 ,Economic
827, 뉴스새벽배송   증시 또 사상 최고 테슬라는 급락,Economic
828, 클릭e종목  LG디스플레이   분기 실적 개선 기대 ,Economic
829,플라스틱없는 카페 어때요  환경 소비가 대세,Economic
830,인플레 우려에 암호화폐 랠리  이더리움  사상 최고가 경신,Economic
831, 국경개방 인프라  통과  환호     또 최고치  뉴욕마감  종합 ,Economic
832,한전   송전탑 백지화 불가 이번 주 고비 ,Economic
833,머스크  지분 매각 할까   테슬라    급락해  천백슬라 로,Economic
834, 재택플러스  요소수 대란인데 웬  정관수술 ,Economic
835, 렉키로나 한계   주가 반토막   세 경영과 함께 난관 부딪힌 셀트리온,Economic
836,철강업도 새 차도 대중교통도 요소수 품귀에  발 동동 ,Economic
837,삼성SDI  EV용 원형전지 채택  리비안    나스닥 상장 수혜 KB,Economic
838,뉴욕증시  인프라 법안 통과에 상승 S P          첫 돌파 마감,Economic
839,국채선물 패대기 멈춘 외국인 국고채 금리도 안정될까,Economic
840,직장인   명 중  명  위드 코로나 걱정   이유는  감염 확산 ,Economic
841,메가스터디교육  구조적 실적 성장세 전망  NH,Economic
842,뉴욕증시  인프라 법안 통과에 상승  대 지수 최고치 마감,Economic
843, 클릭 e종목  비에이치  내년 역대급 실적 내놓을 것 ,Economic
844, 재택플러스  민간 임대로 쏠리는 눈 이유는 ,Economic
845, 억짜리가 지금   억 이시언 결혼에 청약 당첨 아파트 관심,Economic
846, 클릭 e종목   삼성SDI  원형전지 수요 강세의 수혜 대상 ,Economic
847,요소수 대책에도 곳곳 혼란 매점매석에 판매사기까지,Economic
848, 조간브리핑     전국민 재난지원금  vs    손실 전액 보상  정부는 둘다 반대,Economic
849, 삼성SDI  원형전지 사용처의 지속적 확대에 주목  KB,Economic
850,오는   일 공공분양  차 사전청약 공고   차에   만명 운집,Economic
851,대출로  똘똘한 한 채  마련하면 행복할까요  더 머니이스트 최원철의 미래집 ,Economic
852,머스크 지분 매각 전망에 테슬라 주가 급락,Economic
853, 다초점 백내장 수술 도수치료 영양주사  비급여 진료 증가에 전체 가입자 손실보험료 갈수록 늘어,Economic
854,     만명 가입  실손보험   만명이     만원 타갔다,Economic
855,한국이 나랏빚 증가  위  IMF의 진짜 경고는 ,Economic
856, 돈잔치 끝났다     경제 영향은 금리 인상 빨라진다,Economic
857,  NEWS  성장률 곤두박질치는데  나랏빚 급증하는 상황 벌어진다,Economic
858, 년 만에 맞붙는 래미안 vs 자이 한강뷰  프리미엄 전쟁 ,Economic
859,외국인 여성과 결혼한 한국 남성 중    대 나홀로  증가세,Economic
860, 글로벌 마켓  뉴욕증시  인프라 법안 통과 반영 다우 사상 최고,Economic
861,물류업계  위기 극복 시간 부족  국내 요소수 생산기반 갖춰야 ,Economic
862, 주식 팔까  머스크 트윗에 주가    급락 천백슬라  위태  종합 ,Economic
863,캐피탈사  앞다퉈 자본 확충 나서는 이유는,Economic
864, 구글의 꼼수  뒤늦게 알아차린 방통위  공식 확인 후 대응하겠다 ,Economic
865, 김대호 박사의 오늘의 키워드  국경 개방 디커플링 시진핑 선물 IMF 경고 김부겸 반성,Economic
866,직장인        부자 건보료     최고는 월    만원 ,Economic
867, 위드코로나 일주일  확 바뀐 소비패턴 숙취해소제 야식 매출  훨훨 ,Economic
868, 승계본색 LT 구본식의 대물림 단 한 번으로 족했다,Economic
869,위드 코로나에 재등장한  일회용품 규제   공감하지만 비용 문제 어쩌나 ,Economic
870,오는   일 공공분양  차 사전청약 공고   차에   만명 운집,Economic
871,대출로  똘똘한 한 채  마련하면 행복할까요  더 머니이스트 최원철의 미래집 ,Economic
872,머스크 지분 매각 전망에 테슬라 주가 급락,Economic
873, 다초점 백내장 수술 도수치료 영양주사  비급여 진료 증가에 전체 가입자 손실보험료 갈수록 늘어,Economic
874,     만명 가입  실손보험   만명이     만원 타갔다,Economic
875,한국이 나랏빚 증가  위  IMF의 진짜 경고는 ,Economic
876, 돈잔치 끝났다     경제 영향은 금리 인상 빨라진다,Economic
