,title,category
291,정은보  법과 원칙이 우선 초기부터 사전에 상시감독 ,Economic
292,거래소  ETF 상관계수 완화 만기 있는 채권형 ETF 도입 검토 ,Economic
293,윤호중  전국민 방역지원금  내년  월 지급 추진 ,Economic
294,요소  물류대란에 놀란 정부 수입액 낮아도 공급망 관리,Economic
295,렉키로나가 살려놓나   셀트리온  유럽서 승인권고 의견 소식에 주가 강세,Economic
296, 마켓인 MBK파트너스  코리아센터 투자 다나와 인수 추진,Economic
297, 정부 위기대응 능력 시험대   임기말 레임덕 신호탄 ,Economic
298,한경연  탄소중립 에너지정책서 원전 비중 높여야 ,Economic
299,카카오페이  코스피    편입  일까   일까,Economic
300, 숙박 쿠폰 풀린다  이커머스   대한민국 숙박대전  참여,Economic
301,하이투자증권  외국인 매도에도 코스피       밑돌 가능성 적어 ,Economic
302,유정수 글로우서울 대표  공간의 힘 있어야 살아남는다  언박싱 ,Economic
303, 오징어게임  인기에 CU  달고나 수출 빼빼로데이도 전파,Economic
304,상상인저축  비대면 정기예금 금리 인상 최대 연      ,Economic
305,식품이 먹여살린 CJ 이젠 바이오로 키운다,Economic
306, 이호의 현장에서 회사채 시장에 이르게 찾아온 겨울,Economic
307,고병원성AI 비상 농장서 의심축 발생  전국 일시이동중지,Economic
308,포스코   세계서 가장 경쟁력 있는 철강사    년 연속  위,Economic
309, 증시이슈  천랩  CJ제일제당 제약 의료 사업 양수에   대 강세,Economic
310,선두권 넘보는 쿠팡플레이  두달새 사용자    만명  ,Economic
311, 단독  요소수 대란 에 공공 디젤차 운행제한 검토,Economic
312,초반 흥행 리니지W  엔씨 투심 반전되나,Economic
313,최정우 친환경 혁신전략 통했다   포스코  세계 경쟁력   년 연속  위,Economic
314, 세계에서 가장 경쟁력 있는 철강사  포스코    년 연속  위에 이름올려,Economic
315,비트 이더 동반 신고가   급등하는  가지 이유,Economic
316,ETRI  디스플레이 저온 포토레지스트 상용화   소 부 장 자립에 산업 경쟁력 확보까지,Economic
317,삼성전자    나노 모바일 D램 개발    기술 초격차 지속 ,Economic
318,현대    꿈의 구축함  차세대 이지스  번함 수주,Economic
319,메추리 농장 고병원성 AI 의심축 가금농장   시간 이동 중지,Economic
320,원 달러 환율     원 급등   시스템 오류 실제 거래는 없어 ,Economic
321,사우디 러시아 등   개국과 요소 수입 협의,Economic
322,WECPNL LdendB  소음 크기 대신 지속시간 측정  항공 소음단위 바뀐다는데  왜  ,Economic
323,최근  년간 생숙 신축 인허가 적은 곳에 신규 분양 잇따라,Economic
324,오바마  러 중  기후회의 불참 위기의식 긴급함 부족  비판,Economic
325,재점화된 코인시장 비트코인 이더리움 나란히 사상 최고가,Economic
326,코스피      선 후퇴 뉴욕증시  인프라법 통과에 최고치,Economic
327,비트코인   천   만원 돌파  개월만에 신고가 갈아치워,Economic
328,재난지원금 지급 두고 당정 간 파열음 홍남기  올해는 무리 ,Economic
329, 증시이슈  천랩  CJ제일제당 제약 의료 사업 양수에   대 강세,Economic
330,금융정책도 극명한 입장차 이재명  기본금융  vs 윤석열  규제완화 ,Economic
331,음성 메추리농장 AI 의심신고 전국   시간 일시이동중지 종합 ,Economic
332,전국 숙박할인권 오늘부터 풀린다    만장 선착순 배포,Economic
333,국내  위 요소수업체 롯데정밀화학  생산 라인 일부 가동 중단,Economic
334,단계적 일상 회복  대한민국 숙박대전  전국편  할인 풍성,Economic
335,쇼핑 플레이 스테이   오프라인 매장의 이유있는 변신  P 코노미가 온다  Play ,Economic
336,집값이 정말 폭락한다면    박일한의  피아 ,Economic
337, 연준  두달 전 말 뒤집었다  헝다 파산 글로벌 위기로 번질 위험 ,Economic
338, 공간이 가진 힘  보여줄 수 있어야 살아남는다   P 코노미가 온다  Play ,Economic
339,  만원 뚫은 에코프로비엠 증권가  앞으로 더 오른다 ,Economic
340,이달 분양시장 경기  흐림  지방 HSSI 전망치 큰 폭 하락,Economic
341,내년 바뀌는 IPO 제도는   청약증거금률 조정 유력,Economic
342,GS건설  전북  익산자이 그랜드파크  이달 분양 예정,Economic
343, 위드 코로나  속 사망자     명  상보 ,Economic
344,최고    만원 소득월액 보험료 내는 직장인     명,Economic
345, 레드바이오 사업  강화나선 이재현 회장,Economic
346,공모가 허들 못 넘는 크래프톤   전문가  보호예수 해제가 진입기회 ,Economic
347,강행땐 적자국채 발행 불가피    매년  조  눈덩이 이자   재난지원금 손실보상  논란 ,Economic
348,롯데케미칼  하루 새 목표주가 하향 보고서  개,Economic
349,살얼음 폭설 도로  내비게이션으로 미리 안내 제설대책기간 시작,Economic
350,점점 커지는 예대금리차   전세대출 분할상환 유리할까,Economic
351, 주식 초고수는 지금  원자력 수혜 입은 두산중공업 한전기술  매도 매수 활발,Economic
352, 셀트리온헬스케어 vs 에코프로비엠  시총  위 경쟁,Economic
353, 위드 코로나  빛보는 PE 포트폴리오는,Economic
354,유동성 봄날 끝 IPO 잔치도 끝났다,Economic
355,신경주역세권  KTX신경주역 더 메트로 줌파크  분양 눈길,Economic
356,전국 휘발유값     원 돌파 유류세 인하 효과 물음표,Economic
357,올 겨울 배당 투자 시원찮네  글로벌 평균도 안되는 한국 배당성향 ,Economic
358, 인력 확보전쟁  학비  보너스 등 당근책 이어져,Economic
359,비트코인   천   만원 넘어  개월 만에 신고가 갱신,Economic
360,깡통전세 막으려다   빌라 월세화 가속,Economic
361,이젠 재산까지 검증한다   서민대출 보릿고개,Economic
362,연말 짠테크족 잡아라   저축은행 금리 릴레이 인상,Economic
363, 이것은 꿈의 결과다  화성 조건에서 키운 토마토로 케첩 만들었다,Economic
364,중흥그룹  대우건설 노조에 임금인상 고용보장 약속 ,Economic
365,  G AI 메타버스 최적화  삼성전자  차세대 모바일 D램 개발,Economic
366,정은보  금감원 재량적 판단  법과 원칙에 우선할 수 없다 ,Economic
367,신탁 TF에 설레는 은행권  대장동 사태 로 역풍 맞나,Economic
368,롯데케미칼  하루 새 목표주가 하향 보고서  개,Economic
369,살얼음 폭설 도로  내비게이션으로 미리 안내 제설대책기간 시작,Economic
370,점점 커지는 예대금리차   전세대출 분할상환 유리할까,Economic
371, 주식 초고수는 지금  원자력 수혜 입은 두산중공업 한전기술  매도 매수 활발,Economic
372, 셀트리온헬스케어 vs 에코프로비엠  시총  위 경쟁,Economic
373, 위드 코로나  빛보는 PE 포트폴리오는,Economic
374,유동성 봄날 끝 IPO 잔치도 끝났다,Economic
375,신경주역세권  KTX신경주역 더 메트로 줌파크  분양 눈길,Economic
376,전국 휘발유값     원 돌파 유류세 인하 효과 물음표,Economic
377,올 겨울 배당 투자 시원찮네  글로벌 평균도 안되는 한국 배당성향 ,Economic
378, 인력 확보전쟁  학비  보너스 등 당근책 이어져,Economic
379,비트코인   천   만원 넘어  개월 만에 신고가 갱신,Economic
380,깡통전세 막으려다   빌라 월세화 가속,Economic
381,이젠 재산까지 검증한다   서민대출 보릿고개,Economic
382,연말 짠테크족 잡아라   저축은행 금리 릴레이 인상,Economic
383, 이것은 꿈의 결과다  화성 조건에서 키운 토마토로 케첩 만들었다,Economic
384,중흥그룹  대우건설 노조에 임금인상 고용보장 약속 ,Economic
385,  G AI 메타버스 최적화  삼성전자  차세대 모바일 D램 개발,Economic
386,정은보  금감원 재량적 판단  법과 원칙에 우선할 수 없다 ,Economic
387,신탁 TF에 설레는 은행권  대장동 사태 로 역풍 맞나,Economic
388,롯데케미칼  하루 새 목표주가 하향 보고서  개,Economic
389,살얼음 폭설 도로  내비게이션으로 미리 안내 제설대책기간 시작,Economic
390,점점 커지는 예대금리차   전세대출 분할상환 유리할까,Economic
391, 주식 초고수는 지금  원자력 수혜 입은 두산중공업 한전기술  매도 매수 활발,Economic
392, 저가에서 가치로   대세가 된 공유주택  부동산 플러스 테마형 셰어하우스 시대 ,Economic
393, 만가구 짓겠다는 용산정비창   내달 가이드라인 나온다 부동산 플러스 ,Economic
394,고혈당 길어질수록 치매 위험 높아진다,Economic
395,보험사 수조원 적자에 보험료 인상 벼르는데 연간     만원 이상 보험금 수령   만명,Economic
396,대만  양안갈등 속에서도 올해  중국 수출 역대 최대,Economic
397, 증시이슈  카카오뱅크  보호예수 해제  하루 만에 주가 반등,Economic
398, 요소 재고 바닥  비료공장 한계인데 정부  내년  월까진 문제없어 ,Economic
399,한미증시 왜 따로 갈까  국내 물가 압력 탓 ,Economic
400,이랜드  패션업계 최초 ESG 채권 발행 신소재 R D 위한 친환경 센터 건립,Economic
401,모닝 레이  비교불가의 가성비  질주 ,Economic
402,목소리로 정확한 목적지 설정 실내온도 조절   버튼으로 긴급출동까지   더 똑똑해진 볼보  원호연의 시승기 ,Economic
403,선거 국면서 반값 아파트 또    시장  이미 한계 노출한 정책   부동산    ,Economic
404, 특별건축구역 노리자   신반포  차   차  통합재건축 첫발,Economic
405,유통업계  요소수 대란 예의주시  장기화 땐 물류대란 불가피 ,Economic
406,실손보험 적자인데     만명은      만원 이상  보험금 타갔다,Economic
407,분양가 상한제 개편 전 서두르자  알짜 단지  북구청역 푸르지오 에듀포레  주목,Economic
408,샤넬 이어 셀린느까지 가격 인상 코로나  에 콧대 높아진 명품,Economic
409,비트코인   천   만원 돌파  개월만에 신고가 갈아치워,Economic
410,깡통전세 막으려다 서민만 애간장 빌라 시장 월세화 가속  부동산    ,Economic
411,수도권 상위     아파트값  대출 안되는   억 넘어,Economic
412,한경연  원전 비중    로 높이면 탄소중립 비용    조원 절감 ,Economic
413,포스코  세계에서 가장 경쟁력 있는 철강사    년 연속  위,Economic
414,쉐보레     마력의 LT  엔진 품은 콜벳 Z   공개,Economic
415,삼성전자  모바일용 D램도 초격차 업계 최초 LPDDR X 개발,Economic
416,탄소중립 목표 무리수 둔 정부  전기료 폭탄 예고  원전 비중 높여야 ,Economic
417,삼성전자  차세대 모바일 D램  LPDDR X  개발  기술 초격차 지속 ,Economic
418, 신차에 쓸 분량 나눠달라  완성차 업계 위협하는 요소수 대란,Economic
419, 우린 다른데  카드 노조 총파업에 좌불안석 빅테크,Economic
420,현대   차세대 이지스함 중  번함 추가 수주,Economic
421,    년부터 항공기 소음단위  웨클 로 변경 항공기 소음 피해 보상 확대된다,Economic
422,삼성 SK 등  미국 반도체 자료  제출   고객사 정보는 제외,Economic
423,정부비축물자 비철금속 위주 요소수 포함해도 물량확보가 관건,Economic
424,LG디스플레이   일 기업설명회 개최,Economic
425,정은보  사후제재보다 피해 예방에 초점  재차 강조,Economic
426,유류세 인하 언제부터 반영될까,Economic
427,ETF  위 삼성자산운용 점유율 급락  올해만     p 줄었다,Economic
428,삼성전자  세계 최초 DDR X D램 개발  내년 양산 ,Economic
429,정은보  현장검사  사후적 처벌보다 가이드 방식으로 바꿀 것 ,Economic
430, 탄소중립  중국이 움직인다   위기와 기회가 함께 ,Economic
431,에어프라이어는 가라 삼성도 뛰어든    억 멀티쿠커 시장,Economic
432,오토바이와 사고나면 라이더  재킷값 도 물어줘야,Economic
433,수도권 상위     아파트값  대출 금지선    억원 넘어서,Economic
434,바닥 보이는 요소수 산업계 발 묶일라  패닉 ,Economic
435,얀센 추가접종 본격화  동네 잔여백신 물량 봤더니,Economic
436, 재사용컵 씻어서 반납하라고요   vs 스타벅스  불편사항 개선 ,Economic
437,삼성 SK  미국에  반도체 자료  마감일 제출 민감한 정보는 제외,Economic
438,베트남  요소    톤 긴급 한국 수출 승인 교민들도 동참  KVINA ,Economic
439,연준 고위인사들 내년 금리인상 가능성 시사,Economic
440, 원전 적정 수준 사용이 탄소중립 대처하는 유일한 길 ,Economic
441,전국 휘발유  당  천   원 넘어 정유업계  유류세 인하 즉각 반영 ,Economic
442,돼지에게 놀이도구 줬더니 살 더 찌고 덜 싸웠다,Economic
443,포스코    년 연속  세계에서 가장 경쟁력 있는 철강사   위,Economic
444, 한국  GDP 대비 국가부채 증가율 OECD 평균 이하 ,Economic
445,포스코인터  유연근무 복장자율화 체질개선 박차,Economic
446,겨울철 도로 폭설 결빙 피해 막는다   개기관   일 합동회의,Economic
447,삼성전자  D램 기술력 초격차 가속 업계 최초 LPDDR X 개발,Economic
448, 세계 최고 경쟁력 철강사  포스코    년 연속  위,Economic
449,정은보  현장검사  사후적 처벌보다 가이드 방식으로 바꿀 것 ,Economic
450,이번엔 중국발 마그네슘 부족 사태  유럽  업계  폭풍전야  상보 ,Economic
451,샤브샤브 야채가 버거에  채선당표 수제버거  나온다,Economic
452,대장동 방지법 또 나왔다  적정성 사전검토 국토부 장관에 보고 ,Economic
453,전기 수소차  내년까지 고속도로 통행료     할인,Economic
454,셀바스AI  숨겨진 메타버스 수혜주 기대감에  급등 ,Economic
455, 팩트체크  한국의 법인세 최고세율은 다른 선진국에 비해 높다 ,Economic
456,CJ제일제당 동원F B   분기 실적 호조 비결은  식품사업 ,Economic
457,금리올린다고 물가 잡나 한은 내부서도 신경전,Economic
458,씨티그룹    소비자금융 철수에 최대  조    억 원 지출,Economic
459,도보 역세권 아파트  가천대역 더포엠     가구 공급예정,Economic
460,연준 고위인사들 내년 금리인상 가능성 시사,Economic
461,직장인      위드코로나 걱정돼  이유는 코로나 재확산과 회식,Economic
462,삼성 SK 반도체 민감정보 빼고 제출    추가조치 촉각,Economic
463,한국거래소  액티브 ETF 상관계수 내린다,Economic
464, 단독     금융위  정치 목적 시장원리 훼손  CLSA의 일침,Economic
465,브랜드엑스코퍼레이션  하이브 CB 인수 위해    억 출자,Economic
466,어린이보험 시장 휩쓴 현대해상    년 만에 보유고객     만명 넘었다,Economic
467,수도권 상위     아파트값   정부에서  배 올랐다,Economic
468, 경기 인천도 대출 불가   억 넘는 아파트 흔해졌다  서울은   억 돌파  직장인     개월 월급 모아야 ,Economic
469, 보복 여행 심리 잡아라   주간  여행가는 달  할인 쿠폰 쏟아져,Economic
470, 오징어게임  재미 본 삼양식품   부셔먹는 라면스낵  다각화,Economic
471,씨티그룹  한국씨티은행 희망퇴직 등에 최대    조 지출,Economic
472, 뉴스포커스  위중증 사망자 증가세  고령층 미접종자 위주 ,Economic
473,기술주권 위한  R D 인내자본 을 키우자,Economic
474,현대중공업  방위사업청과     억 규모 조선 계약 체결,Economic
475,비트코인  국내서  개월만에 신고가       만원 찍었다,Economic
476,GS건설   익산자이 그랜드파크    월 분양 예정,Economic
477, 한국씨티 소비자금융 철수는 합리적 최대   조    억  비용 ,Economic
478,중흥그룹  대우건설 노조에  업계 톱   임금 제안  얼마나 오를까 ,Economic
479,씨티은행  소비자금융 철수비용 최대  조    억원  내년까지 마무리 ,Economic
480, 메리츠금융 현대중 카카오페이  코스피   에 편입될 듯 ,Economic
481,서울 강남권 인접 입지  베라시떼 하남  분양 예정,Economic
482,수인분당선 가천대역 인근    가구 규모 역세권 단지 건립,Economic
483,  조 시장 지혈제 세대교체 임박 모든 환자에 적용가능한 신기술 등판,Economic
484,인사담당자   명 중  명  올해 신입사원 역량  예년보다 높아 ,Economic
485,NHN벅스   Q 영업익   억 전년      ,Economic
486,요소수 있다는 휴게소 가봤더니   시간  분 대기 그래도 넣으면 다행 ,Economic
487,한국 조선    월 수주  위 재탈환 전세계 발주량     수주,Economic
488,  개인투자자  인프라 법안 통과 소식에 수혜주  줍줍 ,Economic
489,CJ제일제당  차세대 세포 유전자 치료제 CGT CDMO  시장 진출,Economic
490, 코인뉴스   폭주기관차  비트코인  인플레 해답 쥐고 있다 ,Economic
491,   도시바  인프라 디바이스 반도체  사로 분할 검토 ,Economic
492,배달음식 용기도 다회용으로 강남구서 시범사업 추진,Economic
493,코스피 혼조   외인 순매도 전환,Economic
494, 발 등에 불    지시에 베트남서 차량용 요소    톤 긴급 도입하기로,Economic
495,코로나 사태  년 여행사     개 줄때 야영장    개 늘었다,Economic
496, 이데일리N    조 적자 실손보험    만명     만원 이상 보험금 수령,Economic
497,  일만에 또 최고가 비트코인     만달러 돌파,Economic
498,편의점에서 김장 준비  포장김치 배추 양념 예약 판매,Economic
499, 곧 마스크 벗는다  기대감에 북적 여성 고객들 몰렸다  현장  ,Economic
500,비틀즈 조지 해리슨 살던 집 경매   최고  억원대 예상,Economic
501,NHN   Q 영업익    억 달성 창립 이래 최대,Economic
502,현대       억 규모 차세대 이지스  번함 수주,Economic
503, 핫스탁 두산밥캣 컴투스 아이엠,Economic
504,삼성전자 SK하이닉스   상무부에 반도체 정보 제출 완료 ,Economic
505, 테이퍼링 시작하면 오른다더니  믿는 금융주에 발등찍힌 개미들,Economic
506,  월엔 양 질 모두 챙겼다    조선 선박수주  위 복귀,Economic
507, 단독  한화자산운용  한화투자증권 출신 여성 준법감시인 영입,Economic
508,서울 강남구  배달음식 다회용 포장용기 시범 사업 추진,Economic
509,  번가   대한민국 숙박대전  동참 최대  만원 할인쿠폰 제공,Economic
510, 이슈앤 직설  대선 승패는 부동산 민심 잡기  누가 시장 안정화 가져올까,Economic
511,비트코인     만원 돌파   개월 만에 최고치 경신,Economic
512,재난지원금 손실보상 강행하면 적자국채 눈덩이 이자만  조원  국가부채 급증 비상 ,Economic
513,오늘부터  숙박 할인쿠폰  풀린다      만장 선착순 배포,Economic
514, 자막뉴스  요소수 대란에 기름값 고공행진    시동 걸기 무섭다 ,Economic
515,  기술주에 베팅했던 JP모건 블랙록    분기 성적  최악 ,Economic
516,KAMA  카카오커머스와 미래모빌리티 산업 진흥 위한 업무협약,Economic
517,롯데정밀  요소수 전체 생산라인 멈추나    주 버틸 재고만 남아 ,Economic
518,폴카닷 파라체인 옥션  코인판 다시 흔드나  한경 코알라 ,Economic
519,코스피  개인 외인 팔자에 장중 하락 반전     선,Economic
520, 곧 마스크 벗는다  기대감에 북적 여성 고객들 몰렸다  현장  ,Economic
521, 적자폭 줄이는  쏘카  올해 첫 흑자 성적표 나올까,Economic
522,대형건설사 브랜드 아파트 인기 인천  학익 SK뷰  공급,Economic
523,패밀리 하이엔드 진화 오피스텔  판교 디오르나인  내달 공급,Economic
524,  만원 외식  번땐  만원 환급  지원    일 종료,Economic
525, 만명이 실손보험서     만원이상 타갔다 보험 수령액 극과 극,Economic
526,NHN  분기기준 최대 실적 결제 광고매출만  천억원 종합 보 ,Economic
527,  천만원 이상  고액 보험금 수령자   만명 실손보험료 오를까,Economic
528,K 조선    월 수주 톱  전세계 발주량 중    ,Economic
529,문승욱 산업장관  오늘 미국행 반도체 공급망 철강 현안 논의,Economic
530, 이슈앤 직설  대선 승패는 부동산 민심 잡기  누가 시장 안정화 가져올까,Economic
531,비트코인     만원 돌파   개월 만에 최고치 경신,Economic
532,재난지원금 손실보상 강행하면 적자국채 눈덩이 이자만  조원  국가부채 급증 비상 ,Economic
533,오늘부터  숙박 할인쿠폰  풀린다      만장 선착순 배포,Economic
534, 자막뉴스  요소수 대란에 기름값 고공행진    시동 걸기 무섭다 ,Economic
535,공수처   고발사주 의혹  손준성 검사 내일 재소환,Economic
536,아이큐어  도네패질 패취 임상  상 결과 발표 위해   CTAD학회 참가,Economic
537,강원 휘발유 가격 리터당      원 대  년 만에 최고,Economic
538,전기 수소차  내년까지 고속도로 통행료     할인,Economic
539,토지 자동차 등 재산검증까지 받는다고  대출받기 더 어려워진다,Economic
540,대우건설  올 도시정비 부문 수주  조 돌파  신기록 ,Economic
541, 나도 갈아타볼까   오래된 아파트 많은 지역에 신규 분양 잇달아,Economic
542,집값 급등에  오피스텔 주거복합시설  꺾이지 않는 인기 ,Economic
543, 바닥인가   먹는 약에 추락한  셀트리온  반등 노린다,Economic
544,수도권 상위     아파트값    억 원 벽마저 돌파,Economic
545,  조선업  전세계 선박 발주  싹쓸이    월 수주  위,Economic
546,BGF가 품는  코프라      억원 오가는 M A 뜯어보니,Economic
547,한투증권  채권 투자심리  내년  분기 말부터 개선 ,Economic
548, 헝다 위기는 미국에도 위협  연준 경고,Economic
549,  정부 말기 위기대응 능력 시험대 부처간  책임 떠넘기기  레임덕   답없는 요소수 대란 ,Economic
550, 사송신도시 제일풍경채 퍼스트파크   일 화   순위 청약 접수,Economic
551, 단독   최대  억 손에 쥔다     씨티은행 희망퇴직에     신청,Economic
552,동탄 신도시 내 집 마련 기회로 딱   화성동탄  제일풍경채 퍼스티어  주목,Economic
553,국민카드  숙박  최대  만원  할인 티티비비로 호캉스가자,Economic
554,결국 반도체 자료 제출한 삼성 하이닉스  고객 정보는 제외 ,Economic
555, 돌아온 회식     억 외식쿠폰 열흘 만에 동났다,Economic
556,신규 확진      명 엿새 연속 감소세,Economic
557,슬링 백도 편안하게 여성 신발 브랜드  어페리피트 ,Economic
558, 선가   년만에 최고     조선 수주 위 재탈환,Economic
559,대화는 인간관계를 맺어주는 수단  스트레스 받는 당신  이런 대화방법 어때요   출간,Economic
560,노동신문  남은 기간은 수령에 대한 맹세 실천 검증 계기 ,Economic
561, 요소수  부족에 한국이 멈춘다    정부    석탄부족 왜 살피지 못했나 ,Economic
562,CJ제일제당  식품 바이오 사업 호조 힘입어  분기 매출 첫  조원 돌파 ,Economic
563,로블록스  나 아직 안 죽었다         분 미국주식 ,Economic
564,  연준 부의장  내년에 금리인상 요건 충족될 것 ,Economic
565, 조선    월 전 세계 선박      싹쓸이   수주  위 탈환,Economic
566,KB   구리 가격 추종 ETN 및 곱버스 신규 상장,Economic
567, 냉장고도 해킹  LG라면 걱정 없어요  업계 최고 보안등급 획득,Economic
568,NHN한국사이버결제   분기 매출     억 분기 사상 최대 실적,Economic
569,연말 짠테크족 겨냥 주춤했던 저축  금리 속속 인상,Economic
570,신용카드 외식할인행사 내일 종료 지역화폐 할인 시작,Economic
571,  번가  위드코로나 맞이 전국  만여개 숙박상품 최대  만원 할인,Economic
572,대전시  베트남 시장진출 기업 지원 박차,Economic
573,정부  사우디 인니 러시아 등   개국과 요소 수입 협의  답없는 요소수 대란 ,Economic
574,금호건설  검단에    세대 아파트 짓는다,Economic
575,재건축 재개발 시공사 교체 까다로워지나,Economic
576, 원금까지 왜 갚나  예대금리차 확대  전세대출 분할상환 유리할까,Economic
577,씨티그룹  한국씨티은행 철수에  조 천억 지출 예상,Economic
578, 수도권  채 가운데  채   내 돈 없으면 못산다 ,Economic
579,  번가도 대한민국 숙박대전 동참 최대  만원 할인,Economic
580,하얏트 글로벌 객실 특가 프로모션 내년 상반기까지 최대     할인,Economic
581,SK스토아  LG전자 트롬 세탁기 건조기 단독조건 판매,Economic
582,집 안 팔려 다주택자 됐는데  세금 줄일 방법 알려주세요   ,Economic
583,보험도 초개인화 빅테크 없는 틈타 보험사 보장분석 집중,Economic
