,title,category
877,  NEWS  성장률 곤두박질치는데  나랏빚 급증하는 상황 벌어진다,Economic
878, 년 만에 맞붙는 래미안 vs 자이 한강뷰  프리미엄 전쟁 ,Economic
879,외국인 여성과 결혼한 한국 남성 중    대 나홀로  증가세,Economic
880, 글로벌 마켓  뉴욕증시  인프라 법안 통과 반영 다우 사상 최고,Economic
881,물류업계  위기 극복 시간 부족  국내 요소수 생산기반 갖춰야 ,Economic
882, 주식 팔까  머스크 트윗에 주가    급락 천백슬라  위태  종합 ,Economic
883,캐피탈사  앞다퉈 자본 확충 나서는 이유는,Economic
884, 구글의 꼼수  뒤늦게 알아차린 방통위  공식 확인 후 대응하겠다 ,Economic
885, 김대호 박사의 오늘의 키워드  국경 개방 디커플링 시진핑 선물 IMF 경고 김부겸 반성,Economic
886,직장인        부자 건보료     최고는 월    만원 ,Economic
887, 위드코로나 일주일  확 바뀐 소비패턴 숙취해소제 야식 매출  훨훨 ,Economic
888, 승계본색 LT 구본식의 대물림 단 한 번으로 족했다,Economic
889,위드 코로나에 재등장한  일회용품 규제   공감하지만 비용 문제 어쩌나 ,Economic
890,오는   일 공공분양  차 사전청약 공고   차에   만명 운집,Economic
891,대출로  똘똘한 한 채  마련하면 행복할까요  더 머니이스트 최원철의 미래집 ,Economic
892,머스크 지분 매각 전망에 테슬라 주가 급락,Economic
893, 다초점 백내장 수술 도수치료 영양주사  비급여 진료 증가에 전체 가입자 손실보험료 갈수록 늘어,Economic
894,     만명 가입  실손보험   만명이     만원 타갔다,Economic
895,한국이 나랏빚 증가  위  IMF의 진짜 경고는 ,Economic
896, 돈잔치 끝났다     경제 영향은 금리 인상 빨라진다,Economic
897,  NEWS  성장률 곤두박질치는데  나랏빚 급증하는 상황 벌어진다,Economic
898,내일부터 요양병원 입원 종사자 부스터샷      개월 간격 단축 검토,Economic
899, 증시는 나는데  기어다니는 코스피  디커플링  언제 끝날까,Economic
900,미국증시  인프라 법안 효과에  대 지수 상승,Economic
901, 위드코로나 일상업무 되찾는 은행  일부는 추억 속으로,Economic
902, 막히면 뚫는다   신사업 발 뻗는   태양광 기업,Economic
903,뉴욕증시  바이든 정부의 인프라 법안 의회 통과에 상승 마감 다우       ,Economic
904, 수지Re 뷰  서울   억 구축 VS 동탄  억 신축  당신의 선택은 ,Economic
905, 지자체가 외면하면 무용지물  분상제 개편에도 실행력엔  물음표 ,Economic
906, 뉴욕증시   대지수  인프라안 통과에  사상 최고   S P         선 돌파,Economic
907,삼성 SK  오늘 반도체 자료 제출 민감한 정보 뺄 듯,Economic
908,이재명 윤석열  암호화폐 과세유예  요구에 홍남기  예정대로 ,Economic
909,테슬라 주가    가까이 급락 머스크 악재 vs  펩시코 호재  류정훈 기자의 뉴스픽 ,Economic
910,요소수 부족   소규모 업체 더 심각  대중교통까지 차질 빚을까 ,Economic
911,  점령한 태양광 밸류체인    기업 경고음,Economic
912,연준  인자 등 고위인사들  내년 금리인상 가능성 시사,Economic
913,신약 개발에  총     조  정부가 선택한 과제는,Economic
914,대출금리 반발 커지나  은행 폭리 막아달라  청원까지 등장,Economic
915,호실적에도 웃지 못하는 손보사  보험료 인하 압박  촉각 ,Economic
916,이더리움 사상 최고치 경신 비트코인도 최고치 근접,Economic
917, 엄마도 못 바꾼 나를 바꿨다  건강 슈퍼 앱 꿈꾸는 챌린저스,Economic
918,내일부터 요양병원 입원 종사자 부스터샷      개월 간격 단축 검토,Economic
919, 증시는 나는데  기어다니는 코스피  디커플링  언제 끝날까,Economic
920,미국증시  인프라 법안 효과에  대 지수 상승,Economic
921, 위드코로나 일상업무 되찾는 은행  일부는 추억 속으로,Economic
922, 막히면 뚫는다   신사업 발 뻗는   태양광 기업,Economic
923,뉴욕증시  바이든 정부의 인프라 법안 의회 통과에 상승 마감 다우       ,Economic
924, 수지Re 뷰  서울   억 구축 VS 동탄  억 신축  당신의 선택은 ,Economic
925, 지자체가 외면하면 무용지물  분상제 개편에도 실행력엔  물음표 ,Economic
926, 뉴욕증시   대지수  인프라안 통과에  사상 최고   S P         선 돌파,Economic
927,삼성 SK  오늘 반도체 자료 제출 민감한 정보 뺄 듯,Economic
928,이재명 윤석열  암호화폐 과세유예  요구에 홍남기  예정대로 ,Economic
929,테슬라 주가    가까이 급락 머스크 악재 vs  펩시코 호재  류정훈 기자의 뉴스픽 ,Economic
930,요소수 부족   소규모 업체 더 심각  대중교통까지 차질 빚을까 ,Economic
931,  점령한 태양광 밸류체인    기업 경고음,Economic
932,연준  인자 등 고위인사들  내년 금리인상 가능성 시사,Economic
933,신약 개발에  총     조  정부가 선택한 과제는,Economic
934,대출금리 반발 커지나  은행 폭리 막아달라  청원까지 등장,Economic
935,호실적에도 웃지 못하는 손보사  보험료 인하 압박  촉각 ,Economic
936,이더리움 사상 최고치 경신 비트코인도 최고치 근접,Economic
937, 엄마도 못 바꾼 나를 바꿨다  건강 슈퍼 앱 꿈꾸는 챌린저스,Economic
938,내일부터 요양병원 입원 종사자 부스터샷      개월 간격 단축 검토,Economic
939, 증시는 나는데  기어다니는 코스피  디커플링  언제 끝날까,Economic
940,미국증시  인프라 법안 효과에  대 지수 상승,Economic
941, 위드코로나 일상업무 되찾는 은행  일부는 추억 속으로,Economic
942, 막히면 뚫는다   신사업 발 뻗는   태양광 기업,Economic
943,뉴욕증시  바이든 정부의 인프라 법안 의회 통과에 상승 마감 다우       ,Economic
944, 수지Re 뷰  서울   억 구축 VS 동탄  억 신축  당신의 선택은 ,Economic
945, 지자체가 외면하면 무용지물  분상제 개편에도 실행력엔  물음표 ,Economic
946, 뉴욕증시   대지수  인프라안 통과에  사상 최고   S P         선 돌파,Economic
947,삼성 SK  오늘 반도체 자료 제출 민감한 정보 뺄 듯,Economic
948,이재명 윤석열  암호화폐 과세유예  요구에 홍남기  예정대로 ,Economic
949,테슬라 주가    가까이 급락 머스크 악재 vs  펩시코 호재  류정훈 기자의 뉴스픽 ,Economic
950,요소수 부족   소규모 업체 더 심각  대중교통까지 차질 빚을까 ,Economic
951,  점령한 태양광 밸류체인    기업 경고음,Economic
952,연준  인자 등 고위인사들  내년 금리인상 가능성 시사,Economic
953,신약 개발에  총     조  정부가 선택한 과제는,Economic
954,대출금리 반발 커지나  은행 폭리 막아달라  청원까지 등장,Economic
955,요소수 가뭄  단기간에 안 끝난다,Economic
956,국내 요소수 이달말 바닥  삼성 SK도  아껴쓰며 버티는 중 ,Economic
957,생산가능인구 감소도 겹쳐  점점 쪼그라드는 한국경제,Economic
958, 어른 허벅지 굵기만한 해저케이블 수백km  똬리 튼듯 감겨있어 ,Economic
959,       가구   세대 늘린 리모델링  국내  호,Economic
960, 올해   조  vs   차 추경 뒤   조   초과세수  기준시점  차이,Economic
961, 해외여행 가자  화이자 코로나약에 항공주 떴지만 ,Economic
962,리튬메탈 인산철 삼원계 전고체 배터리 업계 종사자도  특성 헷갈리네 ,Economic
963,너도나도 장밋빛 전기차 배터리 거품 우려,Economic
964, 팔기도  사기도 어려워  주택시장  관망세 언제까지 ,Economic
965,화이자  먹는 코로나약 에 국내 바이오주  와르르    그래도 급등한 종목은 ,Economic
966,퀄스   Fed 부의장 사임 파월 연임 청신호 ,Economic
967,      중국산 마그네슘     제  요소수 대란  우려,Economic
968, 재고 이대로면 이달말 공장 멈춘다     국내 최대 요소수 업체의  비명 ,Economic
969,기존 주주만 배불린다  공모주 흥행 변수 된  구주매출 ,Economic
970, 굴뚝기업 매력없다 는    세 알짜회사 팔려나가는 이유,Economic
971, 애들이 물려받기 싫다니  창업주 눈물의 기업 매각,Economic
972, 반도체 자료 제출 D데이 삼성전자 SK하이닉스  기밀정보  빠질 듯 종합 ,Economic
973,요소수 사태  뒷북  대응   일 수출규제  때랑 판박이,Economic
974,요소수 수입  절차 어렵고 배도 없어  민항 화물기 투입 검토,Economic
975,또 차이나 리스크  요소수 이어 태양광 모듈값도 들썩,Economic
976,저무는 디젤차 시대  요소수가 기름 붓나,Economic
977,보호예수 잠금장치 풀리자  카카오뱅크 주가 급락,Economic
978,S펜에  억 화소 카메라  갤럭시S   내년  월 출시 유력,Economic
979, 현장에서  은행이 알아서 해라  금융위 떠넘기기에 서민만 운다,Economic
980,지자체 멋대로 분양가 못깎는다  건축비 가산비 기준 통일,Economic
981,중금리대출 늘리랴  총량 지키랴  머리 싸맨 인터넷은행들,Economic
982,기업들  요소 찾아라  세계 백방으로 뛰지만       우리도 빠듯 ,Economic
983,금리순 검색 없앤 금융협회 앱  누가 찾겠나,Economic
984,반도체 영업 기밀 내놓으라는   vs   업체들 끝까지 고심   이유는 ,Economic
985,미 항공사들  대규모 감원  년 반만에 조종사 구인난,Economic
986, 마켓인  비트코인 ETF가     해외 자산운용사 ETF 신청 속속,Economic
987,랜덜 퀄스 연준 부의장  연말 사퇴   바이든  연준 물갈이할까,Economic
988,보호예수 폭탄이 몰려온다 카카오뱅크도  휘청 ,Economic
989,씨티은행  한국 철수에 최대  조 천억원 비용 지출,Economic
990, 굴뚝기업 매력없다 는    세 알짜회사 팔려나가는 이유,Economic
991, 애들이 물려받기 싫다니  창업주 눈물의 기업 매각,Economic
992, 반도체 자료 제출 D데이 삼성전자 SK하이닉스  기밀정보  빠질 듯 종합 ,Economic
993,요소수 사태  뒷북  대응   일 수출규제  때랑 판박이,Economic
994,요소수 수입  절차 어렵고 배도 없어  민항 화물기 투입 검토,Economic
995,또 차이나 리스크  요소수 이어 태양광 모듈값도 들썩,Economic
996,머스크 설문에 눈치 싸움 테슬라  개장 전  급락 ,Economic
997, 일회용 컵 없어요  친환경 속도내는 카페들,Economic
998,요소수 품귀 화물차 운행 중단 속출,Economic
999,비트코인  하루만에    폭등        만원 고지 재탈환,Economic
