,title,category
0,  조선    월 전세계 선박수주     쓸었다   제치고  위,Economic
1,편법적 부의 대물림  대기업 사주일가    명 세무조사,Economic
2,요소수 대란에 대형 화물차 레미콘 운행 줄였다 운임비도 고공행진,Economic
3,오징어게임 수혜 삼양식품  뿌셔삼양 라면스낵  출시한다,Economic
4,분양 열기 꺾이나  서울 분양경기전망 석달 연속 하락,Economic
5, 영상뉴스 세계 시장 독점한  이 종목   올해 들어서만 주가     상승했다  전문가들  더 오를 것 ,Economic
6,카카오 손해보험사  연내 출범 불투명   본인가 신청 또 미뤄져 ,Economic
7,삼성 SK   에 반도체정보 제출 홍남기  공개수준 전적으로 기업들 판단 ,Economic
8,누적 돌파감염    만명 발생률 얀센백신이 가장 높았다,Economic
9,위드 코로나에 해외여행  기지개   해외항공 발매      ,Economic
10,건산연   정부  임차 임대인 모두에게 삶의 어려움 초래 ,Economic
11, 여주역 센트레빌 트리니체  청약   대   경쟁률 최고   대  ,Economic
12,문승욱 산업부 장관  오늘 방미 반도체 공급망 정보 철강 등 논의,Economic
13,수입업체서 요소  천t 발견 정부  요소수     만   푼다 종합 ,Economic
14,손병두  메타버스 전기차 등 다양한 ETP 선보일 것 ,Economic
15,당국의 속내  고양이 목에 방울 달기 하던 대로 한다 ,Economic
16, 주택    만호  목표는 같지만   이재명  공공  vs 윤석열  민간 ,Economic
17,공정위원장  요소수 매점매석 엄중하게 보고 있다 ,Economic
18, 연준  두달전 전망 뒤집었다  헝다 위기  미국과 세계금융에 위험 ,Economic
19,신세계 또 역대 최대 실적  분기 영업이익  천  억원 종합 ,Economic
20,신세계  코로나 뚫고 신세계 열었다   분기 기준 사상 최대 실적  상보 ,Economic
21,올해 공동주택가격 이의신청  만    건  년 전보다  배 늘어,Economic
22,문승욱 산업부 장관  오늘 미국행   반도체 철강 에너지 논의,Economic
23,SH공사  대 혁신방안 발표  투기 직원  원스트라이크 아웃 ,Economic
24,롯데지에프알  패션사업 확장  기지개     카파 까웨  내년 리론칭,Economic
25,포스코  세계에서 가장 경쟁력 있는 철강사    년 연속  위,Economic
26,  년간   번 수수료 인하   카드업계 인력 구조조정에 떤다,Economic
27,홍남기  탄소 중립 세부계획 마련 중 일부 연말 발표 ,Economic
28,누적 돌파감염    만명 발생률 얀센백신이 가장 높았다,Economic
29,위드 코로나에 해외여행  기지개   해외항공 발매      ,Economic
30,건산연   정부  임차 임대인 모두에게 삶의 어려움 초래 ,Economic
31,지난주 코로나   사망자    명 전주보다   명 늘었다,Economic
32,사전예약  잔여백신   얀센 접종자 부스터샷 어떻게 진행되나,Economic
33,정은보  금감원 재량적 판단  법과 원칙에 우선될 수 없어  종합 ,Economic
34,신세계   Q 영업이익     억   역대 최대 실적 ,Economic
35,신세계   백화점 면세점 호조  역대 최대  분기 매출,Economic
36, 단독 농협은행  SK C C와  통합데이터 허브  만든다,Economic
37,검찰  윤석열 장모  모해위증  재수사 결론 무혐의 불기소 처분,Economic
38, 백신 부작용 걱정한 사람이 더 많이 겪는다 ,Economic
39,신세계  매출 영업익 신기록  백화점 끌고 면세점 밀고 ,Economic
40,엠투엔  신라젠 인수 차질 없이 마무리 되나 주가   대 ,Economic
41,  분기 역대 최대 실적  신세계  영업익 전년   배 상승 종합 ,Economic
42,업체 보관 요소  천t 확인    t 요소수로 즉시 생산 종합 ,Economic
43,  조선    월    만CGT 수주   위  세계 발주량    ,Economic
44,투기 직원  원스트라이크 아웃  SH  대 혁신방안 발표,Economic
45,김헌동  강남에  억원대 공공아파트 짓겠다 ,Economic
46, 현장연결  질병청  위중증 환자   대 이상에서       차지 ,Economic
47,종합검사 폐지되나 정은보  금융사 상시 검사 확대할 것 ,Economic
48,대장동 주민들  성남의뜰이 송전선로 지중화 약속 안지켜   준공 승인 보류해달라 ,Economic
49,전세계서 유독 한국만 카드수수료 규제    이유는 정치 ,Economic
50,  마그네슘     감축  유럽 한국 대란 우려,Economic
51,김헌동 SH 사장 후보자  강남에   평대  억짜리 아파트 짓겠다 ,Economic
52,한국거래소  액티브 ETF 규제 완화 추진 상관계수 기준 낮춘다 ,Economic
53,SK 입사지원자      여 명 개인정보 유출  머리숙여 사과 ,Economic
54,정부  민간 수입업체 보관 차량용 요소  천 톤 확인,Economic
55,이스타항공  성정 인수포기설 사실무근 예정대로 진행 ,Economic
56,현대엔지니어링  힐스테이트 동인  선착순 계약 실시,Economic
57,쿠팡   직장 내 괴롭힘  주장에  사실 관계 왜곡 허위주장 묵과 않을 것 ,Economic
58,소상공인   명 중  명  위드 코로나 시행 긍정적 ,Economic
59,환경단체  수산보조금 폐지를  vs 수산업계  어업 말살시키는 것 ,Economic
60, 아직 재고 있다지만  산업계  요소수 대란 장기화할까  전전긍긍 ,Economic
61, 단독  DS네트웍스  쌍용건설 인수 추진,Economic
62, 기울어진 운동장  놓인 카드사  수수료율   인데 더 내린다고  ,Economic
63,코로나 이후 일자리   만개 증발     년 뒤에도 종업원 덜 쓴다 ,Economic
64, 점심 브리핑 비트코인      만원 돌파 또 최고가 경신   마스터카드  암호화폐 결제카드 출시,Economic
65,신한서부티엔디리츠  초대형 복합형 리츠로 도약 내달 코스피 상장,Economic
66,SK 채용 지원자     명 개인정보 유출  머리 숙여 사과 ,Economic
67,KB식 전세대출     분할상환  은행권 확산될까  촉각 ,Economic
68,돈뿌리기 돌입한 대선 재정건전성 논의는 안갯속,Economic
69,사장 갑질도 모자라 아들에 동생까지 회삿돈 꿀꺽 얌체 사주 일가   여명에 국세청  철퇴 ,Economic
70,SH공사  김헌동의  반값 아파트  공급 확대한다,Economic
71,김헌동 SH 사장 후보자  강남에   평대  억짜리 아파트 짓겠다 ,Economic
72,한국거래소  액티브 ETF 규제 완화 추진 상관계수 기준 낮춘다 ,Economic
73,SK 입사지원자      여 명 개인정보 유출  머리숙여 사과 ,Economic
74,정부  민간 수입업체 보관 차량용 요소  천 톤 확인,Economic
75,현대중공업  신의 방패  이지스함   번함 수주,Economic
76,정부  요소수 긴급 수급 조정조치 이번 주내 시행,Economic
77,SK 입사지원자  천   여명 개인정보 유출  머리숙여 사과  종합 ,Economic
78, 증시이슈  에코프로비엠  양극재 생산능력 확대에   대 상승세,Economic
79, 분기도 역대 최대실적 신세계  오프라인 혁신 통했다,Economic
80, 백화점 리뉴얼 효과  신세계   분기 영업익     억 분기 사상 최대 종합 ,Economic
81,비트코인     만원 이더리움    만원 돌파 사상 최고가,Economic
82,PEF  오너 갈등   이번엔  오렌즈  스타비젼서 터졌다,Economic
83,개발 대신  주거복지 전문 으로   SH    대 혁신  추진한다,Economic
84,한달 앞둔 요소수발 교통대란 대목 두고 속 타는  전세버스 ,Economic
85, 은행이  갑   서민 피해  대출금리 급등에  청원 등장,Economic
86, 스타트업  뮤직카우 정현경 창업가의  직관 과  몸빵 론,Economic
87, 코인뉴스  비트코인   한 번도 경험 못한 고점      만원 돌파,Economic
88,신세계   분기 매출  조  천   억 분기 사상 최대 기록,Economic
89,내년에 또 재난지원금 받나   내년 예산안에 반영,Economic
90, 카지노 호텔 동반 회복세  파라다이스  분기  흑자전환 ,Economic
91, 보관 중인 요소  천t 확인  이번 주  긴급수급조정조치  시행,Economic
92,     세 미만 현금 쿠폰 총    만원 지급      조 부양책 추진,Economic
93,화장품 대리점  곳중에  곳  판매목표 강요 받아,Economic
94,수도권 상위     아파트  대출 금지선    억원 뚫어,Economic
95,정부  수입업체 보관 요소  천톤 확보 사재기 업체  곳도 고발,Economic
96, 죽음의 호수 로 변한 새만금호     이하 아무것도 못 살아 ,Economic
97,요소수 매점매석 단속 첫날  수입업체 쌓아둔 요소     톤 찾았다,Economic
98,회삿돈으로 사치생활 통행세까지 국세청  대기업 세무조사 착수,Economic
99,비덴트  빗썸 매각에서 지분 확대 기류로  협업 확대 ,Economic
100,강원도 아파트 원정 매매 기승 비규제지역 몰린 투자수요,Economic
101,소비심리 회복 신세계   분기 매출 영업이익  역대 최대 ,Economic
102,메타버스 ETF  한국이 원조 미국보다 맛집이네,Economic
103, 멈추는거 처음 봤어요  불꺼진 석포제련소를 주민들이 밝힌 이유,Economic
104,미국 반도체 자료 요구 삼성 SK도 제출,Economic
105, 명품의 힘  신세계   분기 사상 최대 매출 영업이익,Economic
106, 합리적 분양가  돋보이는 브랜드 단지   창원 무동 동원로얄듀크  분양 앞둬,Economic
107,코로나 여파   년  일자리   만개 사라진다,Economic
108, 비트코인 지금      만원 넘었다 사상 최고가 경신,Economic
109,브랜드엑스코퍼레이션  방탄소년단 소속사 하이브 CB에    억원 투자,Economic
110, 카지노 호텔 동반 회복세  파라다이스  분기  흑자전환 ,Economic
111,건산연  차기 정부  재건축 재개발 규제 완화해야 ,Economic
112,현대중공업      톤급 차세대 이지스함  번함 수주,Economic
113,회삿돈으로 고가주택 슈퍼카 등 이용 구입   사주 일가 등   명 세무조사,Economic
114,정은보 금감원장  금감원 재량적 판단 결정  법과 원칙 우선할 수 없어 ,Economic
115, 오렌지카운티 병점역  이달 분양 예정,Economic
116,포스코 현대 대우건설  정비사업 왕좌 놓고 막판 수주 사활,Economic
117,삼성전자 디스플레이 이어 삼성전기 사내 방역지침 완화,Economic
118, 대출 제한으로  된 금융기관 금리  배 올려 폭리 취해  청원,Economic
119,삼성전자  가장 빠른  모바일 디램  개발 메타버스 등 최적,Economic
120, 변동장엔 금  금 거래량 지난해보다    증가,Economic
121,롯데케미칼  하루 만에 목표주가 하향 보고서  개 쏟아졌다,Economic
122, 조원 차이 셀트리온헬스케어 vs 에코프로비엠 코스닥 시총  위 경쟁 격화,Economic
123,  메타버스 선두주자 네이버  최대 실적에도  횡보    대장주 로블럭스는 ,Economic
124,서울은 한산한데  외곽은 불   장  뚜렷해진 초양극화 장세  부동산    ,Economic
125,쿠팡  직장 내 괴롭힘 관련 허위 주장 묵과하지 않을 것 ,Economic
126, Q 웃었지만 칼텍스가 또 GS 허태수호  체질개선 고민 여전,Economic
127,일본이 수출 규제한 포토레지스트 국산화 성공,Economic
128,윤송아 NFT 미술품  억원 낙찰 NFT 작품 보장 보험 등장 가능성은,Economic
129,신세계  역대  분기 최대 매출 영업이익 달성,Economic
130,화장품 기계 대리점  곳 중  곳  공급업자가 판매 목표 강제 ,Economic
131,건산연  차기 정부  재건축 재개발 규제 완화해야 ,Economic
132,현대중공업      톤급 차세대 이지스함  번함 수주,Economic
133,회삿돈으로 고가주택 슈퍼카 등 이용 구입   사주 일가 등   명 세무조사,Economic
134,정은보 금감원장  금감원 재량적 판단 결정  법과 원칙 우선할 수 없어 ,Economic
135, 오렌지카운티 병점역  이달 분양 예정,Economic
136,포스코 현대 대우건설  정비사업 왕좌 놓고 막판 수주 사활,Economic
137,롯데GFR 카파 까웨 리론칭 정준호 대표   년 내 매출     억 목표 ,Economic
138,금리인상에 변동 고정 금리차  배 확대,Economic
139, 증시 뜨거운데 코스피는 미지근  기초체력 한계 여전 ,Economic
140, 단독 스타벅스  배달 영토 비수도권까지 부산  개 매장서 시작,Economic
141,코윈테크  수주잔고     억대 돌파 총    억원 규모 수주,Economic
142,회삿돈으로 슈퍼카 타고 미술품 재테크 동생 회사엔  통행세 ,Economic
143, 주식 팔까  머스크 입방정   바이든은 핑계  다른 속셈 있었다,Economic
144, 뉴스초점  삼성 SK  미국에 반도체 정보 제출  민감 정보 제외 ,Economic
145, 코인브리핑  비트코인 이더리움 나란히 신고가,Economic
146, 억 리무진 굴리고 자녀회사 일감몰아준   명 세무조사,Economic
147,동부건설   여주역 센트레빌 트리니체  청약 두 자릿수 경쟁률로 흥행,Economic
148,실손보험 적자라는데    만명이     만원 이상 받았다,Economic
149,   분기 제조업 공급 증가세 둔화 수입 비중 첫     돌파,Economic
150,포스코   세계에서 가장 경쟁력 있는 철강사    년 연속  위,Economic
151, fn종목 돋보기  넥스턴바이오  당뇨 완치 목표로 신약개발 사업   L O 추진,Economic
152,이스타항공  성정과 매각절차 진행중  차순위 광림  대기 ,Economic
153, fn종목 돋보기  비아트론  메타버스 환경서 반도체 수혜 부각   FC BGA 투자 확대,Economic
154,     억대  성남  가천대역 더포엠  조합원 모집,Economic
155, 사상최고가  비트코인   억원 현실 될까,Economic
156,신규 확진      명 엿새 연속 감소세,Economic
157,또 사상 최고가 경신한 비트코인 한때     만원 돌파,Economic
158, 요소수 대란  대형버스업계도 연말 못 넘긴다 종합 ,Economic
159, 집주인과 말이 안 통해요   외국인 부동산 쇼핑 올해     만건  역대 최고,Economic
160, 한 달도 못 버텨  요소수 품귀에 시멘트 레미콘 업계  셧다운  우려,Economic
161,고승범  신평사  국가부채보다 가계부채 문제삼을 것 ,Economic
162, 치솟는 금리 막아주세요  청와대 청원 등장,Economic
163,쿠팡  민노총  직장 괴롭힘  주장 정면 반박  사실왜곡 묵과 않겠다 ,Economic
164, 시세조정 고발 거래소 감사  돌입한 당국 증권업계  긴장 ,Economic
165,네이버 카카오  AI 클라우드 개발자  싹쓸이 ,Economic
166,삼성전자  가장 빠른 모바일 D램 개발  초에 FHD급 영화   편 처리,Economic
167,근무 안했는데 수십억 연봉   대기업 사주일가  편법   대물림 ,Economic
168, 요소수  만    t  통관대기 잡혀있다  이것만 풀려도 숨통 ,Economic
169, 코로나 호황  기업에서 수백억 퇴직금에 사치품 유용한 사주일가,Economic
170,사익 편취 부 편법 대물림  국세청  대기업 사주일가   명 세무조사,Economic
171,한샘 현대리바트   분기 실적 주춤 성장세 회복 전략은,Economic
172, 씨티   한국 철수에 최대  조    억 지출 ,Economic
173, 시그니처 광교  차  지식산업센터 기업 사옥으로 주목,Economic
174,   규제에 반사이익 인도펀드 수익률  독주 ,Economic
175,국민   명중  명 이상  코로나  시대 디지털 소비 ,Economic
176, 달러당     원   환율 시스템 오류 해프닝에  발칵 ,Economic
177,기업 사유화에  콜옵션  편법 증여까지 대기업 사주 등   명 세무조사,Economic
178,요소수 부족   소규모 업체 더 심각  대중교통까지 차질 빚을까 ,Economic
179, 주먹구구  분상제 개선 분양가 오를까 내릴까,Economic
180,고가 전세대출 보증 제한할까 서울 아파트 경매 호황  식후땡 부동산 ,Economic
181,건설업계  임대차 법 유예하고 주택보유세 줄여야    차기 정부 과제 제안,Economic
182,왕숙만 몰렸다 뚝 떨어진  차 사전청약 경쟁률 왜 ,Economic
183,씨티은행 희망퇴직자 최대  억원 받는다   철수에    조 투입,Economic
184,놀면서 수십억 연봉 받고 탈세   명 긴급 세무조사,Economic
185,테이퍼링은 시작됐고  금리인상 내년  연준에  매 들이 난다,Economic
186,재미없으면 발길  뚝   놀이터 만들자  매장은 변신 중  언박싱 ,Economic
187, 초동시각  부동산  존버족 은 승리할 것인가,Economic
188,편법적 부의 대물림  대기업 사주일가    명 세무조사,Economic
189, 코로나 호황  기업에서 수백억 퇴직금에 사치품 유용한 사주일가,Economic
190,사익 편취 부 편법 대물림  국세청  대기업 사주일가   명 세무조사,Economic
191,한샘 현대리바트   분기 실적 주춤 성장세 회복 전략은,Economic
192, 씨티   한국 철수에 최대  조    억 지출 ,Economic
193, 시그니처 광교  차  지식산업센터 기업 사옥으로 주목,Economic
194,   규제에 반사이익 인도펀드 수익률  독주 ,Economic
195,국민   명중  명 이상  코로나  시대 디지털 소비 ,Economic
196, 달러당     원   환율 시스템 오류 해프닝에  발칵 ,Economic
197,기업 사유화에  콜옵션  편법 증여까지 대기업 사주 등   명 세무조사,Economic
198,요소수 부족   소규모 업체 더 심각  대중교통까지 차질 빚을까 ,Economic
199, 주먹구구  분상제 개선 분양가 오를까 내릴까,Economic
200,고가 전세대출 보증 제한할까 서울 아파트 경매 호황  식후땡 부동산 ,Economic
201,건설업계  임대차 법 유예하고 주택보유세 줄여야    차기 정부 과제 제안,Economic
202,왕숙만 몰렸다 뚝 떨어진  차 사전청약 경쟁률 왜 ,Economic
203,씨티은행 희망퇴직자 최대  억원 받는다   철수에    조 투입,Economic
204,놀면서 수십억 연봉 받고 탈세   명 긴급 세무조사,Economic
205,테이퍼링은 시작됐고  금리인상 내년  연준에  매 들이 난다,Economic
206,재미없으면 발길  뚝   놀이터 만들자  매장은 변신 중  언박싱 ,Economic
207, 초동시각  부동산  존버족 은 승리할 것인가,Economic
208,편법적 부의 대물림  대기업 사주일가    명 세무조사,Economic
209, 코로나 호황  기업에서 수백억 퇴직금에 사치품 유용한 사주일가,Economic
210,사익 편취 부 편법 대물림  국세청  대기업 사주일가   명 세무조사,Economic
211,한샘 현대리바트   분기 실적 주춤 성장세 회복 전략은,Economic
212, 씨티   한국 철수에 최대  조    억 지출 ,Economic
213, 시그니처 광교  차  지식산업센터 기업 사옥으로 주목,Economic
214,   규제에 반사이익 인도펀드 수익률  독주 ,Economic
215,국민   명중  명 이상  코로나  시대 디지털 소비 ,Economic
216,소상공인   명 중  명  위드코로나 긍정적  매출 회복은  아직 ,Economic
217,포스코   세계 최고 철강사    년 연속  위 올랐다,Economic
218,삼성전자  업계 첫   나노미터 공정 적용 모바일용 D램 개발,Economic
219, 비축량까지 푼다지만  장비 가동중단   운송 포기  속출,Economic
220, 카뱅  주가 추락에 홍콩 PE  지분 담보로     억  회수,Economic
221,아마존이 점찍은 리비안  상장 후  제 의 테슬라  될까,Economic
222,DSR규제 피해 내집마련 수요 올해 몰린다  힐스테이트 오룡  수요자 눈독,Economic
223, 자본시장 끝난다  머스크가 쏘아올린 억만장자세 논란,Economic
224, 스우파 레깅스  운영사가 BTS 소속사에 투자하는 이유,Economic
225,코로나 때 번 돈으로 슈퍼카 별장 대기업 사주일가 탈세조사,Economic
226,SK  입사지원자 개인정보 노출  머리 숙여 사과  관련 기관에 신고 ,Economic
227, 콜옵션 CB  악용 대물림 세무조사 받는다 시행사로 자녀 편법 지원한 건설사  곳도 대상,Economic
228,소상공인   명 중  명  위드 코로나 시행 긍정적 ,Economic
229,회삿돈 독식  자녀엔 일감 몰빵 사주   명 세무조사,Economic
230,KDI  코로나 고용 충격  재택근무 어려운 쪽에 더 심해 ,Economic
231,통행세 이익 수천억원 자녀회사에 몰아준 사주일가 세무조사,Economic
232,  대 주식 현금 증여   대 일감몰아주기   대 고액급여 배당  그렇게 금수저가 된다 ,Economic
233,국세청  대기업 중견기업  오너 일가    명 탈세 조사 착수,Economic
234, 필요하다면 국방물자생산법 사용  반도체 자료 받은    다음 스텝은,Economic
235,화장품 대리점  곳 중  곳  본사가 판매 목표 강제했다 ,Economic
236,손병두 거래소 이사장  메타버스ETP 등 다양한 상품 내놓을 것  종합 ,Economic
237, 기 신도시도  유령  계열사 내세운  벌떼 입찰  우려  정부서 근본 해결책을   호소  일상톡톡 플러스 ,Economic
238,레깅스로 대박난 이 회사 BTS 소속사에    억 통 큰 투자한다,Economic
239,휘발유 평균가  당  천   원 넘어 정유업계  유류세 인하 즉각 반영 ,Economic
240,공정위  생활용품 화장품 등  개 업종  대리점 갑질  상당수 ,Economic
241,반도체 부족 영향 본격화  분기   국내공급        뚝 ,Economic
242,소상공인들  손실보상 제외업종 지원금 지급  가장 원해,Economic
243,소상공인   명 중  명  위드 코로나 시행 긍정적 ,Economic
244,소상공인   명 중  명  위드 코로나 시행 긍정적 ,Economic
245,출근도 안 한 사주 일가에 수십억 급여 고급 리조트 준 대기업,Economic
246,화장품 대리점      공급업자로부터 판매목표 강제 당해 ,Economic
247,소상공인   위드코로나 경기는 아직  쌀쌀  매출 회복 안돼 ,Economic
248,국내서 팔린 제조업 제품 수입 비중 첫     돌파  역대 최대 ,Economic
249,일 안하고 월급받고  내부정보로 주식투자 사주 일가   명 세무조사,Economic
250,회삿돈으로 슈퍼카에 호화리조트까지    부모찬스  탈세 덜미,Economic
251,상장 몸값 띄워야 하는데 CJ올리브영  발목  잡는  사업,Economic
252,모바일 D램도  삼성 초격차  업계 최초 저전력 DDR X 개발,Economic
253, 오징어게임  열풍에 비행기 타는  달고나  몽골 말레이시아  CU 에  만개 풀린다,Economic
254, 한우 반값 행사 계속 할게요   밥상물가 낮추기 나선 한우농가,Economic
255,지하철 가천대역 도보권에 아파트    가구 조성,Economic
256, 수도권 상위     아파트값    억 넘어   현 정부 들어  배   ,Economic
257,홈쇼핑 여행사  위드 코로나에 국내외 여행상품 잇따라 판매,Economic
258,이스타항공  성정이 인수포기  사실무근 ,Economic
259,음성 메추리 농장 덮친 AI 공포  개월만에 또   만마리 살처분,Economic
260,홍남기  탄소중립 세부 계획 마련 중 일부 연말 발표 ,Economic
261,힘받는 SK하이닉스   개월만에   만원  터치  외인도 올라탔다,Economic
262,머지포인트 사태  분쟁조정 사상 최대 규모 기록,Economic
263,위중증 환자 증가 비상   일만에 최다,Economic
264,요소수 대란 산업계 전반으로  재고는 한달치뿐 ,Economic
265,주가 빠질 때 지분 늘리자 일양 유유제약    세 행보 눈길,Economic
266,코로나 백신 이어 치료제도 화이자 등이 주도 기대컸던  K 바이오  아직도  추격자  처지,Economic
267,  멈추는데    지나친 불안감 갖지 말라 ,Economic
268, 김건희 연루 의혹  도이치모터스 주가조작 가담자 추가 기소,Economic
269,손병두  메타버스 전기차 ETP 등 상품 다양화할 것 ,Economic
270,자고 일어나면 오르는 대출금리 좀 멈출까 은행채 금리 하락세,Economic
271,비트코인 이더리움 최고가 테슬라는  천백슬라 로 급락,Economic
272,머스크 트윗에 주가    가까이 급락 머스크 악재 vs  펩시코 호재,Economic
273,택배업계  요소수 대란 인데  할 수 있는게 없다 정부가 불안감 조성 ,Economic
274,코로나 강제휴직 승무원 극단 선택  산재  첫 인정,Economic
275, 역대급 사은품 푼다  SK스토아  LG트롬 건조기 세탁기 단독조건 판매,Economic
276, 반도체 배터리 공급망 재편   기업비밀 보호를 ,Economic
277,유럽바이오 품은 CJ제일제당 분기매출 사상 첫  조원 돌파,Economic
278, 겨울 골프는 치앙마이지  ,Economic
279,   요소수 물량확보 총력  판매 사기  기승 ,Economic
280,SK  SKCT 인적성시험서 개인정보     건 노출 사고,Economic
281,   반도체 공급난  내후년까지  현대차는  일요일 특근  노노 갈등,Economic
282,   탄소배출권거래제 도입 철강산업 등에 영향 ,Economic
283,KT  분기 영업익      통신 플랫폼  쌍끌이  종합 ,Economic
284, 대한민국 숙박대전  재개 할인쿠폰 받으려면 ,Economic
285,삼성 SK  반도체 자료 제출 민감한 정보 제외 ,Economic
286, 바이오 매출  조 돌파  CJ제일제당  미래사업 성과 가시화되나,Economic
287,원자재 가격 뛰는 데 세금 부담까지 높아지는  촉매 귀금속 관세 폐지  목소리,Economic
288, 김건희 연루 의혹  도이치모터스 주가조작 가담자 추가 기소,Economic
289,손병두  메타버스 전기차 ETP 등 상품 다양화할 것 ,Economic
290,자고 일어나면 오르는 대출금리 좀 멈출까 은행채 금리 하락세,Economic
